title,description,content,text_for_analysis,url,published_at,source,author,image_url
"Texas teen's death linked to caffeine in Alani Nu energy drink, family alleges in lawsuit","The family of a 17-year-old Texas cheerleader has filed a wrongful death lawsuit against a distributor of a popular energy drink, saying the teenager died from an enlarged heart caused by ingesting large amounts of caffeine.","The family of a 17-year-old Texas cheerleader has filed a wrongful death lawsuit against a distributor of a popular energy drink, saying the teenager died from an enlarged heart caused by ingesting l… [+5594 chars]","Texas teen's death linked to caffeine in Alani Nu energy drink, family alleges in lawsuit The family of a 17-year-old Texas cheerleader has filed a wrongful death lawsuit against a distributor of a popular energy drink, saying the teenager died from an enlarged heart caused by ingesting large amounts of caffeine. The family of a 17-year-old Texas cheerleader has filed a wrongful death lawsuit against a distributor of a popular energy drink, saying the teenager died from an enlarged heart caused by ingesting l… [+5594 chars]",https://www.nbcnews.com/news/us-news/texas-teens-death-linked-caffeine-alani-nu-energy-drink-family-alleges-rcna267441,2026-04-10T03:03:51+00:00,NBC News,"Daniella Silva, Marlene Lenthang","https://media-cldnry.s-nbcnews.com/image/upload/t_nbcnews-fp-1200-630,f_auto,q_auto:best/rockcms/2026-04/260409-Larissa-Nicole-Rodriguez-ew-1053p-57573c.jpg"
"The iPhone Air was our most polarising phone of 2025, but this 28% discount makes it an easy recommendation","TechRadar’s international team of experts were split on the thin and light iPhone Air, but we can all agree it’s the better buy when it’s cheaper than the 256GB iPhone 17.","Not long after the thin and light iPhone Air was launched in September, we crowned it the Phone of the Year for 2025 — not because it was the best phone ever, but because it was the most talked about… [+2458 chars]","The iPhone Air was our most polarising phone of 2025, but this 28% discount makes it an easy recommendation TechRadar’s international team of experts were split on the thin and light iPhone Air, but we can all agree it’s the better buy when it’s cheaper than the 256GB iPhone 17. Not long after the thin and light iPhone Air was launched in September, we crowned it the Phone of the Year for 2025 — not because it was the best phone ever, but because it was the most talked about… [+2458 chars]",https://www.techradar.com/phones/iphone/the-iphone-air-was-our-most-polarising-phone-of-2025-but-this-28-percent-discount-makes-it-an-easy-recommendation,2026-04-10T01:57:27+00:00,TechRadar,"nico.arboleda@futurenet.com (Nico Arboleda) , Nico Arboleda",https://cdn.mos.cms.futurecdn.net/NTLyJysXDWXetFwNKs4kWG-2000-80.jpg
Why Senior Engineers Choose Boring Go Over Exciting Rust,How a $3.2M production disaster taught us that technical excellence doesn’t always align with business success — and why boring… How a $3.2M production disaster taught us that technical excellence doesn’t always align with business success — and why boring te…,"How a $3.2M production disaster taught us that technical excellence doesnt always align with business success and why boring 
Why Senior Engineers Choose Boring Go Over Exciting Rust
How a $3.2M pr… [+17909 chars]",Why Senior Engineers Choose Boring Go Over Exciting Rust How a $3.2M production disaster taught us that technical excellence doesn’t always align with business success — and why boring… How a $3.2M production disaster taught us that technical excellence doesn’t always align with business success — and why boring te… How a $3.2M production disaster taught us that technical excellence doesnt always align with business success and why boring Why Senior Engineers Choose Boring Go Over Exciting Rust How a $3.2M pr… [+17909 chars],https://dev.to/speed_engineer/why-senior-engineers-choose-boring-go-over-exciting-rust-lod,2026-04-10T01:36:48+00:00,Dev.to,speed engineer,"https://media2.dev.to/dynamic/image/width=1200,height=627,fit=cover,gravity=auto,format=auto/https%3A%2F%2Fdev-to-uploads.s3.amazonaws.com%2Fuploads%2Farticles%2Fb0m8ndez2s8bezjq5frj.png"
How to Optimize Your Recovery After a Stroke,"A New Series of Health Insights Is on the Way




IMPORTANT


A New Series of Health Insights Is on the Way

Our team has been working behind the scenes to prepare new research and practical health strategies for our readers. While we finish preparing wha…","A New Series of Health Insights Is on the Way
Bob Dennis, Ph.D., a biomedical engineer by profession, is also the author of ""Stroke of Luck: Master Neuroplasticity for Recovery and Growth After Stro… [+15749 chars]","How to Optimize Your Recovery After a Stroke A New Series of Health Insights Is on the Way IMPORTANT A New Series of Health Insights Is on the Way Our team has been working behind the scenes to prepare new research and practical health strategies for our readers. While we finish preparing wha… A New Series of Health Insights Is on the Way Bob Dennis, Ph.D., a biomedical engineer by profession, is also the author of ""Stroke of Luck: Master Neuroplasticity for Recovery and Growth After Stro… [+15749 chars]",https://articles.mercola.com/sites/articles/archive/2026/04/10/neuroplasticity-stroke-rehabilitation.aspx,2026-04-10T00:00:00+00:00,Mercola.com,Dr. Mercola,https://media.mercola.com/ImageServer/Public/2024/August/FB/neuroplasticity-stroke-rehabilitation-fb.jpg
"NFL under federal investigation for potential anticompetitive practices, AP source says","The Justice Department is investigating the NFL for potential anticompetitive practices, according to a government official. It comes amid increasing federal scrutiny of the amount of money fans are paying to watch sports on television.","The Justice Department is investigating the NFL for potential anticompetitive practices, according to a government official.
The official, who was not authorized to discuss an ongoing investigation … [+4738 chars]","NFL under federal investigation for potential anticompetitive practices, AP source says The Justice Department is investigating the NFL for potential anticompetitive practices, according to a government official. It comes amid increasing federal scrutiny of the amount of money fans are paying to watch sports on television. The Justice Department is investigating the NFL for potential anticompetitive practices, according to a government official. The official, who was not authorized to discuss an ongoing investigation … [+4738 chars]",https://www.pbs.org/newshour/nation/nfl-under-federal-investigation-for-potential-anticompetitive-practices-ap-source-says,2026-04-09T23:36:46+00:00,PBS,"Joe Reedy, Associated Press, Eric Tucker, Associated Press",https://d3i6fh83elv35t.cloudfront.net/static/2026/04/2026-01-28T035545Z_1390051219_MT1USATODAY28100192_RTRMADP_3_NCAA-FOOTBALL-EAST-WEST-SHRINE-BOWL-1024x683.jpg
Futures: Trump Issues Hormuz Threat; Amazon Fuels AI Trade - Investor's Business Daily,"Futures: Trump Issues Hormuz Threat; Amazon Fuels AI TradeInvestor's Business Daily Stock Market Today: Dow Gains; Oil Rebounds After Iran Cease-Fire Gets Off to Shaky Start — Live UpdatesWSJ S&P 500, Nasdaq Extend Win Streaks Amid Ceasefire Hopes; 3 New Brea…",The Fine Print: The following comments are owned by whoever posted them. We are not responsible for them in any way.,"Futures: Trump Issues Hormuz Threat; Amazon Fuels AI Trade - Investor's Business Daily Futures: Trump Issues Hormuz Threat; Amazon Fuels AI TradeInvestor's Business Daily Stock Market Today: Dow Gains; Oil Rebounds After Iran Cease-Fire Gets Off to Shaky Start — Live UpdatesWSJ S&P 500, Nasdaq Extend Win Streaks Amid Ceasefire Hopes; 3 New Brea… The Fine Print: The following comments are owned by whoever posted them. We are not responsible for them in any way.",https://slashdot.org/firehose.pl?op=view&amp;id=181508624,2026-04-09T23:32:52+00:00,Slashdot.org,feedfeeder,
Radically modular inflatable tent grows wheels and redefines 'towing',"Over the years, we've seen a number of RV innovators develop lightweight, small-packing camping trailers with inflatable living areas, from the roomy Air Opus to the pinchably adorable Booba trailer. The new ToW trailer starts from the other direction, coming…","Over the years, we've seen a number of RV innovators develop lightweight, small-packing camping trailers with inflatable living areas, from the roomy Air Opus to the pinchably adorable Booba trailer.… [+6941 chars]","Radically modular inflatable tent grows wheels and redefines 'towing' Over the years, we've seen a number of RV innovators develop lightweight, small-packing camping trailers with inflatable living areas, from the roomy Air Opus to the pinchably adorable Booba trailer. The new ToW trailer starts from the other direction, coming… Over the years, we've seen a number of RV innovators develop lightweight, small-packing camping trailers with inflatable living areas, from the roomy Air Opus to the pinchably adorable Booba trailer.… [+6941 chars]",https://newatlas.com/camping-trailers/karsten-tent-on-wheels/,2026-04-09T23:03:00+00:00,New Atlas,C.C. Weiss,https://assets.newatlas.com/dims4/default/da8c9d5/2147483647/strip/true/crop/2048x1075+0+230/resize/1200x630!/quality/85/?url=https%3A%2F%2Fnewatlas-brightspot.s3.amazonaws.com%2F4c%2F52%2F2f0f48cf4ec998e83167df789382%2Fimg-3310-1.jpeg&na.image_optimisation=0
U.S. Justice Department reportedly opens investigation into NFL for potential anticompetitive practices,"The Justice Department is investigating the NFL for potential anticompetitive practices, according to a government official. The official said the investigation is ""about affordability for consumers and creating an even playing field for providers.""","The Justice Department is investigating the NFL for potential anticompetitive practices, according to a government official.
The official, who was not authorized to discuss an ongoing investigation … [+4663 chars]","U.S. Justice Department reportedly opens investigation into NFL for potential anticompetitive practices The Justice Department is investigating the NFL for potential anticompetitive practices, according to a government official. The official said the investigation is ""about affordability for consumers and creating an even playing field for providers."" The Justice Department is investigating the NFL for potential anticompetitive practices, according to a government official. The official, who was not authorized to discuss an ongoing investigation … [+4663 chars]",https://www.cbc.ca/sports/football/nfl/nfl-investigation-potential-anticompetitive-practices-9.7158401,2026-04-09T22:25:43+00:00,CBC News,,"https://i.cbc.ca/ais/21d908d3-fce5-4b0d-bc82-1df9ae098a9a,1775773168236/full/max/0/default.jpg?im=Crop%2Crect%3D%280%2C216%2C4038%2C2271%29%3BResize%3D620"
Agentic Payments In B2C Commerce: Where We Are Now,In November we answered five questions on the state of agentic payments and provided a key timeline of critical announcements up to that point. It's time to take a fresh look.,In November we answered five questions on the state of agentic payments and provided a key timeline of critical announcements up to that point. It’s time to take a fresh look. To summarize the bigges… [+11097 chars],Agentic Payments In B2C Commerce: Where We Are Now In November we answered five questions on the state of agentic payments and provided a key timeline of critical announcements up to that point. It's time to take a fresh look. In November we answered five questions on the state of agentic payments and provided a key timeline of critical announcements up to that point. It’s time to take a fresh look. To summarize the bigges… [+11097 chars],https://www.forrester.com/blogs/agentic-payments-in-b2c-commerce-where-we-are-now/,2026-04-09T22:06:45+00:00,Forrester.com,Lily Varon,https://go.forrester.com/wp-content/uploads/2022/03/FMK_FORR_GenericSocialImage_220314.jpg
"Save Up to 45% on Beds, Toys, Treats, Litter & Pet Essentials at Amazon Canada","Keeping pets happy, comfortable, and entertained can add up fast, which is exactly why Amazon Canada’s latest pet deals with up to 45% off are worth a look right now. The deals page is packed with savings across beds, toys, treats, litter, feeders, grooming t…","Keeping pets happy, comfortable, and entertained can add up fast, which is exactly why Amazon Canadas latest pet deals with up to 45% off are worth a look right now. The deals page is packed with sav… [+2604 chars]","Save Up to 45% on Beds, Toys, Treats, Litter & Pet Essentials at Amazon Canada Keeping pets happy, comfortable, and entertained can add up fast, which is exactly why Amazon Canada’s latest pet deals with up to 45% off are worth a look right now. The deals page is packed with savings across beds, toys, treats, litter, feeders, grooming t… Keeping pets happy, comfortable, and entertained can add up fast, which is exactly why Amazon Canadas latest pet deals with up to 45% off are worth a look right now. The deals page is packed with sav… [+2604 chars]",https://www.redflagdeals.com/deal/home-garden/save-up-to-45-on-beds-toys-treats-litter-pet-essentials-at-amazon-canada/,2026-04-09T21:31:40+00:00,redflagdeals.com,Kari Erickson,https://x.dam-img.rfdcontent.com/offers/014/173/449/600x600_smart_fit.jpg
How to watch Aintree Races for free — live stream Grand National 2026 from anywhere,Hold onto your hats and place your bets: here's how to watch Aintree Races for free from anywhere in the world as the sport of kings heads to Aintree for the Grand National weekend.,Aintree hosts the Grand National this weekend (9-11 April) but there's plenty of horse racing to come before the blue ribband event at one of the hottest weekends in the horse racing calendar – and y… [+4683 chars],How to watch Aintree Races for free — live stream Grand National 2026 from anywhere Hold onto your hats and place your bets: here's how to watch Aintree Races for free from anywhere in the world as the sport of kings heads to Aintree for the Grand National weekend. Aintree hosts the Grand National this weekend (9-11 April) but there's plenty of horse racing to come before the blue ribband event at one of the hottest weekends in the horse racing calendar – and y… [+4683 chars],https://www.techradar.com/how-to-watch/horse-racing/how-to-watch-aintree-races-for-free,2026-04-09T21:29:58+00:00,TechRadar,Tom Bailey,https://cdn.mos.cms.futurecdn.net/mLAaKvsmxMH9sSN5fhX2Fh-2555-80.jpg
The best cat scratching posts,"After testing nine cat scratching posts with two cats, I found the most durable, stable options that kept them coming back.","If your cat were out in the wild, they'd naturally sharpen their claws on trees and other sturdy surfaces. Scratching is a natural behavior, so providing something that mimics that experience indoors… [+17965 chars]","The best cat scratching posts After testing nine cat scratching posts with two cats, I found the most durable, stable options that kept them coming back. If your cat were out in the wild, they'd naturally sharpen their claws on trees and other sturdy surfaces. Scratching is a natural behavior, so providing something that mimics that experience indoors… [+17965 chars]",https://www.businessinsider.com/guides/pets/best-cat-scratching-posts,2026-04-09T21:25:41+00:00,Business Insider,"jmcgrath@insider.com (Jenny McGrath,Julie Liu, DVM)",https://i.insider.com/69d80d2005c9b303c4e76c2d?width=1200&format=jpeg
"Stock Market Today, April 9: Amazon Surges After CEO Details AI and AWS Growth Plans",,"If you click 'Accept all', we and our partners, including 251 who are part of the IAB Transparency &amp; Consent Framework, will also store and / or access information on a device (in other words, us… [+1046 chars]","Stock Market Today, April 9: Amazon Surges After CEO Details AI and AWS Growth Plans If you click 'Accept all', we and our partners, including 251 who are part of the IAB Transparency Consent Framework, will also store and / or access information on a device (in other words, us… [+1046 chars]",https://consent.yahoo.com/v2/collectConsent?sessionId=1_cc-session_ec8dd9b3-6e9e-40e4-8b56-12bc28c901ed,2026-04-09T21:05:06+00:00,Yahoo Entertainment,,
"As Amazon Takes on Chipmakers, Should You Buy AMZN Stock Here?",Amazon stock pushed higher as the company revealed plans of selling AI chips and announces $25 billion data center investment in Mississippi. Here’s why...,"Amazon (AMZN) shares ripped higher on Thursday after CEO Andy Jassy said the company could start selling artificial intelligence (AI) chips directly to third parties.
Adding to momentum on April 9 w… [+2798 chars]","As Amazon Takes on Chipmakers, Should You Buy AMZN Stock Here? Amazon stock pushed higher as the company revealed plans of selling AI chips and announces $25 billion data center investment in Mississippi. Here’s why... Amazon (AMZN) shares ripped higher on Thursday after CEO Andy Jassy said the company could start selling artificial intelligence (AI) chips directly to third parties. Adding to momentum on April 9 w… [+2798 chars]",https://www.barchart.com/story/news/1230176/as-amazon-takes-on-chipmakers-should-you-buy-amzn-stock-here,2026-04-09T20:49:00+00:00,Barchart.com,Wajeeh Khan,https://s.yimg.com/ny/api/res/1.2/kZCggDz7pJZGPaywOdGV7A--/YXBwaWQ9aGlnaGxhbmRlcjt3PTEyMDA7aD04MDA-/https://media.zenfs.com/en/barchart_com_477/53921926b0ea4c196011ac50e860a881
Andy Jassy Bets $200B on A.I. to Cement Amazon’s Tech Dominance,"Under Andy Jassy, Amazon is pouring $200 billion into A.I. infrastructure to dominate the cloud and secure its next decade of growth. With record spending, Jassy wants Amazon to define the global A.I. landscape before anyone else.","Andy Jassy, CEO of Amazon, is charging ahead on his A.I. ambitions. Photo by Andrej Sokolow/picture alliance via Getty Images
Amazon is going all in on A.I. and betting more money on it than anyone … [+3011 chars]","Andy Jassy Bets $200B on A.I. to Cement Amazon’s Tech Dominance Under Andy Jassy, Amazon is pouring $200 billion into A.I. infrastructure to dominate the cloud and secure its next decade of growth. With record spending, Jassy wants Amazon to define the global A.I. landscape before anyone else. Andy Jassy, CEO of Amazon, is charging ahead on his A.I. ambitions. Photo by Andrej Sokolow/picture alliance via Getty Images Amazon is going all in on A.I. and betting more money on it than anyone … [+3011 chars]",https://observer.com/2026/04/amazon-andy-jassy-defends-ai-spend/,2026-04-09T20:44:55+00:00,Observer,"Alexandra Tremayne-Pengelly, Alexandra Tremayne-Pengelly",https://observer.com/wp-content/uploads/sites/2/2026/04/GettyImages-2265246744.jpg?quality=80
Amazon CEO Andy Jassy highlights AI growth in annual shareholder letter,Shares of Amazon.com Inc. rose more than 5% today after chief executive Andy Jassy published his latest shareholder letter. The memo is the fifth that Jassy has penned since taking up the top post in 2021. Amazon’s first shareholder letter was written by foun…,"Shares of Amazon.com Inc. rose more than 5% today after chief executive Andy Jassy published his latest shareholder letter.
The memo is the fifth that Jassy has penned since taking up the top post i… [+5178 chars]",Amazon CEO Andy Jassy highlights AI growth in annual shareholder letter Shares of Amazon.com Inc. rose more than 5% today after chief executive Andy Jassy published his latest shareholder letter. The memo is the fifth that Jassy has penned since taking up the top post in 2021. Amazon’s first shareholder letter was written by foun… Shares of Amazon.com Inc. rose more than 5% today after chief executive Andy Jassy published his latest shareholder letter. The memo is the fifth that Jassy has penned since taking up the top post i… [+5178 chars],https://siliconangle.com/2026/04/09/amazon-ceo-andy-jassy-highlights-ai-growth-annual-shareholder-letter/,2026-04-09T20:43:28+00:00,SiliconANGLE News,Maria Deutscher,https://d15shllkswkct0.cloudfront.net/wp-content/blogs.dir/1/files/2026/04/aws-andy-jassy.jpg
Dept. of Justice sets sights on NFL's media rights deals,The DOJ is addressing whether the anti-trust exemption given to sports leagues for its TV deals to applies to streamers.,"The Dept. of Justice is investigating the NFL's media deals with streaming companies as more of its games go behind subscription pay walls.
The investigation first reported by the Wall Street Journa… [+4702 chars]",Dept. of Justice sets sights on NFL's media rights deals The DOJ is addressing whether the anti-trust exemption given to sports leagues for its TV deals to applies to streamers. The Dept. of Justice is investigating the NFL's media deals with streaming companies as more of its games go behind subscription pay walls. The investigation first reported by the Wall Street Journa… [+4702 chars],https://sports.yahoo.com/articles/dept-justice-sets-sights-nfls-203923006.html,2026-04-09T20:39:23+00:00,Yahoo Entertainment,Stephen Battaglio,https://s.yimg.com/os/en/la_times_articles_853/115d1d74a37b5571b142d0e514891907
The $200 Savings Hack Nobody Uses in Disney World…But YOU Should,Here are my best hacks for saving money in Disney World.,"We all know how expensive Disney World can be…but if you’re like me, you just HAVE to go as much as you can, right? But if you’re also like me and have a strict budget for your trip, you also need to… [+6595 chars]","The $200 Savings Hack Nobody Uses in Disney World…But YOU Should Here are my best hacks for saving money in Disney World. We all know how expensive Disney World can be…but if you’re like me, you just HAVE to go as much as you can, right? But if you’re also like me and have a strict budget for your trip, you also need to… [+6595 chars]",https://www.disneyfoodblog.com/2026/04/09/the-200-savings-hack-nobody-uses-in-disney-world-but-you-should/,2026-04-09T20:33:04+00:00,disneyfoodblog.com,Robin Burks,https://www.disneyfoodblog.com/wp-content/uploads/2024/09/featured-mickey-short-mickey-minnie-coin-700x444.png
What Netflix Has Been Up To Since Losing Bid For Warner Bros. Discovery,Netflix announced it was raising prices as well as continuing to invest heavily in more content after dropping its bid for rival Warner Bros. Discovery in February.,"Netflix announced it was raising prices and continuing to invest heavily in more content after dropping its bid for rival Warner Bros. Discovery in February.
The world’s largest streaming service en… [+4480 chars]",What Netflix Has Been Up To Since Losing Bid For Warner Bros. Discovery Netflix announced it was raising prices as well as continuing to invest heavily in more content after dropping its bid for rival Warner Bros. Discovery in February. Netflix announced it was raising prices and continuing to invest heavily in more content after dropping its bid for rival Warner Bros. Discovery in February. The world’s largest streaming service en… [+4480 chars],https://dailycaller.com/2026/04/09/netflix-since-losing-bid-warner-bros-discovery/,2026-04-09T20:30:43+00:00,The Daily Caller,Ryan Meilstrup,"https://images.dailycaller.com/image/width=1280,height=549,fit=cover,format=webp,f=auto/https://cdn01.dailycaller.com/wp-content/uploads/2025/12/GettyImages-971177838-scaled-e1765229972727.jpg"
US stocks today: US stocks end higher as Middle East peace talks lift sentiment,"On Thursday, Indian markets experienced a surge in optimism, buoyed by positive movements in U.S. stocks as diplomatic talks reduced tensions in the Middle East. Key indexes made notable gains, even as crude oil prices experienced some volatility. Economic da…","U.S. stocks advanced on Thursday, as ongoing negotiations toward a peaceful resolution to the six-week Middle East conflict helped ease worries over the fragile U.S.-Iran truce. All three major U.S. … [+2344 chars]","US stocks today: US stocks end higher as Middle East peace talks lift sentiment On Thursday, Indian markets experienced a surge in optimism, buoyed by positive movements in U.S. stocks as diplomatic talks reduced tensions in the Middle East. Key indexes made notable gains, even as crude oil prices experienced some volatility. Economic da… U.S. stocks advanced on Thursday, as ongoing negotiations toward a peaceful resolution to the six-week Middle East conflict helped ease worries over the fragile U.S.-Iran truce. All three major U.S. … [+2344 chars]",https://economictimes.indiatimes.com/markets/us-stocks/news/us-stocks-today-us-stocks-end-higher-as-middle-east-peace-talks-lift-sentiment/articleshow/130153466.cms,2026-04-09T20:04:06+00:00,The Times of India,Reuters,"https://img.etimg.com/thumb/msid-130153466,width-1200,height-630,imgsize-243302,overlay-etmarkets/articleshow.jpg"
