title,description,content,text_for_analysis,url,published_at,source,author,image_url
"20VC x SaaStr: Anthropic Hit $30 Billion and Training Costs a Quarter of OpenAI’s, SpaceX Files at $1.75 Trillion, and Why the Big Three Will Dwarf Every IPO of the Last 25 Years Combined","With Harry Stebbings, Jason Lemkin, and Rory O’Driscoll Anthropic just hit $30 billion in annualized revenue. Up from $9 billion at the start of the year. That’s 3.3x growth in four months. It took Salesforce 25 years to get to $30 billion. Anthropic got ther…","With Harry Stebbings, Jason Lemkin, and Rory O’Driscoll
Anthropic just hit $30 billion in annualized revenue. Up from $9 billion at the start of the year. That’s 3.3x growth in four months. It took … [+22306 chars]","20VC x SaaStr: Anthropic Hit $30 Billion and Training Costs a Quarter of OpenAI’s, SpaceX Files at $1.75 Trillion, and Why the Big Three Will Dwarf Every IPO of the Last 25 Years Combined With Harry Stebbings, Jason Lemkin, and Rory O’Driscoll Anthropic just hit $30 billion in annualized revenue. Up from $9 billion at the start of the year. That’s 3.3x growth in four months. It took Salesforce 25 years to get to $30 billion. Anthropic got ther… With Harry Stebbings, Jason Lemkin, and Rory O’Driscoll Anthropic just hit $30 billion in annualized revenue. Up from $9 billion at the start of the year. That’s 3.3x growth in four months. It took … [+22306 chars]",https://www.saastr.com/20vc-x-saastr-anthropic-hit-30-billion-and-training-costs-a-quarter-of-openais-spacex-files-at-1-75-trillion-and-why-the-big-three-will-dwarf-every-ipo-of-the-last-25-years-combined/,2026-04-09T20:03:38+00:00,Saastr.com,Jason Lemkin,https://i0.wp.com/www.saastr.com/wp-content/uploads/2026/04/harry51-scaled.jpg?fit=1000%2C563&quality=70&ssl=1
Ever Wondered Why PC Buyers Are Getting ‘Lucky’ With Their Amazon Packages Recently? It’s a Fiasco That Has Annoyed Retailers,"While many of us rejoice when gamers get multiple RAM sticks despite ordering a single unit, this has been a nightmare for Amazon retailers, who, interestingly, cannot avoid it. Retailers Are 'Tired' By The Negligence of Amazon's Warehouse Staff, Saying That …","While many of us rejoice when gamers get multiple RAM sticks despite ordering a single unit, this has been a nightmare for Amazon retailers, who, interestingly, cannot avoid it.
We have noticed a ra… [+2649 chars]","Ever Wondered Why PC Buyers Are Getting ‘Lucky’ With Their Amazon Packages Recently? It’s a Fiasco That Has Annoyed Retailers While many of us rejoice when gamers get multiple RAM sticks despite ordering a single unit, this has been a nightmare for Amazon retailers, who, interestingly, cannot avoid it. Retailers Are 'Tired' By The Negligence of Amazon's Warehouse Staff, Saying That … While many of us rejoice when gamers get multiple RAM sticks despite ordering a single unit, this has been a nightmare for Amazon retailers, who, interestingly, cannot avoid it. We have noticed a ra… [+2649 chars]",https://wccftech.com/ever-wondered-why-pc-buyers-are-getting-lucky-with-their-amazon-packages-recently-its-a-fiasco-that-has-annoyed-retailers/,2026-04-09T19:45:02+00:00,Wccftech,Muhammad Zuhair,https://cdn.wccftech.com/wp-content/uploads/2026/04/GettyImages-969617042-amazon-amcare-robbinsville-web-1574809152-e1574809393341-1920x958.webp
"Justice Department is investigating the NFL for potential anticompetitive practices, AP source says","According to a government official, who spoke on condition of anonymity, said the investigation is “about affordability for consumers and creating an even playing field for providers.”","The Justice Department is investigating the NFL for potential anticompetitive practices, according to a government official.
The official, who was not authorized to discuss an ongoing investigation … [+4367 chars]","Justice Department is investigating the NFL for potential anticompetitive practices, AP source says According to a government official, who spoke on condition of anonymity, said the investigation is “about affordability for consumers and creating an even playing field for providers.” The Justice Department is investigating the NFL for potential anticompetitive practices, according to a government official. The official, who was not authorized to discuss an ongoing investigation … [+4367 chars]",https://sports.yahoo.com/articles/justice-department-investigating-nfl-potential-194430804.html,2026-04-09T19:44:30+00:00,Yahoo Entertainment,"Associated Press,Boston25NewsStaff",https://s.yimg.com/os/en/wfxt_cox_articles_703/27db6499406fe60f7bd29a9b60af742a
Micron Stock Rockets Toward $420 on Explosive AI Memory Demand and Record Q3 Guidance,"BOISE, Idaho — Micron Technology Inc. shares climbed more than 3% Thursday to trade around $420.50 as investors continued to reward the memory chipmaker's dominant position in the artificial intelligence boom, fueled by sold-out high-bandwidth memory producti…","BOISE, Idaho — Micron Technology Inc. shares climbed more than 3% Thursday to trade around $420.50 as investors continued to reward the memory chipmaker's dominant position in the artificial intellig… [+7675 chars]","Micron Stock Rockets Toward $420 on Explosive AI Memory Demand and Record Q3 Guidance BOISE, Idaho — Micron Technology Inc. shares climbed more than 3% Thursday to trade around $420.50 as investors continued to reward the memory chipmaker's dominant position in the artificial intelligence boom, fueled by sold-out high-bandwidth memory producti… BOISE, Idaho — Micron Technology Inc. shares climbed more than 3% Thursday to trade around $420.50 as investors continued to reward the memory chipmaker's dominant position in the artificial intellig… [+7675 chars]",https://www.ibtimes.com.au/micron-stock-rockets-toward-420-explosive-ai-memory-demand-record-q3-guidance-1865962,2026-04-09T19:29:17+00:00,Ibtimes.com.au,Daniel Lee,https://d.ibtimes.com.au/en/full/1839199/earnings-news-micron-technology-inc-nasdaq-mu.jpg
Corning Stock Surges Past $170 on AI Fiber Optics Boom and Upgraded Growth Targets,"CORNING, N.Y. — Corning Inc. shares climbed more than 3% Thursday to trade around $170.30 as investors rewarded the materials science giant's deepening role in powering artificial intelligence data centers with high-density optical fiber, cable and connectivi…","CORNING, N.Y. — Corning Inc. shares climbed more than 3% Thursday to trade around $170.30 as investors rewarded the materials science giant's deepening role in powering artificial intelligence data c… [+7323 chars]","Corning Stock Surges Past $170 on AI Fiber Optics Boom and Upgraded Growth Targets CORNING, N.Y. — Corning Inc. shares climbed more than 3% Thursday to trade around $170.30 as investors rewarded the materials science giant's deepening role in powering artificial intelligence data centers with high-density optical fiber, cable and connectivi… CORNING, N.Y. — Corning Inc. shares climbed more than 3% Thursday to trade around $170.30 as investors rewarded the materials science giant's deepening role in powering artificial intelligence data c… [+7323 chars]",https://www.ibtimes.com.au/corning-stock-surges-past-170-ai-fiber-optics-boom-upgraded-growth-targets-1865958,2026-04-09T19:19:43+00:00,Ibtimes.com.au,Daniel Lee,https://d.ibtimes.com.au/en/full/1893541/corning-stock-surges-past-170-ai-fiber-optics-boom.jpg
Save yourself wrist pain and $45 with this Logitech MX Vertical Mouse deal,"Getting a vertical mouse got rid of my wrist pain, and the Logitech MX Vertical is the most popular high-end model!","The Logitech MX Vertical still stands strong as the most popular mouse in its category, despite launching all the way back in 2018. Its still an awesome mouse, and the good news is that older product… [+1867 chars]","Save yourself wrist pain and $45 with this Logitech MX Vertical Mouse deal Getting a vertical mouse got rid of my wrist pain, and the Logitech MX Vertical is the most popular high-end model! The Logitech MX Vertical still stands strong as the most popular mouse in its category, despite launching all the way back in 2018. Its still an awesome mouse, and the good news is that older product… [+1867 chars]",https://www.androidauthority.com/logitech-mx-vertical-mouse-deal-2-3656311/,2026-04-09T19:19:31+00:00,Android Authority,Edgar Cervantes,https://www.androidauthority.com/wp-content/uploads/2019/10/Logitech-MX-Vertical-on-a-desk.jpg
"Amazon generating $15B in AI revenue, CEO Andy Jassy says","Jassy also pointed to rapid growth in Amazon’s custom chip business, as large tech companies develop their own processors to cut dependence on costly Nvidia AI chips.","Amazon’s AI services at its cloud-computing unit are generating annualized revenue of more than $15 billion, CEO Andy Jassy said, the first time the company has reported numbers on a business it has … [+2774 chars]","Amazon generating $15B in AI revenue, CEO Andy Jassy says Jassy also pointed to rapid growth in Amazon’s custom chip business, as large tech companies develop their own processors to cut dependence on costly Nvidia AI chips. Amazon’s AI services at its cloud-computing unit are generating annualized revenue of more than $15 billion, CEO Andy Jassy said, the first time the company has reported numbers on a business it has … [+2774 chars]",https://nypost.com/2026/04/09/business/amazon-generating-15b-in-ai-revenue-ceo-andy-jassy-says/,2026-04-09T19:18:44+00:00,New York Post,Reuters,https://nypost.com/wp-content/uploads/sites/2/2026/04/newspress-collage-3hrylpwyq-1775762368514.jpg?quality=75&strip=all&1775747974&w=1200
Meta rolls out new AI model in ‘fundamental shift’ in latest effort to catch up with rivals,"The company unveiled Muse Spark, its first major AI model since overhauling its AI division and pouring billions into talent and infrastructure.",Mark Zuckerberg-run Meta has rolled out a new artificial intelligence model designed to power everything from shopping suggestions to chat — the latest effort in the tech giants costly push to catch … [+4262 chars],"Meta rolls out new AI model in ‘fundamental shift’ in latest effort to catch up with rivals The company unveiled Muse Spark, its first major AI model since overhauling its AI division and pouring billions into talent and infrastructure. Mark Zuckerberg-run Meta has rolled out a new artificial intelligence model designed to power everything from shopping suggestions to chat — the latest effort in the tech giants costly push to catch … [+4262 chars]",https://nypost.com/2026/04/09/business/meta-rolls-out-new-ai-model-in-latest-effort-to-catch-up-with-rivals/,2026-04-09T19:17:15+00:00,New York Post,Ariel Zilber,https://nypost.com/wp-content/uploads/sites/2/2026/04/125314877.jpg?quality=75&strip=all&w=1200
"Justice Department is investigating the NFL for potential anticompetitive practices, AP source says","The Justice Department is investigating the NFL for potential anticompetitive practices, according to a government official. The official, who was not authorized to discuss an ongoing investigation by name and spoke on condition of anonymity, said the investi…","The Justice Department is investigating the NFL for potential anticompetitive practices, according to a government official.
The official, who was not authorized to discuss an ongoing investigation … [+4246 chars]","Justice Department is investigating the NFL for potential anticompetitive practices, AP source says The Justice Department is investigating the NFL for potential anticompetitive practices, according to a government official. The official, who was not authorized to discuss an ongoing investigation by name and spoke on condition of anonymity, said the investi… The Justice Department is investigating the NFL for potential anticompetitive practices, according to a government official. The official, who was not authorized to discuss an ongoing investigation … [+4246 chars]",https://sports.yahoo.com/articles/justice-department-investigating-nfl-potential-191110802.html,2026-04-09T19:11:10+00:00,Yahoo Entertainment,JOE REEDY and ERIC TUCKER,https://s.yimg.com/ny/api/res/1.2/A1ocO7QP833m9KSoSPknBw--/YXBwaWQ9aGlnaGxhbmRlcjt3PTEyMDA7aD04MDA7Y2Y9d2VicA--/https://media.zenfs.com/en/ap.org/d1e21913127d2af0cc6b9c2b65acdef3
Hut 8 Stock Explodes Past $63 on AI Data Center Pivot as Bitcoin Miner Transforms Into Powerhouse,"MIAMI — Hut 8 Corp. shares surged more than 3% Thursday to trade around $63.72, extending a blistering multi-day rally that has pushed the stock up sharply in recent sessions as investors pile into the former Bitcoin miner's aggressive shift toward artificial…","MIAMI — Hut 8 Corp. shares surged more than 3% Thursday to trade around $63.72, extending a blistering multi-day rally that has pushed the stock up sharply in recent sessions as investors pile into t… [+7144 chars]","Hut 8 Stock Explodes Past $63 on AI Data Center Pivot as Bitcoin Miner Transforms Into Powerhouse MIAMI — Hut 8 Corp. shares surged more than 3% Thursday to trade around $63.72, extending a blistering multi-day rally that has pushed the stock up sharply in recent sessions as investors pile into the former Bitcoin miner's aggressive shift toward artificial… MIAMI — Hut 8 Corp. shares surged more than 3% Thursday to trade around $63.72, extending a blistering multi-day rally that has pushed the stock up sharply in recent sessions as investors pile into t… [+7144 chars]",https://www.ibtimes.com.au/hut-8-stock-explodes-past-63-ai-data-center-pivot-bitcoin-miner-transforms-powerhouse-1865953,2026-04-09T19:09:59+00:00,Ibtimes.com.au,Mike Clair,https://d.ibtimes.com.au/en/full/1893537/hut-8.jpg
"Google wants more Intel inside ... its datacenters, taps Chipzilla for more SmartNICs","Custom ASIC biz now running at a $1B annual pace for Intel
Google will continue to work with Intel, buying SmartNICs for its public cloud rather than blazing its own trail as AWS has done with its Nitro NICs.…","Google will continue to work with Intel, buying SmartNICs for its public cloud rather than blazing its own trail as AWS has done with its Nitro NICs.
Like most hyperscalers today, Google employs Sma… [+2666 chars]","Google wants more Intel inside ... its datacenters, taps Chipzilla for more SmartNICs Custom ASIC biz now running at a $1B annual pace for Intel Google will continue to work with Intel, buying SmartNICs for its public cloud rather than blazing its own trail as AWS has done with its Nitro NICs.… Google will continue to work with Intel, buying SmartNICs for its public cloud rather than blazing its own trail as AWS has done with its Nitro NICs. Like most hyperscalers today, Google employs Sma… [+2666 chars]",https://www.theregister.com/2026/04/09/google_intel_ipu/,2026-04-09T19:03:41+00:00,Theregister.com,Tobias Mann,https://regmedia.co.uk/2023/01/20/shutterstock_intel.jpg
Man Lights 1.2 Million Square Foot Warehouse on Fire for Not Paying Him Enough,"""All you had to do was pay us enough to live.""
The post Man Lights 1.2 Million Square Foot Warehouse on Fire for Not Paying Him Enough appeared first on Futurism.","Can’t-miss innovations from the bleeding edge of science and tech
Many workers’ pay is effectively frozen in an unforgiving labor market that hasn’t seen any meaningful increases in wages in decades… [+2505 chars]","Man Lights 1.2 Million Square Foot Warehouse on Fire for Not Paying Him Enough ""All you had to do was pay us enough to live."" The post Man Lights 1.2 Million Square Foot Warehouse on Fire for Not Paying Him Enough appeared first on Futurism. Can’t-miss innovations from the bleeding edge of science and tech Many workers’ pay is effectively frozen in an unforgiving labor market that hasn’t seen any meaningful increases in wages in decades… [+2505 chars]",http://futurism.com/future-society/man-lights-warehouse-fire-not-paying-enough,2026-04-09T19:01:07+00:00,Futurism,Victor Tangermann,https://futurism.com/wp-content/uploads/2026/04/man-lights-warehouse-fire-not-paying-enough.jpg?w=1200
I Can’t Believe I Just Found This For $16 On Amazon,One of our Disney World must-haves is on sale for just $16 for a limited time!,"One of the must-haves on our Disney World packing list is on sale for almost 40% off right now!
Cinderella Castle
Between booking Lightning Lanes, managing dining reservations, and taking tons of p… [+3004 chars]","I Can’t Believe I Just Found This For $16 On Amazon One of our Disney World must-haves is on sale for just $16 for a limited time! One of the must-haves on our Disney World packing list is on sale for almost 40% off right now! Cinderella Castle Between booking Lightning Lanes, managing dining reservations, and taking tons of p… [+3004 chars]",https://www.disneyfoodblog.com/2026/04/09/i-cant-believe-i-just-found-this-for-16-on-amazon/,2026-04-09T19:00:04+00:00,disneyfoodblog.com,Brianna LeCompte,https://www.disneyfoodblog.com/wp-content/uploads/2025/05/2025-WDW-port-orleans-riverside-atmo-2-700x525.jpg
Amazon handing out FREE $50 gift cards with new Samsung Galaxy A37 phones,"As we reported earlier today, Samsung has now unleashed its all-new mid-ranger A-series Galaxy phones to the U.S. market. The new Galaxy A37 5G and Galaxy A57 5G are available for purchase directly on the Samsung site, and with the option of a FREE case or 30…","As we reported earlier today, Samsung has now unleashed its all-new mid-ranger A-series Galaxy phones to the U.S. market. The new Galaxy A37 5G and Galaxy A57 5G are available for purchase directly o… [+1166 chars]","Amazon handing out FREE $50 gift cards with new Samsung Galaxy A37 phones As we reported earlier today, Samsung has now unleashed its all-new mid-ranger A-series Galaxy phones to the U.S. market. The new Galaxy A37 5G and Galaxy A57 5G are available for purchase directly on the Samsung site, and with the option of a FREE case or 30… As we reported earlier today, Samsung has now unleashed its all-new mid-ranger A-series Galaxy phones to the U.S. market. The new Galaxy A37 5G and Galaxy A57 5G are available for purchase directly o… [+1166 chars]",http://9to5toys.com/2026/04/09/amazon-free-50-gift-cards-new-samsung-galaxy-a37/,2026-04-09T18:54:52+00:00,9to5Toys,Justin Kahn,https://i0.wp.com/9to5toys.com/wp-content/uploads/sites/5/2026/04/Samsung-A37-57-new-deals.jpg?resize=1200%2C628&quality=82&strip=all&ssl=1
I was put on a PIP at Amazon and took an offer to leave. I thought finding a new job would be easy — I was wrong.,An Amazon program manager took a termination package after being put on a PIP. Moving to Houston and changing his strategy helped him land a new job.,"Nicholas JenkinsNicholas Jenkins
<ul><li>Nicholas Jenkins was put on a performance improvement plan while working at Amazon.</li><li>He took a termination package in December 2024 and was surprised … [+4828 chars]",I was put on a PIP at Amazon and took an offer to leave. I thought finding a new job would be easy — I was wrong. An Amazon program manager took a termination package after being put on a PIP. Moving to Houston and changing his strategy helped him land a new job. Nicholas JenkinsNicholas Jenkins Nicholas Jenkins was put on a performance improvement plan while working at Amazon.He took a termination package in December 2024 and was surprised … [+4828 chars],https://www.businessinsider.com/amazon-pip-job-market-search-strategies-networking-2026-4,2026-04-09T18:53:52+00:00,Business Insider,Jacob Zinkula,https://i.insider.com/69d653f9f36fd1a78c051d32?width=1119&format=jpeg
Is a backlash brewing? Rapid innovation in AI coding and agents may force push for enterprise order and control,"Artificial intelligence is proving to be a big bet for many companies across the enterprise landscape, and the gamblers are getting nervous. A survey of 2,400 global employees and C-suite leaders released this week by the agentic AI platform Writer Inc. found…","Artificial intelligence is proving to be a big bet for many companies across the enterprise landscape, and the gamblers are getting nervous.
A survey of 2,400 global employees and C-suite leaders re… [+8127 chars]","Is a backlash brewing? Rapid innovation in AI coding and agents may force push for enterprise order and control Artificial intelligence is proving to be a big bet for many companies across the enterprise landscape, and the gamblers are getting nervous. A survey of 2,400 global employees and C-suite leaders released this week by the agentic AI platform Writer Inc. found… Artificial intelligence is proving to be a big bet for many companies across the enterprise landscape, and the gamblers are getting nervous. A survey of 2,400 global employees and C-suite leaders re… [+8127 chars]",https://siliconangle.com/2026/04/09/backlash-brewing-rapid-innovation-ai-coding-agents-may-force-push-enterprise-order-control/,2026-04-09T18:47:47+00:00,SiliconANGLE News,Mark Albertson,https://d15shllkswkct0.cloudfront.net/wp-content/blogs.dir/1/files/2026/04/HumanX-1.jpg
Bloom Energy Stock Rockets 7.3% Past $157 as AI Data Center Power Crunch Drives Fuel Cell Demand,"SAN JOSE, Calif. — Shares of Bloom Energy Corp. surged more than 7% Thursday, blasting past $157 as investors piled into the solid-oxide fuel cell maker amid intensifying demand for reliable on-site power to fuel artificial intelligence data centers and ease …","SAN JOSE, Calif. — Shares of Bloom Energy Corp. surged more than 7% Thursday, blasting past $157 as investors piled into the solid-oxide fuel cell maker amid intensifying demand for reliable on-site … [+7208 chars]","Bloom Energy Stock Rockets 7.3% Past $157 as AI Data Center Power Crunch Drives Fuel Cell Demand SAN JOSE, Calif. — Shares of Bloom Energy Corp. surged more than 7% Thursday, blasting past $157 as investors piled into the solid-oxide fuel cell maker amid intensifying demand for reliable on-site power to fuel artificial intelligence data centers and ease … SAN JOSE, Calif. — Shares of Bloom Energy Corp. surged more than 7% Thursday, blasting past $157 as investors piled into the solid-oxide fuel cell maker amid intensifying demand for reliable on-site … [+7208 chars]",https://www.ibtimes.com.au/bloom-energy-stock-rockets-73-past-157-ai-data-center-power-crunch-drives-fuel-cell-demand-1865942,2026-04-09T18:46:19+00:00,Ibtimes.com.au,Mike Clair,https://d.ibtimes.com.au/en/full/1893533/bloom-energy.jpg
Sugar Harmony (INVESTIGATED): What You Need to Know Before Buying This Blood Sugar Support Supplement,"A 2026 analysis examining the Sugar Harmony liquid formula, the ingredient rationale, purchase authenticity concerns, and the practical factors consumers may want to weigh before ordering A 2026 analysis examining the Sugar Harmony liquid formula, the ingredi…","New York City, NY, April 09, 2026 (GLOBE NEWSWIRE) -- Sugar Harmony has attracted growing attention among consumers seeking a liquid-format supplement positioned for blood sugar support, but increase… [+32566 chars]","Sugar Harmony (INVESTIGATED): What You Need to Know Before Buying This Blood Sugar Support Supplement A 2026 analysis examining the Sugar Harmony liquid formula, the ingredient rationale, purchase authenticity concerns, and the practical factors consumers may want to weigh before ordering A 2026 analysis examining the Sugar Harmony liquid formula, the ingredi… New York City, NY, April 09, 2026 (GLOBE NEWSWIRE) -- Sugar Harmony has attracted growing attention among consumers seeking a liquid-format supplement positioned for blood sugar support, but increase… [+32566 chars]",https://www.globenewswire.com/news-release/2026/04/09/3271359/0/en/Sugar-Harmony-INVESTIGATED-What-You-Need-to-Know-Before-Buying-This-Blood-Sugar-Support-Supplement.html,2026-04-09T18:41:00+00:00,GlobeNewswire,Sugar Harmony,https://ml.globenewswire.com/Resource/Download/9864fc08-26f2-48fe-af19-3bcc3ee77201
Tesla Is Reportedly Working on a Cheaper Electric SUV Model,"The company previously scrapped efforts at a vehicle in the $25,000 range.","Citing anonymous sources familiar with the project, Reuters reported Thursday that Tesla is developing a new compact SUV model that would be priced below its other electric vehicles, including the $3… [+1443 chars]","Tesla Is Reportedly Working on a Cheaper Electric SUV Model The company previously scrapped efforts at a vehicle in the $25,000 range. Citing anonymous sources familiar with the project, Reuters reported Thursday that Tesla is developing a new compact SUV model that would be priced below its other electric vehicles, including the $3… [+1443 chars]",https://www.cnet.com/home/electric-vehicles/report-teslas-working-on-a-cheaper-compact-suv-model/,2026-04-09T18:37:28+00:00,CNET,Omar Gallaga,https://www.cnet.com/a/img/resize/e038a2d52a096f872f91a7de830b97a69410f5b9/hub/2025/11/15/acc64d87-d120-442e-b157-b7cba19bf0db/tesla-fsd-v14-in-use.jpg?auto=webp&fit=crop&height=675&width=1200
