title,description,content,text_for_analysis,url,published_at,source,author,image_url
"""The pro-aim function is like cheat mode for shooters"": Who needs Xbox's Elite controller when this cheaper joypad plays better?","The Turtle Beach Stealth Ultra is a top-of-the-line controller for Xbox. Incredibly responsive controls, an OLED display, and other useful features are now yours for less with this 54% discount.","Most people prefer playing first-person shooters with a mouse and keyboard as they're far more intuitive for aiming fast compared to traditional controllers.
However, there are some controllers aimi… [+3621 chars]","""The pro-aim function is like cheat mode for shooters"": Who needs Xbox's Elite controller when this cheaper joypad plays better? The Turtle Beach Stealth Ultra is a top-of-the-line controller for Xbox. Incredibly responsive controls, an OLED display, and other useful features are now yours for less with this 54% discount. Most people prefer playing first-person shooters with a mouse and keyboard as they're far more intuitive for aiming fast compared to traditional controllers. However, there are some controllers aimi… [+3621 chars]",https://www.windowscentral.com/accessories/who-needs-xbox-elite-controller-when-this-plays-better,2026-04-10T11:46:03+00:00,Windows Central,Alexander Cope,https://cdn.mos.cms.futurecdn.net/UVjSYZkNujQG5zYVHutt3C-1918-80.jpg
Cineplex Reports Strong March Box Office Results,"TORONTO, April 10, 2026 (GLOBE NEWSWIRE) -- (TSX: CGX) – Cineplex, Canada’s leading entertainment and media company, reported box office revenues of $52.4 million for March 2026.","TORONTO, April 10, 2026 (GLOBE NEWSWIRE) -- (TSX: CGX)  Cineplex, Canadas leading entertainment and media company, reported box office revenues of $52.4 million for March 2026.
<table><tr><td>Period… [+6273 chars]","Cineplex Reports Strong March Box Office Results TORONTO, April 10, 2026 (GLOBE NEWSWIRE) -- (TSX: CGX) – Cineplex, Canada’s leading entertainment and media company, reported box office revenues of $52.4 million for March 2026. TORONTO, April 10, 2026 (GLOBE NEWSWIRE) -- (TSX: CGX) Cineplex, Canadas leading entertainment and media company, reported box office revenues of $52.4 million for March 2026. Period… [+6273 chars]",https://www.globenewswire.com/news-release/2026/04/10/3271676/0/en/Cineplex-Reports-Strong-March-Box-Office-Results.html,2026-04-10T11:30:00+00:00,GlobeNewswire,Cineplex Inc.,https://ml.globenewswire.com/Resource/Download/9e3c8136-f7d0-4000-b960-ada6beb99d59
"Live again: Most affordable M5 MacBook Pro you can buy down at $1,400 on Amazon ($299 under the model Apple sells)","This deal almost surely will not last for long as this is the unicorn 512GB M5 MacBook Pro Apple no longer sells down at $1,399.99 shipped on Amazon right now. That’s the most affordable M5 MacBook Pro out there and one that might be gone for good very soon. …","This deal almost surely will not last for long as this is the unicorn 512GB M5 MacBook Pro Apple no longer sells down at $1,399.99 shipped on Amazon right now. Thats the most affordable M5 MacBook Pr… [+1499 chars]","Live again: Most affordable M5 MacBook Pro you can buy down at $1,400 on Amazon ($299 under the model Apple sells) This deal almost surely will not last for long as this is the unicorn 512GB M5 MacBook Pro Apple no longer sells down at $1,399.99 shipped on Amazon right now. That’s the most affordable M5 MacBook Pro out there and one that might be gone for good very soon. … This deal almost surely will not last for long as this is the unicorn 512GB M5 MacBook Pro Apple no longer sells down at $1,399.99 shipped on Amazon right now. Thats the most affordable M5 MacBook Pr… [+1499 chars]",http://9to5toys.com/2026/04/10/live-most-affordable-m5-macbook-pro/,2026-04-10T11:18:18+00:00,9to5Toys,Justin Kahn,https://i0.wp.com/9to5toys.com/wp-content/uploads/sites/5/2025/10/Apple-M5-MacBook-Pro-best-trade-in-value-2.jpg?resize=1200%2C628&quality=82&strip=all&ssl=1
"Is Anthropic's Mythos model the most capable AI yet, what is Capybara, and why is this powerful system considered too dangerous to go public over advanced hacking risks?",Is Anthropic Mythos model the most capable AI yet? A powerful new AI has triggered global concern. Anthropic says its Mythos system has already found thousands of critical software vulnerabilities. This includes flaws across major operating systems and web br…,"Is Anthropic Mythos model the most capable AI yet? A quiet but critical shift is unfolding inside the artificial intelligence world. Anthropic has paused the public rollout of its newest system, Myth… [+8832 chars]","Is Anthropic's Mythos model the most capable AI yet, what is Capybara, and why is this powerful system considered too dangerous to go public over advanced hacking risks? Is Anthropic Mythos model the most capable AI yet? A powerful new AI has triggered global concern. Anthropic says its Mythos system has already found thousands of critical software vulnerabilities. This includes flaws across major operating systems and web br… Is Anthropic Mythos model the most capable AI yet? A quiet but critical shift is unfolding inside the artificial intelligence world. Anthropic has paused the public rollout of its newest system, Myth… [+8832 chars]",https://economictimes.indiatimes.com/news/international/us/is-anthropic-mythos-model-the-most-capable-ai-yet-what-is-capybara-and-why-is-this-powerful-system-considered-too-dangerous-to-go-public-over-advanced-hacking-risks/articleshow/130167435.cms,2026-04-10T11:17:27+00:00,The Times of India,Piyush Shukla,"https://img.etimg.com/thumb/msid-130167974,width-1200,height-630,imgsize-23430,overlay-economictimes/articleshow.jpg"
"After jumping 2,200% over the last twelve months, DDR4 spot prices fall 5%, the first decline in nearly a year — DDR5 pricing sees some relief in China channel market","DDR4 16Gb spot prices fell about 5% over the past month to roughly $74.10, ending nearly a year of consecutive monthly gains.","The spot price of a 16GB DDR4 chip slipped roughly 5% over the past month to around $74.10, the first monthly decline since February 2025 and the first crack in a rally that pushed the same part from… [+2987 chars]","After jumping 2,200% over the last twelve months, DDR4 spot prices fall 5%, the first decline in nearly a year — DDR5 pricing sees some relief in China channel market DDR4 16Gb spot prices fell about 5% over the past month to roughly $74.10, ending nearly a year of consecutive monthly gains. The spot price of a 16GB DDR4 chip slipped roughly 5% over the past month to around $74.10, the first monthly decline since February 2025 and the first crack in a rally that pushed the same part from… [+2987 chars]",https://www.tomshardware.com/tech-industry/ddr4-spot-prices-fall-for-first-time-in-nearly-a-year-as-chinese-channel-inventory-clears,2026-04-10T11:00:00+00:00,Tom's Hardware UK,Luke James,https://cdn.mos.cms.futurecdn.net/NgEKzJRNYA3eHz59cwqH43-1920-80.jpg
How to land Galaxy S26 Ultra at up to $400 off the list price (no trade needed),"The wild Samsung Galaxy Z TriFold will be in-stock again this morning starting at 10:00 a.m. (or earlier), but for those still looking towards landing one of its flagship Galaxy S26 Ultra devices, the deals are flying this week. Samsung is offering straight u…","The wild Samsung Galaxy Z TriFold will be in-stock again this morning starting at 10:00 a.m. (or earlier), but for those still looking towards landing one of its flagship Galaxy S26 Ultra devices, th… [+1341 chars]","How to land Galaxy S26 Ultra at up to $400 off the list price (no trade needed) The wild Samsung Galaxy Z TriFold will be in-stock again this morning starting at 10:00 a.m. (or earlier), but for those still looking towards landing one of its flagship Galaxy S26 Ultra devices, the deals are flying this week. Samsung is offering straight u… The wild Samsung Galaxy Z TriFold will be in-stock again this morning starting at 10:00 a.m. (or earlier), but for those still looking towards landing one of its flagship Galaxy S26 Ultra devices, th… [+1341 chars]",http://9to5toys.com/2026/04/10/how-to-galaxy-s26-ultra-deal/,2026-04-10T10:09:47+00:00,9to5Toys,Justin Kahn,https://i0.wp.com/9to5toys.com/wp-content/uploads/sites/5/2026/03/Last-Chance-Galaxy-S26-Ultra-Galaxy-buds-4-deals.jpg?resize=1200%2C628&quality=82&strip=all&ssl=1
Morning Brief: A big day for inflation,"The Fed's preferred inflation gauge showed pricing pressures remained elevated for the month of February, even before the US and Israel began their military ...","Good morning! Oil prices surged on Thursday as the ceasefire's precariousness became clearer, but markets reversed losses after Israel agreed to negotiations with Lebanon.
But the stock market didn'… [+9607 chars]","Morning Brief: A big day for inflation The Fed's preferred inflation gauge showed pricing pressures remained elevated for the month of February, even before the US and Israel began their military ... Good morning! Oil prices surged on Thursday as the ceasefire's precariousness became clearer, but markets reversed losses after Israel agreed to negotiations with Lebanon. But the stock market didn'… [+9607 chars]",https://finance.yahoo.com/news/morning-brief-a-big-day-for-inflation-100052155.html,2026-04-10T10:00:52+00:00,Yahoo Entertainment,Hamza Shaban,https://s.yimg.com/ny/api/res/1.2/1zwMhDOoAPUaU2PPk1g6Wg--/YXBwaWQ9aGlnaGxhbmRlcjt3PTEyMDA7aD03MjM7Y2Y9d2VicA--/https://s.yimg.com/os/creatr-uploaded-images/2026-04/4442d6f0-345d-11f1-b367-42741f02b771
"U.S. and Iran begin peace talks as Trump’s White House goes to war against the media, insider traders, and the Pope",Everything you need to know before you reach the office this morning.,Oil rose marginally to $97 per barrel this morning. S&amp;P 500 futures were flat before the open in New York. The index closed up 0.62% yesterday. Asia was up strongly today: Japans Nikkei 225 rose … [+8167 chars],"U.S. and Iran begin peace talks as Trump’s White House goes to war against the media, insider traders, and the Pope Everything you need to know before you reach the office this morning. Oil rose marginally to $97 per barrel this morning. SP 500 futures were flat before the open in New York. The index closed up 0.62% yesterday. Asia was up strongly today: Japans Nikkei 225 rose … [+8167 chars]",https://fortune.com/2026/04/10/us-iran-peace-talks-trump-wsj-insider-trading-pope/,2026-04-10T09:57:07+00:00,Fortune,Jim Edwards,"https://fortune.com/img-assets/wp-content/uploads/2026/04/GettyImages-2270167901.jpg?resize=1200,600"
Alphabet steamrolled BI's stock bracket. Here are 4 things your picks revealed.,Bracket voters largely opted for more proven companies that they interact with on a daily basis.,"After three weeks of voting and general bracket madness, First Trade readership has selected ALPHABETas the Magnificent 7 (plus Palantir) stock they'd most like to own for the next 10 years.
The Goo… [+2772 chars]","Alphabet steamrolled BI's stock bracket. Here are 4 things your picks revealed. Bracket voters largely opted for more proven companies that they interact with on a daily basis. After three weeks of voting and general bracket madness, First Trade readership has selected ALPHABETas the Magnificent 7 (plus Palantir) stock they'd most like to own for the next 10 years. The Goo… [+2772 chars]",https://www.businessinsider.com/march-madness-style-bracket-crowned-alphabet-as-top-stock-pick-2026-4,2026-04-10T09:50:01+00:00,Business Insider,jciolli@businessinsider.com (Joe Ciolli),https://i.insider.com/69d812f6f976785dcb190072?width=1200&format=jpeg
10 Best AI Chip Makers in 2026: NVIDIA Dominates AI Chip Race as Market Surges Toward $500 Billion Milestone,"SAN FRANCISCO — NVIDIA Corp. solidified its commanding lead in the exploding artificial intelligence chip sector in early 2026, capturing roughly 80-85% of the AI accelerator market while the broader AI semiconductor industry hurtled toward half a trillion do…","SAN FRANCISCO — NVIDIA Corp. solidified its commanding lead in the exploding artificial intelligence chip sector in early 2026, capturing roughly 80-85% of the AI accelerator market while the broader… [+8971 chars]","10 Best AI Chip Makers in 2026: NVIDIA Dominates AI Chip Race as Market Surges Toward $500 Billion Milestone SAN FRANCISCO — NVIDIA Corp. solidified its commanding lead in the exploding artificial intelligence chip sector in early 2026, capturing roughly 80-85% of the AI accelerator market while the broader AI semiconductor industry hurtled toward half a trillion do… SAN FRANCISCO — NVIDIA Corp. solidified its commanding lead in the exploding artificial intelligence chip sector in early 2026, capturing roughly 80-85% of the AI accelerator market while the broader… [+8971 chars]",https://www.ibtimes.com.au/10-best-ai-chip-makers-2026-nvidia-dominates-ai-chip-race-market-surges-toward-500-billion-1866051,2026-04-10T09:46:44+00:00,Ibtimes.com.au,Daniel Lee,https://d.ibtimes.com.au/en/full/1858708/tech-giants-ai-race-have-been-spending-billions-dollars-gpus-made-nvidia-considered-leader.jpg
My 2026 Sephora Spring Sale Favorites!,"My 2026 sephora spring sale favorites are here! All the best of the best. I love the spring sephora sale! Time to stock up on all things skincare, sunscreen and all the pretty pastel makeup shades. I’m a certified beauty product junkie and have been since I w…","My 2026 sephora spring sale favorites are here! All the best of the best.
I love the spring sephora sale!
Time to stock up on all things skincare, sunscreen and all the pretty pastel makeup shades.… [+11047 chars]","My 2026 Sephora Spring Sale Favorites! My 2026 sephora spring sale favorites are here! All the best of the best. I love the spring sephora sale! Time to stock up on all things skincare, sunscreen and all the pretty pastel makeup shades. I’m a certified beauty product junkie and have been since I w… My 2026 sephora spring sale favorites are here! All the best of the best. I love the spring sephora sale! Time to stock up on all things skincare, sunscreen and all the pretty pastel makeup shades.… [+11047 chars]",https://www.howsweeteats.com/2026/04/2026-sephora-spring-sale/,2026-04-10T09:30:50+00:00,Howsweeteats.com,Jessica,https://www.howsweeteats.com/wp-content/uploads/2026/04/Copy-of-Copy-of-Copy-of-Copy-of-Copy-of-Copy-of-Copy-of-Copy-of-Copy-of-you-2.png
"Ambitious hacker reduces worst-case memory latency by up to 93%, but with severe downsides — 1960s bottleneck overcome by hedging memory accesses to avoid running into DRAM refresh stalls","The clever software trick works on both x86 and Arm to radically reduce worst-case memory latency, but it has severe limitations, too.","A method devised by YouTuber, Googler, and security researcher LaurieWired could have huge implications for a very few specific use cases and workloads that are highly sensitive to ""tail latency,"" or… [+7720 chars]","Ambitious hacker reduces worst-case memory latency by up to 93%, but with severe downsides — 1960s bottleneck overcome by hedging memory accesses to avoid running into DRAM refresh stalls The clever software trick works on both x86 and Arm to radically reduce worst-case memory latency, but it has severe limitations, too. A method devised by YouTuber, Googler, and security researcher LaurieWired could have huge implications for a very few specific use cases and workloads that are highly sensitive to ""tail latency,"" or… [+7720 chars]",https://www.tomshardware.com/software/ambitious-hacker-reduces-worst-case-memory-latency-by-up-to-93-percent-but-with-severe-downsides-1960s-bottleneck-overcome-by-hedging-memory-accesses-to-avoid-running-into-dram-refresh-stalls,2026-04-10T09:26:17+00:00,Tom's Hardware UK,Zak Killian,https://cdn.mos.cms.futurecdn.net/NQmsyhzefFY96H2vVzpPZJ-1920-80.jpg
March inflation report to offer first glimpse of Iran war's economic impact,The U.S. is about to get an initial glimpse into how the economy has begun absorbing the war with Iran,"The U.S. is about to get an initial glimpse into how the economy has begun absorbing the war with Iran.
Subscribe to read this story ad-free 
Get unlimited access to ad-free articles and exclusive … [+2677 chars]",March inflation report to offer first glimpse of Iran war's economic impact The U.S. is about to get an initial glimpse into how the economy has begun absorbing the war with Iran The U.S. is about to get an initial glimpse into how the economy has begun absorbing the war with Iran. Subscribe to read this story ad-free Get unlimited access to ad-free articles and exclusive … [+2677 chars],https://www.nbcnews.com/business/economy/march-inflation-report-iran-war-gas-prices-rcna267535,2026-04-10T09:00:00+00:00,NBC News,Rob Wile,"https://media-cldnry.s-nbcnews.com/image/upload/t_nbcnews-fp-1200-630,f_auto,q_auto:best/rockcms/2026-04/260409-grocery-aa-556-60ab83.jpg"
Amazon and Walmart Are Now Chasing the Same Shopper,"Imagine buying a high-amp car battery, a crocheted purse and a bag of fresh groceries all in one go without thinking twice about where to shop. That’s the line Amazon and Walmart want to erase as they battle to become the go-to destination for every kind of p…","Imagine buying a high-amp car battery, a crocheted purse and a bag of fresh groceries all in one go without thinking twice about where to shop. Thats the line Amazon and Walmart want to erase as they… [+6969 chars]","Amazon and Walmart Are Now Chasing the Same Shopper Imagine buying a high-amp car battery, a crocheted purse and a bag of fresh groceries all in one go without thinking twice about where to shop. That’s the line Amazon and Walmart want to erase as they battle to become the go-to destination for every kind of p… Imagine buying a high-amp car battery, a crocheted purse and a bag of fresh groceries all in one go without thinking twice about where to shop. Thats the line Amazon and Walmart want to erase as they… [+6969 chars]",https://www.pymnts.com/retail-2/2026/amazon-and-walmart-are-now-chasing-the-same-shopper/,2026-04-10T08:00:53+00:00,pymnts.com,PYMNTS,https://www.pymnts.com/wp-content/uploads/2023/07/Amazon-delivery.jpg
What Anthropic’s too-dangerous-to-release AI model means for its upcoming IPO,Anthropic says it has built its most capable AI model ever. It's also decided you can't have it.,"Anthropic has a new product with a major catchits too powerful to be released. For a company valued at around $380 billion and reportedly preparing for an IPO this year, its an unusual stancebut one … [+9354 chars]","What Anthropic’s too-dangerous-to-release AI model means for its upcoming IPO Anthropic says it has built its most capable AI model ever. It's also decided you can't have it. Anthropic has a new product with a major catchits too powerful to be released. For a company valued at around $380 billion and reportedly preparing for an IPO this year, its an unusual stancebut one … [+9354 chars]",https://fortune.com/2026/04/10/anthropic-too-dangerous-to-release-ai-model-means-for-its-upcoming-ipo/,2026-04-10T07:52:38+00:00,Fortune,Beatrice Nolan,"https://fortune.com/img-assets/wp-content/uploads/2026/04/GettyImages-2261864825-2-e1775770945351.jpg?resize=1200,600"
Databricks co-founder Matei Zaharia wins ACM Prize and declares AGI is already here,"In short: Matei Zaharia, the Berkeley computer science professor and Databricks co-founder who created Apache Spark, has won the 2026 ACM Prize in Computing for his foundational contributions to distributed data systems and AI infrastructure. The $250,000 pri…","In short: Matei Zaharia, the Berkeley computer science professor and Databricks co-founder who created Apache Spark, has won the 2026 ACM Prize in Computing for his foundational contributions to dist… [+7322 chars]","Databricks co-founder Matei Zaharia wins ACM Prize and declares AGI is already here In short: Matei Zaharia, the Berkeley computer science professor and Databricks co-founder who created Apache Spark, has won the 2026 ACM Prize in Computing for his foundational contributions to distributed data systems and AI infrastructure. The $250,000 pri… In short: Matei Zaharia, the Berkeley computer science professor and Databricks co-founder who created Apache Spark, has won the 2026 ACM Prize in Computing for his foundational contributions to dist… [+7322 chars]",https://thenextweb.com/news/databricks-matei-zaharia-acm-prize-agi/,2026-04-10T06:09:33+00:00,The Next Web,Alina Maria Stan,https://cdn0.tnwcdn.com/wp-content/blogs.dir/1/files/2026/04/databricks-matei-zaharia-acm-prize-agi.png
Amazon Product Recalled Due to Packaging Safety Violation,"The U.S. Consumer Product Safety Commission issued a recall notice on April 2 for specific hair growth products sold on Amazon, citing the absence of federally mandated child-resistant packaging [1]. The recall impacts the Tuymec Minoxidil Hair Growth Kit and…","The U.S. Consumer Product Safety Commission issued a recall notice on April 2 for specific hair growth products sold on Amazon, citing the absence of federally mandated child-resistant packaging [1].… [+6332 chars]","Amazon Product Recalled Due to Packaging Safety Violation The U.S. Consumer Product Safety Commission issued a recall notice on April 2 for specific hair growth products sold on Amazon, citing the absence of federally mandated child-resistant packaging [1]. The recall impacts the Tuymec Minoxidil Hair Growth Kit and… The U.S. Consumer Product Safety Commission issued a recall notice on April 2 for specific hair growth products sold on Amazon, citing the absence of federally mandated child-resistant packaging [1].… [+6332 chars]",https://www.naturalnews.com/2026-04-10-amazon-product-recalled-due-to-packaging-violation.html,2026-04-10T06:00:00+00:00,Naturalnews.com,Morgan S. Verity,https://www.naturalnews.com/wp-content/uploads/sites/91/2026/04/Amazon-Building-Sign.jpg
AWS ponders selling its home-grown chips by the rack-load and is close to selling out AI capacity,"Annual CEO letter reveals two customers want all Graviton servers, huge drone rollout, a million robots, and more megalomania Amazon CEO Andy Jassy on Thursday delivered his annual letter to shareholders and it’s full of interesting news about the cloud and e…","Amazon CEO Andy Jassy on Thursday delivered his annual letter to shareholders and its full of interesting news about the cloud and e-tail giant.
One detail that caught The Registers eye was Jassys a… [+3955 chars]","AWS ponders selling its home-grown chips by the rack-load and is close to selling out AI capacity Annual CEO letter reveals two customers want all Graviton servers, huge drone rollout, a million robots, and more megalomania Amazon CEO Andy Jassy on Thursday delivered his annual letter to shareholders and it’s full of interesting news about the cloud and e… Amazon CEO Andy Jassy on Thursday delivered his annual letter to shareholders and its full of interesting news about the cloud and e-tail giant. One detail that caught The Registers eye was Jassys a… [+3955 chars]",https://www.theregister.com/2026/04/10/amazon_may_sell_homegrown_chips/,2026-04-10T05:04:14+00:00,Theregister.com,Simon Sharwood,https://regmedia.co.uk/2020/12/03/andy_jassy_reinvent_2020.jpg
How Fara Homidi Is Building a Global Beauty Brand,The beauty brand is entering Australia and New Zealand as part of its growth strategy and has secured a second round of funding from Sandbridge Capital.,"The brands launch in Australia comes after a second round of an undisclosed sum of investment from private equity firm Sandbridge Capital, which first got involved with the brand in February 2025 to … [+2241 chars]","How Fara Homidi Is Building a Global Beauty Brand The beauty brand is entering Australia and New Zealand as part of its growth strategy and has secured a second round of funding from Sandbridge Capital. The brands launch in Australia comes after a second round of an undisclosed sum of investment from private equity firm Sandbridge Capital, which first got involved with the brand in February 2025 to … [+2241 chars]",https://www.vogue.com/article/how-fara-homidi-is-building-a-global-beauty-brand,2026-04-10T05:00:00+00:00,Vogue,Hikmat Mohammed,"https://assets.vogue.com/photos/69d7d6f8ca2eb361780655ff/16:9/w_1280,c_limit/04-10-26-FARA-HOMIDI-vogue-business-story.jpg"
OpenAI has quietly launched its ads manager as it races to build out its ads business,"The AI platform quietly launched its ads manager within its ChatGPT ads pilot advertisers last week, and also lowered the barrier to joining the test.","OpenAI launched an ads manager last week the latest move in its fast expanding advertising business, Digiday has learned.The tool described by those with access as serviceable and broadly similar in … [+4386 chars]","OpenAI has quietly launched its ads manager as it races to build out its ads business The AI platform quietly launched its ads manager within its ChatGPT ads pilot advertisers last week, and also lowered the barrier to joining the test. OpenAI launched an ads manager last week the latest move in its fast expanding advertising business, Digiday has learned.The tool described by those with access as serviceable and broadly similar in … [+4386 chars]",http://digiday.com/marketing/openai-has-quietly-launched-its-ads-manager-as-it-races-to-build-out-its-ads-business/,2026-04-10T04:01:00+00:00,Digiday,Krystal Scanlon,https://digiday.com/wp-content/uploads/sites/3/2025/12/openai-ads-digiday.jpg
