title,description,content,text_for_analysis,url,published_at,source,author,image_url
"Amazon’s chip business could be worth $50 billion, Jassy says, and he hints it may sell them externally","In short: Andy Jassy’s annual letter to shareholders, published on 9 April 2026, reveals that Amazon’s custom chip business, covering Graviton, Trainium, and Nitro, generates more than $20 billion in annualised revenue growing at triple-digit rates year-on-ye…","In short: Andy Jassys annual letter to shareholders, published on 9 April 2026, reveals that Amazons custom chip business, covering Graviton, Trainium, and Nitro, generates more than $20 billion in a… [+7063 chars]","Amazon’s chip business could be worth $50 billion, Jassy says, and he hints it may sell them externally In short: Andy Jassy’s annual letter to shareholders, published on 9 April 2026, reveals that Amazon’s custom chip business, covering Graviton, Trainium, and Nitro, generates more than $20 billion in annualised revenue growing at triple-digit rates year-on-ye… In short: Andy Jassys annual letter to shareholders, published on 9 April 2026, reveals that Amazons custom chip business, covering Graviton, Trainium, and Nitro, generates more than $20 billion in a… [+7063 chars]",https://thenextweb.com/news/amazon-custom-chips-jassy-letter-fifty-billion-trainium/,2026-04-09T18:30:46+00:00,The Next Web,Alina Maria Stan,https://cdn0.tnwcdn.com/wp-content/blogs.dir/1/files/2026/04/amazon-custom-chips-jassy-letter-fifty-billion-trainium.png
"Intel Stock Surges Past $60 as Analyst Upgrade, Terafab Partnership and Foundry Momentum Fuel Turnaround Hopes","SANTA CLARA, Calif. — Intel Corp. shares climbed more than 2.5% Thursday, breaking above $60 for the first time in years, as renewed optimism around the chipmaker's foundry business, a high-profile partnership with Elon Musk's Terafab project and a fresh anal…","SANTA CLARA, Calif. — Intel Corp. shares climbed more than 2.5% Thursday, breaking above $60 for the first time in years, as renewed optimism around the chipmaker's foundry business, a high-profile p… [+6787 chars]","Intel Stock Surges Past $60 as Analyst Upgrade, Terafab Partnership and Foundry Momentum Fuel Turnaround Hopes SANTA CLARA, Calif. — Intel Corp. shares climbed more than 2.5% Thursday, breaking above $60 for the first time in years, as renewed optimism around the chipmaker's foundry business, a high-profile partnership with Elon Musk's Terafab project and a fresh anal… SANTA CLARA, Calif. — Intel Corp. shares climbed more than 2.5% Thursday, breaking above $60 for the first time in years, as renewed optimism around the chipmaker's foundry business, a high-profile p… [+6787 chars]",https://www.ibtimes.com.au/intel-stock-surges-past-60-analyst-upgrade-terafab-partnership-foundry-momentum-fuel-turnaround-1865939,2026-04-09T18:30:43+00:00,Ibtimes.com.au,Mike Clair,https://d.ibtimes.com.au/en/full/1879924/executives-silicon-valley-chip-maker-intel-say-fluid-us-trade-policies-regulatory-moves-have.jpg
Amazon’s AI Chip Business Is Surging—And It Could Be a Major Catalyst for AMZN Stock,,"If you click 'Accept all', we and our partners, including 251 who are part of the IAB Transparency &amp; Consent Framework, will also store and / or access information on a device (in other words, us… [+1046 chars]","Amazon’s AI Chip Business Is Surging—And It Could Be a Major Catalyst for AMZN Stock If you click 'Accept all', we and our partners, including 251 who are part of the IAB Transparency Consent Framework, will also store and / or access information on a device (in other words, us… [+1046 chars]",https://consent.yahoo.com/v2/collectConsent?sessionId=1_cc-session_bf391823-f285-43ae-9ab5-6d3a58cfb12d,2026-04-09T18:15:51+00:00,Yahoo Entertainment,,
Filmhub Acquires Indie Dramedy ‘Burt’ Ahead of World Parkinson’s Day (EXCLUSIVE),"Global sales and distribution company Filmhub has acquired the rights to “Burt,” a micro-indie dramedy about an estranged father and son navigating Parkinson’s Disease. The film stars Oliver Cooper and Burt Berger, who plays the title role of Burt, an aging s…","Global sales and distribution company Filmhub has acquired the rights to “Burt,” a micro-indie dramedy about an estranged father and son navigating Parkinson’s Disease. 
The film stars Oliver Cooper… [+2099 chars]","Filmhub Acquires Indie Dramedy ‘Burt’ Ahead of World Parkinson’s Day (EXCLUSIVE) Global sales and distribution company Filmhub has acquired the rights to “Burt,” a micro-indie dramedy about an estranged father and son navigating Parkinson’s Disease. The film stars Oliver Cooper and Burt Berger, who plays the title role of Burt, an aging s… Global sales and distribution company Filmhub has acquired the rights to “Burt,” a micro-indie dramedy about an estranged father and son navigating Parkinson’s Disease. The film stars Oliver Cooper… [+2099 chars]",https://variety.com/2026/film/news/filmhub-indie-dramedy-burt-world-parkinsons-day-1236712108/,2026-04-09T18:15:00+00:00,Variety,Angelique Jackson,https://variety.com/wp-content/uploads/2026/04/BURT_MAIN-PIC-CC-1.jpg?w=1000&h=563&crop=1
"As NYC Food Halls Go Bust, One Food Court Is Booming","Even as the food halls that sprang up around New York over the past ten or 15 years have started to close, Tangram Mall in Flushing has made its food court a destination for neighbors and international travelers alike.","On a Sunday afternoon in March, a stream of young people and families flowed continuously through the second-floor food court at Tangram, Flushings largest shopping mall. Nearly everyone milling abou… [+7756 chars]","As NYC Food Halls Go Bust, One Food Court Is Booming Even as the food halls that sprang up around New York over the past ten or 15 years have started to close, Tangram Mall in Flushing has made its food court a destination for neighbors and international travelers alike. On a Sunday afternoon in March, a stream of young people and families flowed continuously through the second-floor food court at Tangram, Flushings largest shopping mall. Nearly everyone milling abou… [+7756 chars]",http://www.grubstreet.com/article/tangram-mall-best-food-hall-nyc.html,2026-04-09T18:05:00+00:00,Grub Street,Aaron Short,https://pyxis.nymag.com/v1/imgs/7f0/d89/f1d4782a07002cab53e1fb05f98a2f7371-FoodHall1F.1x.rsocial.w1200.jpg
Shares fall amid Iran ceasefire uncertainty,Aviation stocks and home builders fall amid higher oil price worries,"Irish shares fell on Thursday, along with most European markets, amid ongoing uncertainty about the future of the Iran ceasefire and whether the Strait of Hormuz would reopen fully.
Brent crude oil … [+3970 chars]","Shares fall amid Iran ceasefire uncertainty Aviation stocks and home builders fall amid higher oil price worries Irish shares fell on Thursday, along with most European markets, amid ongoing uncertainty about the future of the Iran ceasefire and whether the Strait of Hormuz would reopen fully. Brent crude oil … [+3970 chars]",https://www.irishtimes.com/business/2026/04/09/shares-fall-amid-iran-ceasefire-uncertainty/,2026-04-09T18:02:16+00:00,The Irish Times,Peter Flanagan,https://www.irishtimes.com/resizer/v2/YIEEK7CXL7AJUE2QMCSQULNSFU.jpg?smart=true&auth=fb2ccecd4a092ca3a364d42b9365bdf8a7ffa0600ea0bf9219d10b6ab7d81d99&width=1200&height=630
GameStop Shares Edge Higher as $9 Billion Cash Pile and Acquisition Buzz Keep Meme Stock Hopes Alive,GameStop Corp. shares ticked up modestly Thursday as the video game retailer's massive cash reserves and persistent speculation about a transformational acquisition under CEO Ryan Cohen continued to fuel investor interest despite ongoing revenue declines in i…,GameStop Corp. shares ticked up modestly Thursday as the video game retailer's massive cash reserves and persistent speculation about a transformational acquisition under CEO Ryan Cohen continued to … [+7487 chars],GameStop Shares Edge Higher as $9 Billion Cash Pile and Acquisition Buzz Keep Meme Stock Hopes Alive GameStop Corp. shares ticked up modestly Thursday as the video game retailer's massive cash reserves and persistent speculation about a transformational acquisition under CEO Ryan Cohen continued to fuel investor interest despite ongoing revenue declines in i… GameStop Corp. shares ticked up modestly Thursday as the video game retailer's massive cash reserves and persistent speculation about a transformational acquisition under CEO Ryan Cohen continued to … [+7487 chars],https://www.ibtimes.com.au/gamestop-shares-edge-higher-9-billion-cash-pile-acquisition-buzz-keep-meme-stock-hopes-alive-1865930,2026-04-09T17:51:06+00:00,Ibtimes.com.au,Mike Clair,https://d.ibtimes.com.au/en/full/1673270/investors-appear-have-mistaken-gme-resources-us-firm-gamestop-which-has-seen-its-shares-surge.jpg
World's smallest violin spotted at Amazon HQ as exec pay packets deflate,"C-suite forced to take sandwiches into work, cycle home It's going to be hard holding back our tears. The C-suite lieutenants at Amazon didn’t exactly get the bumper payday that many El Reg readers would expect, particularly compared with prior years.…","It's going to be hard holding back our tears. The C-suite lieutenants at Amazon didnt exactly get the bumper payday that many El Reg readers would expect, particularly compared with prior years.
Bef… [+2116 chars]","World's smallest violin spotted at Amazon HQ as exec pay packets deflate C-suite forced to take sandwiches into work, cycle home It's going to be hard holding back our tears. The C-suite lieutenants at Amazon didn’t exactly get the bumper payday that many El Reg readers would expect, particularly compared with prior years.… It's going to be hard holding back our tears. The C-suite lieutenants at Amazon didnt exactly get the bumper payday that many El Reg readers would expect, particularly compared with prior years. Bef… [+2116 chars]",https://www.theregister.com/2026/04/09/amazon_execs_pay_packet_pinch/,2026-04-09T17:45:25+00:00,Theregister.com,Paul Kunert,https://regmedia.co.uk/2021/06/02/amazon.jpg
"Amazon CEO reveals AI revenue, dismisses spending doubts in annual letter","Amazon's cloud division has reached a remarkable milestone, raking in more than $15 billion each year from its AI offerings. This impressive figure highlights the success of Amazon's heavy investments in technology. Additionally, the company's custom chip sec…","Amazon's AI services at its cloud-computing unit are generating annualized revenue of more than $15 billion, CEO Andy Jassy said, the first time the company has reported numbers on a business it has … [+2515 chars]","Amazon CEO reveals AI revenue, dismisses spending doubts in annual letter Amazon's cloud division has reached a remarkable milestone, raking in more than $15 billion each year from its AI offerings. This impressive figure highlights the success of Amazon's heavy investments in technology. Additionally, the company's custom chip sec… Amazon's AI services at its cloud-computing unit are generating annualized revenue of more than $15 billion, CEO Andy Jassy said, the first time the company has reported numbers on a business it has … [+2515 chars]",https://economictimes.indiatimes.com/markets/us-stocks/news/amazon-ceo-reveals-ai-revenue-dismisses-spending-doubts-in-annual-letter/articleshow/130150782.cms,2026-04-09T17:45:20+00:00,The Times of India,Reuters,"https://img.etimg.com/thumb/msid-130150782,width-1200,height-630,imgsize-50038,overlay-etmarkets/articleshow.jpg"
Samsung Galaxy S26 Ultra hits new record-low price only days after first discount,"The Samsung Galaxy S26 Ultra was discounted for the first time only a couple of days ago. Well, the price just dropped further!","The Samsung Galaxy S26 series got its first discount only a couple of days ago, saving you up to $200 on the Galaxy S26 Ultra. Well, it just got even cheaper! Amazon is now offering the Black model o… [+1709 chars]","Samsung Galaxy S26 Ultra hits new record-low price only days after first discount The Samsung Galaxy S26 Ultra was discounted for the first time only a couple of days ago. Well, the price just dropped further! The Samsung Galaxy S26 series got its first discount only a couple of days ago, saving you up to $200 on the Galaxy S26 Ultra. Well, it just got even cheaper! Amazon is now offering the Black model o… [+1709 chars]",https://www.androidauthority.com/samsung-galaxy-s26-ultra-deal-3656313/,2026-04-09T17:41:39+00:00,Android Authority,Edgar Cervantes,https://www.androidauthority.com/wp-content/uploads/2026/03/Samsung-Galaxy-S26-Ultra-lying-hero.jpg
Amazon CEO Andy Jassy's pay rose to $2.1 million in 2025 as security and travel costs climbed,Amazon CEO Andy Jassy made $2.1 million last year and had millions of dollars' worth of company stock.,"Andy Jassy's total compensation grew in 2025 due to higher travel and security expenses, Amazon said.Brendan McDermid/Reuters
<ul><li>Amazon paid CEO Andy Jassy nearly $2.1 million last year, accord… [+1945 chars]","Amazon CEO Andy Jassy's pay rose to $2.1 million in 2025 as security and travel costs climbed Amazon CEO Andy Jassy made $2.1 million last year and had millions of dollars' worth of company stock. Andy Jassy's total compensation grew in 2025 due to higher travel and security expenses, Amazon said.Brendan McDermid/Reuters Amazon paid CEO Andy Jassy nearly $2.1 million last year, accord… [+1945 chars]",https://www.businessinsider.com/how-much-amazon-ceo-andy-jassy-made-2025-pay-stock-2026-4,2026-04-09T17:38:44+00:00,Business Insider,Alex Bitter,https://i.insider.com/69d7b5f396ef6a4c9d121390?width=800&format=jpeg
Understanding Amazon Bedrock model lifecycle,"This post shows you how to manage FM transitions in Amazon Bedrock, so you can make sure your AI applications remain operational as models evolve. We discuss the three lifecycle states, how to plan migrations with the new extended access feature, and practica…","Amazon Bedrock regularly releases new foundation model (FM) versions with better capabilities, accuracy, and safety. Understanding the model lifecycle is essential for effective planning and manageme… [+12793 chars]","Understanding Amazon Bedrock model lifecycle This post shows you how to manage FM transitions in Amazon Bedrock, so you can make sure your AI applications remain operational as models evolve. We discuss the three lifecycle states, how to plan migrations with the new extended access feature, and practica… Amazon Bedrock regularly releases new foundation model (FM) versions with better capabilities, accuracy, and safety. Understanding the model lifecycle is essential for effective planning and manageme… [+12793 chars]",https://aws.amazon.com/blogs/machine-learning/understanding-amazon-bedrock-model-lifecycle/,2026-04-09T17:33:28+00:00,Amazon.com,Saurabh Trikande,https://d2908q01vomqb2.cloudfront.net/f1f836cb4ea6efb2a0b1b99f41ad8b103eff4b59/2026/04/09/ML-19718-THUMBNAIL.jpg
AWS previews a cloud-agnostic registry for managing agentic fleets at scale,Amazon Web Services Inc. is trying to make sure enterprises that embrace artificial intelligent agents and automation aren’t getting lost in the curse of “agentic sprawl.” The cloud computing giant is trying to prevent that from happening with the launch of A…,"Amazon Web Services Inc. is trying to make sure enterprises that embrace artificial intelligent agents and automation arent getting lost in the curse of agentic sprawl.
The cloud computing giant is … [+6027 chars]",AWS previews a cloud-agnostic registry for managing agentic fleets at scale Amazon Web Services Inc. is trying to make sure enterprises that embrace artificial intelligent agents and automation aren’t getting lost in the curse of “agentic sprawl.” The cloud computing giant is trying to prevent that from happening with the launch of A… Amazon Web Services Inc. is trying to make sure enterprises that embrace artificial intelligent agents and automation arent getting lost in the curse of agentic sprawl. The cloud computing giant is … [+6027 chars],https://siliconangle.com/2026/04/09/aws-previews-cloud-agnostic-registry-managing-agentic-fleets-scale/,2026-04-09T17:30:04+00:00,SiliconANGLE News,Mike Wheatley,https://d15shllkswkct0.cloudfront.net/wp-content/blogs.dir/1/files/2026/04/Screenshot-from-2026-04-09-07-29-46.png
The future of managing agents at scale: AWS Agent Registry now in preview,"Today, we're announcing AWS Agent Registry (preview) in AgentCore, a single place to discover, share, and reuse AI agents, tools, and agent skills across your enterprise.","Now available through Amazon Bedrock AgentCore, use AWS Agent Registry to discover, share, and reuse agents, tools, and agent skills across your organization.
As enterprises scale to hundreds or tho… [+8953 chars]","The future of managing agents at scale: AWS Agent Registry now in preview Today, we're announcing AWS Agent Registry (preview) in AgentCore, a single place to discover, share, and reuse AI agents, tools, and agent skills across your enterprise. Now available through Amazon Bedrock AgentCore, use AWS Agent Registry to discover, share, and reuse agents, tools, and agent skills across your organization. As enterprises scale to hundreds or tho… [+8953 chars]",https://aws.amazon.com/blogs/machine-learning/the-future-of-managing-agents-at-scale-aws-agent-registry-now-in-preview/,2026-04-09T17:28:20+00:00,Amazon.com,Preethi C N,https://d2908q01vomqb2.cloudfront.net/f1f836cb4ea6efb2a0b1b99f41ad8b103eff4b59/2026/04/09/ml-20825-1120x630.png
Fastly Stock Plunges 14% in Sharp Pullback After Epic Rally on Edge Cloud Momentum,SAN FRANCISCO — Shares of Fastly Inc. tumbled more than 14% Thursday as investors locked in gains following a meteoric run that saw the edge cloud computing specialist more than double in 2026 and hit multi-year highs earlier this week.,SAN FRANCISCO — Shares of Fastly Inc. tumbled more than 14% Thursday as investors locked in gains following a meteoric run that saw the edge cloud computing specialist more than double in 2026 and hi… [+6751 chars],Fastly Stock Plunges 14% in Sharp Pullback After Epic Rally on Edge Cloud Momentum SAN FRANCISCO — Shares of Fastly Inc. tumbled more than 14% Thursday as investors locked in gains following a meteoric run that saw the edge cloud computing specialist more than double in 2026 and hit multi-year highs earlier this week. SAN FRANCISCO — Shares of Fastly Inc. tumbled more than 14% Thursday as investors locked in gains following a meteoric run that saw the edge cloud computing specialist more than double in 2026 and hi… [+6751 chars],https://www.ibtimes.com.au/fastly-stock-plunges-14-sharp-pullback-after-epic-rally-edge-cloud-momentum-1865925,2026-04-09T17:27:20+00:00,Ibtimes.com.au,Mike Clair,https://d.ibtimes.com.au/en/full/1892824/fastly-inc.jpg
Is UPS Down Now? UPS Website Experiences Intermittent Issues as Users Report Tracking and Login Problems,"ATLANTA — United Parcel Service Inc.'s website faced scattered user complaints of slowdowns and access glitches Thursday, with some customers unable to track packages or log into accounts as the delivery giant pushes through a major network overhaul and facil…","ATLANTA — United Parcel Service Inc.'s website faced scattered user complaints of slowdowns and access glitches Thursday, with some customers unable to track packages or log into accounts as the deli… [+6924 chars]","Is UPS Down Now? UPS Website Experiences Intermittent Issues as Users Report Tracking and Login Problems ATLANTA — United Parcel Service Inc.'s website faced scattered user complaints of slowdowns and access glitches Thursday, with some customers unable to track packages or log into accounts as the delivery giant pushes through a major network overhaul and facil… ATLANTA — United Parcel Service Inc.'s website faced scattered user complaints of slowdowns and access glitches Thursday, with some customers unable to track packages or log into accounts as the deli… [+6924 chars]",https://www.ibtimes.com.au/ups-down-now-ups-website-experiences-intermittent-issues-users-report-tracking-login-problems-1865924,2026-04-09T17:25:37+00:00,Ibtimes.com.au,Daniel Lee,https://d.ibtimes.com.au/en/full/1893529/ups.jpg
Netflix Stock Surges 2.5% as Price Hikes and Ad Tier Momentum Fuel Optimism Ahead of Q1 Earnings,"Netflix Inc. shares climbed more than 2.5% Thursday as investors bet on the streaming giant's latest U.S. price increases and accelerating advertising business to deliver another strong quarter, with first-quarter 2026 results due next week.","Netflix Inc. shares climbed more than 2.5% Thursday as investors bet on the streaming giant's latest U.S. price increases and accelerating advertising business to deliver another strong quarter, with… [+6297 chars]","Netflix Stock Surges 2.5% as Price Hikes and Ad Tier Momentum Fuel Optimism Ahead of Q1 Earnings Netflix Inc. shares climbed more than 2.5% Thursday as investors bet on the streaming giant's latest U.S. price increases and accelerating advertising business to deliver another strong quarter, with first-quarter 2026 results due next week. Netflix Inc. shares climbed more than 2.5% Thursday as investors bet on the streaming giant's latest U.S. price increases and accelerating advertising business to deliver another strong quarter, with… [+6297 chars]",https://www.ibtimes.com.au/netflix-stock-surges-25-price-hikes-ad-tier-momentum-fuel-optimism-ahead-q1-earnings-1865922,2026-04-09T17:20:08+00:00,Ibtimes.com.au,Anthony Will,https://d.ibtimes.com.au/en/full/1892129/netflix-open-2-massive-entertainment-venues-that-will-offer-events-shops-themed-its-famous-shows.jpg
"You’ve heard of K-beauty, now try these J-Beauty bestsellers","I chose the best Japanese skin care products, including editor favorites like cleansers, essences and toners from top-rated brands like Shiseido, DHC, Biore and more.","Youve likely heard about K-beauty and its countless benefits for your skin. But take it from a beauty writer: Japanese skin care, aptly called J-beauty, should also be on your radar if its not alread… [+12794 chars]","You’ve heard of K-beauty, now try these J-Beauty bestsellers I chose the best Japanese skin care products, including editor favorites like cleansers, essences and toners from top-rated brands like Shiseido, DHC, Biore and more. Youve likely heard about K-beauty and its countless benefits for your skin. But take it from a beauty writer: Japanese skin care, aptly called J-beauty, should also be on your radar if its not alread… [+12794 chars]",https://www.nbcnews.com/select/shopping/best-japanese-beauty-products-rcna267486,2026-04-09T17:17:59+00:00,NBC News,Ashley Morris,"https://media-cldnry.s-nbcnews.com/image/upload/t_nbcnews-fp-1200-630,f_auto,q_auto:best/rockcms/2026-04/260406-best-jbeauty-prods-mm-main-31e13f.jpg"
"War, rates, inflation: More headwinds ahead for homebuyers","War, rates, inflation: More headwinds ahead for homebuyersocregister.com","On Feb. 26, right before the Iran war, the average Freddie Mac 30-year mortgage rate dropped to 5.98%.
This week, the rate averaged 6.37%. For an $800,000 mortgage, the payment jumped 4.2% or $202 (… [+5995 chars]","War, rates, inflation: More headwinds ahead for homebuyers War, rates, inflation: More headwinds ahead for homebuyersocregister.com On Feb. 26, right before the Iran war, the average Freddie Mac 30-year mortgage rate dropped to 5.98%. This week, the rate averaged 6.37%. For an $800,000 mortgage, the payment jumped 4.2% or $202 (… [+5995 chars]",https://www.ocregister.com/2026/04/09/war-rates-inflation-more-headwinds-ahead-for-homebuyers/,2026-04-09T17:17:24+00:00,OCRegister,Jeff Lazerson,https://www.ocregister.com/wp-content/uploads/2026/04/OCR-L-REAL-LAZERSON-0412-2.jpg?w=1024&h=682
Trump Administration Targets NFL Over High Costs of Games,The DOJ and FCC are investigating the NFL's national TV deals over concerns that access to games is getting harder and more expensive. It's a review that could benefit Fox and Paramount.,"The Trump administration appears to be launching a full-throated investigation into the most valuable programming in all of television: Games from the National Football League.
Earlier this year the… [+5255 chars]",Trump Administration Targets NFL Over High Costs of Games The DOJ and FCC are investigating the NFL's national TV deals over concerns that access to games is getting harder and more expensive. It's a review that could benefit Fox and Paramount. The Trump administration appears to be launching a full-throated investigation into the most valuable programming in all of television: Games from the National Football League. Earlier this year the… [+5255 chars],http://www.hollywoodreporter.com/business/business-news/trump-administration-targets-nfl-rights-streaming-1236559941/,2026-04-09T17:13:44+00:00,Hollywood Reporter,Alex Weprin,https://www.hollywoodreporter.com/wp-content/uploads/2026/01/GettyImages-2255626190-H-2026.jpg?w=1296&h=730&crop=1
