title,description,content,text_for_analysis,url,published_at,source,author,image_url
KiwiSaver boss pours cold water on Chris Liddell’s AI call-to-arms; surging EV sales confirmed; ChatGPT’s timer fibs – Tech Insider,PLUS: Why does ChatGPT lie?,"In a Herald NOW Businessinterview with Garth Bray, Liddell added that the Government could potentially introduce tax breaks for small to medium businesses that adopt AI.
Liddell didnt seem keen on t… [+8714 chars]","KiwiSaver boss pours cold water on Chris Liddell’s AI call-to-arms; surging EV sales confirmed; ChatGPT’s timer fibs – Tech Insider PLUS: Why does ChatGPT lie? In a Herald NOW Businessinterview with Garth Bray, Liddell added that the Government could potentially introduce tax breaks for small to medium businesses that adopt AI. Liddell didnt seem keen on t… [+8714 chars]",https://www.nzherald.co.nz/business/kiwisaver-boss-pours-cold-water-on-chris-liddells-ai-call-to-arms-exploding-ev-sales-confirmed-chatgpts-timer-fibs-tech-insider/premium/VTF4RFOIKRBIVNR4DWSMAQVEQQ/,2026-04-09T03:04:00+00:00,New Zealand Herald,Chris Keall,https://www.nzherald.co.nz/resizer/v2/T6OOGFV4EZDI7PDKJYDFAGFFAA.jpg?auth=0187ff51df71dadf44f66450359cc6b552ff1efaa8d4baea61b518097962872e&width=1200&height=675&quality=70&smart=true
'Big Short' investor Michael Burry says Anthropic is 'eating Palantir's lunch' as enterprise AI spending shifts,"Michael Burry sees Anthropic's rapid rise as a threat to Palantir, highlighting its appeal among businesses due to ease of AI integration.","Michael Burry has long been bearish on Palantir, but he recently shared a new take on the market's AI darling, comparing its prospects to another titan in the space. 
Anthropic isn't publicly traded… [+2280 chars]","'Big Short' investor Michael Burry says Anthropic is 'eating Palantir's lunch' as enterprise AI spending shifts Michael Burry sees Anthropic's rapid rise as a threat to Palantir, highlighting its appeal among businesses due to ease of AI integration. Michael Burry has long been bearish on Palantir, but he recently shared a new take on the market's AI darling, comparing its prospects to another titan in the space. Anthropic isn't publicly traded… [+2280 chars]",https://www.businessinsider.com/michael-burry-anthropic-palantir-short-ai-stocks-tech-pltr-claude-2026-4,2026-04-08T19:56:03+00:00,Business Insider,sobrient@insider.com (Samuel O'Brient),https://i.insider.com/69d67a971a512d0a63e738ff?width=1200&format=jpeg
Felix launches with $1.7M to reliably automate professional services,"Felix, officially known as Spoken Empathy Systems Inc., launched on Tuesday with $1.7 million in pre-seed funding to expand its platform that automates complex professional workflows without constant human oversight. XYZ Venture Capital led the round with par…","Felix, officially known as Spoken Empathy Systems Inc., launched on Tuesday with $1.7 million in pre-seed funding to expand its platform that automates complex professional workflows without constant… [+3918 chars]","Felix launches with $1.7M to reliably automate professional services Felix, officially known as Spoken Empathy Systems Inc., launched on Tuesday with $1.7 million in pre-seed funding to expand its platform that automates complex professional workflows without constant human oversight. XYZ Venture Capital led the round with par… Felix, officially known as Spoken Empathy Systems Inc., launched on Tuesday with $1.7 million in pre-seed funding to expand its platform that automates complex professional workflows without constant… [+3918 chars]",https://siliconangle.com/2026/04/08/felix-launches-1-7m-reliably-automate-professional-services/,2026-04-08T17:15:32+00:00,SiliconANGLE News,Kyt Dotson,https://d15shllkswkct0.cloudfront.net/wp-content/blogs.dir/1/files/2026/04/A-pixelated-AI-agent-providing-business-insights-to-a-businessman-wearing-a-suit-in-an-office-muted-.jpeg
Leading AI Companies Driving Enterprise Adoption,"Leading AI companies drive enterprise adoption by providing scalable platforms, infrastructure, and solutions that integrate AI into core business operations. This is how they help smaller companies adopt AI solutions without too many headaches. Let's see how…","Artificial Intelligence is quickly becoming a core part of enterprise strategy. Nearly 80% of large companies now use AI in real operations, showing that businesses are moving beyond testing and maki… [+23787 chars]","Leading AI Companies Driving Enterprise Adoption Leading AI companies drive enterprise adoption by providing scalable platforms, infrastructure, and solutions that integrate AI into core business operations. This is how they help smaller companies adopt AI solutions without too many headaches. Let's see how… Artificial Intelligence is quickly becoming a core part of enterprise strategy. Nearly 80% of large companies now use AI in real operations, showing that businesses are moving beyond testing and maki… [+23787 chars]",https://elearningindustry.com/advertise/elearning-marketing-resources/blog/leading-ai-companies-driving-enterprise-adoption,2026-04-08T13:00:38+00:00,Elearningindustry.com,Christopher Pappas,https://cdn.elearningindustry.com/wp-content/uploads/2026/04/Leading-AI-Companies-Driving-Enterprise-Adoption.png
C3 AI debuts agentic tool that transforms natural language prompts into enterprise-grade systems,"C3.ai Inc. has lifted the lid off a new “agentic” software development platform it’s calling C3 Code, which is capable of transforming natural language requests into production-ready applications fully autonomously. Unveiled today, C3 Code is said to shift th…","C3.ai Inc. has lifted the lid off a new agentic software development platform its calling C3 Code, which is capable of transforming natural language requests into production-ready applications fully … [+5838 chars]","C3 AI debuts agentic tool that transforms natural language prompts into enterprise-grade systems C3.ai Inc. has lifted the lid off a new “agentic” software development platform it’s calling C3 Code, which is capable of transforming natural language requests into production-ready applications fully autonomously. Unveiled today, C3 Code is said to shift th… C3.ai Inc. has lifted the lid off a new agentic software development platform its calling C3 Code, which is capable of transforming natural language requests into production-ready applications fully … [+5838 chars]",https://siliconangle.com/2026/04/08/c3-ai-debuts-c3-code-agentic-tool-transforms-natural-language-prompts-enterprise-grade-systems/,2026-04-08T13:00:23+00:00,SiliconANGLE News,Mike Wheatley,https://d15shllkswkct0.cloudfront.net/wp-content/blogs.dir/1/files/2026/04/Screenshot-from-2026-04-08-08-10-18.png
How the math works on a $1.75 trillion SpaceX valuation,"SpaceX would immediately become the sixth most-valuable publicly listed US firm, worth more ​than the likes of Meta Platforms, which has been publicly listed for more than a decade, and Berkshire Hathaway, a company older than SpaceX founder Elon Musk.","Elon Musk's SpaceX is seeking a $1.75 trillion valuation in its forthcoming initial public offering. How far into the stratosphere is that?Going by common Wall Street metrics, the answer is, way out … [+5692 chars]","How the math works on a $1.75 trillion SpaceX valuation SpaceX would immediately become the sixth most-valuable publicly listed US firm, worth more ​than the likes of Meta Platforms, which has been publicly listed for more than a decade, and Berkshire Hathaway, a company older than SpaceX founder Elon Musk. Elon Musk's SpaceX is seeking a $1.75 trillion valuation in its forthcoming initial public offering. How far into the stratosphere is that?Going by common Wall Street metrics, the answer is, way out … [+5692 chars]",https://economictimes.indiatimes.com/tech/technology/how-the-math-works-on-a-1-75-trillion-spacex-valuation/articleshow/130113338.cms,2026-04-08T12:30:44+00:00,The Times of India,Reuters,"https://img.etimg.com/thumb/width-1200,height-900,imgsize-62980,resizemode-75,msid-130113338/tech/technology/how-the-math-works-on-a-1-75-trillion-spacex-valuation.jpg"
"Palantir's AI Powers US Strikes in Iran War, Speeding 'Kill Chain' in First Major AI-Driven Conflict","WASHINGTON — As U.S. and Israeli forces have unleashed more than 11,000 strikes on Iranian targets since late February 2026, Palantir Technologies' artificial intelligence systems have emerged as a central tool in the Pentagon's targeting operations, compress…","WASHINGTON — As U.S. and Israeli forces have unleashed more than 11,000 strikes on Iranian targets since late February 2026, Palantir Technologies' artificial intelligence systems have emerged as a c… [+8422 chars]","Palantir's AI Powers US Strikes in Iran War, Speeding 'Kill Chain' in First Major AI-Driven Conflict WASHINGTON — As U.S. and Israeli forces have unleashed more than 11,000 strikes on Iranian targets since late February 2026, Palantir Technologies' artificial intelligence systems have emerged as a central tool in the Pentagon's targeting operations, compress… WASHINGTON — As U.S. and Israeli forces have unleashed more than 11,000 strikes on Iranian targets since late February 2026, Palantir Technologies' artificial intelligence systems have emerged as a c… [+8422 chars]",https://www.ibtimes.com.au/palantirs-ai-powers-us-strikes-iran-war-speeding-kill-chain-first-major-ai-driven-conflict-1865793,2026-04-08T11:02:40+00:00,Ibtimes.com.au,Daniel Lee,https://d.ibtimes.com.au/en/full/1892608/palantir.jpg
When Flock Comes to Town: Why Cities Are Axing the Controversial Surveillance Technology,"Flock Safety surveillance equipment is appearing in neighborhoods across the country. I spoke with experts about the tech, laws and privacy issues at play.","Early this year, my home city of Bend, Oregon, ended its contract with surveillance company Flock Safety, following months of public pressure and concerns around weak data privacy protections. Flock'… [+22973 chars]","When Flock Comes to Town: Why Cities Are Axing the Controversial Surveillance Technology Flock Safety surveillance equipment is appearing in neighborhoods across the country. I spoke with experts about the tech, laws and privacy issues at play. Early this year, my home city of Bend, Oregon, ended its contract with surveillance company Flock Safety, following months of public pressure and concerns around weak data privacy protections. Flock'… [+22973 chars]",https://www.cnet.com/home/security/when-flock-comes-to-town-why-cities-are-axing-the-controversial-surveillance-technology/,2026-04-08T10:00:00+00:00,CNET,Tyler Lacoma,https://www.cnet.com/a/img/resize/d9a1ad1c04f1050acee2847bf47c758d40ea0122/hub/2026/03/30/20f18d29-c3e9-47d3-8467-1a0ba718fa78/flock-surveillance.png?auto=webp&fit=crop&height=675&width=1200
How the math works on a $1.75 trillion SpaceX valuation,"SpaceX is targeting a $1.75 trillion valuation for its upcoming IPO, aiming to raise over $75 billion. This valuation is driven by its profitable Starlink satellite network and a leading launch business, with investors also factoring in future potential from …","Elon Musk's SpaceX is seeking a $1.75 trillion valuation in its forthcoming initial public offering. How far into the stratosphere is that?Going by common Wall Street metrics, the answer is, way out … [+5696 chars]","How the math works on a $1.75 trillion SpaceX valuation SpaceX is targeting a $1.75 trillion valuation for its upcoming IPO, aiming to raise over $75 billion. This valuation is driven by its profitable Starlink satellite network and a leading launch business, with investors also factoring in future potential from … Elon Musk's SpaceX is seeking a $1.75 trillion valuation in its forthcoming initial public offering. How far into the stratosphere is that?Going by common Wall Street metrics, the answer is, way out … [+5696 chars]",https://economictimes.indiatimes.com/news/international/global-trends/how-the-math-works-on-a-1-75-trillion-spacex-valuation/articleshow/130108166.cms,2026-04-08T09:02:51+00:00,The Times of India,Reuters,"https://img.etimg.com/thumb/msid-130108257,width-1200,height-630,imgsize-69702,overlay-economictimes/articleshow.jpg"
A startup building the Harvey for patent law has raised $40 million,Patlytics raised the new funding after securing more than 40% of the AmLaw 100 firms and growing revenue about 10x in a single year.,"Arthur Jen and Paul Lee.Patlytics
<ul><li>Patlytics builds software for law firms and businesses to automate patent filing and litigation.</li><li>The startup has raised $40 million in new funding, … [+4871 chars]","A startup building the Harvey for patent law has raised $40 million Patlytics raised the new funding after securing more than 40% of the AmLaw 100 firms and growing revenue about 10x in a single year. Arthur Jen and Paul Lee.Patlytics Patlytics builds software for law firms and businesses to automate patent filing and litigation.The startup has raised $40 million in new funding, … [+4871 chars]",https://www.businessinsider.com/patlytics-raises-40-million-funding-patent-law-ip-2026-4,2026-04-08T09:00:01+00:00,Business Insider,Melia Russell,https://i.insider.com/69d3bde5e762ed6cfe44a8eb?width=1200&format=jpeg
"Prediction: This AI Stock Will Be Worth More Than Microsoft, Alphabet, and Palantir Combined by 2030",,"If you click 'Accept all', we and our partners, including 251 who are part of the IAB Transparency &amp; Consent Framework, will also store and / or access information on a device (in other words, us… [+1046 chars]","Prediction: This AI Stock Will Be Worth More Than Microsoft, Alphabet, and Palantir Combined by 2030 If you click 'Accept all', we and our partners, including 251 who are part of the IAB Transparency Consent Framework, will also store and / or access information on a device (in other words, us… [+1046 chars]",https://consent.yahoo.com/v2/collectConsent?sessionId=1_cc-session_f3618605-7560-4376-b00d-c758d79d8753,2026-04-08T06:35:00+00:00,Yahoo Entertainment,,
Attack on Iran's Bushehr reactor would spell disaster,"The recklessness of the US and Israeli bombing attacks on Iran that now threaten to potentially destroy the Bushehr commercial nuclear power plant there, represents a radiological risk of monumental proportions, warned Beyond Nuclear today.The 1,000 megawatt …","The bottom 95% of Americans will generally see higher taxes, according to report author Michael Ettlinger, a senior fellow at ITEP and the University of New Hampshire's Carsey School of Public Policy… [+4379 chars]","Attack on Iran's Bushehr reactor would spell disaster The recklessness of the US and Israeli bombing attacks on Iran that now threaten to potentially destroy the Bushehr commercial nuclear power plant there, represents a radiological risk of monumental proportions, warned Beyond Nuclear today.The 1,000 megawatt … The bottom 95% of Americans will generally see higher taxes, according to report author Michael Ettlinger, a senior fellow at ITEP and the University of New Hampshire's Carsey School of Public Policy… [+4379 chars]",https://www.commondreams.org/newswire/attack-on-iran-s-bushehr-reactor-would-spell-disaster,2026-04-07T17:41:40+00:00,Common Dreams,Newswire Editor,https://www.commondreams.org/media-library/eyJhbGciOiJIUzI1NiIsInR5cCI6IkpXVCJ9.eyJpbWFnZSI6Imh0dHBzOi8vYXNzZXRzLnJibC5tcy8zMjEwMDM4OS9vcmlnaW4ucG5nIiwiZXhwaXJlc19hdCI6MTgxMjIyMDI1N30.ErOfRE5hvYF7nWXKN4iUp2dOTKR2-o5weET2FxMgj9A/image.png?width=210
"Only 2 types of people will survive the AI era, warns Palantir’s billionaire CEO — but there is another way to succeed",Is your career 'AI-proof' in the brave new world?,"Moneywise and Yahoo Finance LLC may earn commission or revenue through links in the content below.
In the age of AI, almost everyone is looking for a way to protect themselves. From recent college g… [+4917 chars]","Only 2 types of people will survive the AI era, warns Palantir’s billionaire CEO — but there is another way to succeed Is your career 'AI-proof' in the brave new world? Moneywise and Yahoo Finance LLC may earn commission or revenue through links in the content below. In the age of AI, almost everyone is looking for a way to protect themselves. From recent college g… [+4917 chars]",https://finance.yahoo.com/sectors/technology/articles/only-2-types-people-survive-171500512.html,2026-04-07T17:15:00+00:00,Yahoo Entertainment,Vishesh Raisinghani,https://s.yimg.com/ny/api/res/1.2/MxaMcmYncrQiOeJ8KupheA--/YXBwaWQ9aGlnaGxhbmRlcjt3PTEyMDA7aD02NzU-/https://media.zenfs.com/en/moneywise_ecomm_711/4fcd18b29a30aea4c5669c524b7e22b3
Analyst Explains Why Ontology Separates Palantir (PLTR) From Peers,"Palantir Technologies Inc. (NASDAQ:PLTR) is one of the 8 Best American Stocks to Buy for the Next 5 Years. On April 2, UBS analyst Karl Keirstead highlighted...","Palantir Technologies Inc. (NASDAQ:PLTR) is one of the 8 Best American Stocks to Buy for the Next 5 Years. On April 2, UBS analyst Karl Keirstead highlighted that Palantir Technologies Inc.s (NASDAQ:… [+2319 chars]","Analyst Explains Why Ontology Separates Palantir (PLTR) From Peers Palantir Technologies Inc. (NASDAQ:PLTR) is one of the 8 Best American Stocks to Buy for the Next 5 Years. On April 2, UBS analyst Karl Keirstead highlighted... Palantir Technologies Inc. (NASDAQ:PLTR) is one of the 8 Best American Stocks to Buy for the Next 5 Years. On April 2, UBS analyst Karl Keirstead highlighted that Palantir Technologies Inc.s (NASDAQ:… [+2319 chars]",https://finance.yahoo.com/markets/stocks/articles/analyst-explains-why-ontology-separates-150759599.html,2026-04-07T15:07:59+00:00,Yahoo Entertainment,Jabran Kundi,https://s.yimg.com/ny/api/res/1.2/s4UDrWURMn1yA..NVJ1GAQ--/YXBwaWQ9aGlnaGxhbmRlcjt3PTEyMDA7aD02NzM-/https://media.zenfs.com/en/insidermonkey.com/2a1e83d3cf1f479e2ed9d6092ca05aaf
Lease roundup: Pura Vida + Pilates and yoga studios on tap across South Florida,"Pura Vida Miami, Jetset Pilates, more | Kendall  Popular South Florida café Pura Vida Miami and three other tenants will open at the Palms at Town & Country retail center in Miami-Dade County’s Kendall neighborhood.  Pura Vida, founded by Omer and Jennifer Ho…","Pura Vida Miami, Jetset Pilates, more | Kendall 
Popular South Florida café Pura Vida Miami and three other tenants will open at the Palms at Town &amp; Country retail center in Miami-Dade Countys K… [+4206 chars]","Lease roundup: Pura Vida + Pilates and yoga studios on tap across South Florida Pura Vida Miami, Jetset Pilates, more | Kendall Popular South Florida café Pura Vida Miami and three other tenants will open at the Palms at Town & Country retail center in Miami-Dade County’s Kendall neighborhood. Pura Vida, founded by Omer and Jennifer Ho… Pura Vida Miami, Jetset Pilates, more | Kendall Popular South Florida café Pura Vida Miami and three other tenants will open at the Palms at Town Country retail center in Miami-Dade Countys K… [+4206 chars]",https://therealdeal.com/miami/2026/04/07/kimco-greystar-terreno-quest-workspaces-score-tenants/,2026-04-07T14:30:00+00:00,The Real Deal,Lidia Dinkova,https://static.therealdeal.com/wp-content/uploads/2026/04/Lease-roundup-Pura-Vida-Pilates-and-yoga-studios-on-tap-across-South-Florida2.jpg
Nobody Knows How to File Taxes on Prediction Market Wins,"Americans flocked to prediction markets last year. Now, it’s time to pay taxes on winnings. How do you do that? Great question.","How do you file taxes on prediction market profits? It seems like the type of straightforward question any halfway decent bookkeeper should be able to answer. Right now, though, its a conundrum for t… [+3480 chars]","Nobody Knows How to File Taxes on Prediction Market Wins Americans flocked to prediction markets last year. Now, it’s time to pay taxes on winnings. How do you do that? Great question. How do you file taxes on prediction market profits? It seems like the type of straightforward question any halfway decent bookkeeper should be able to answer. Right now, though, its a conundrum for t… [+3480 chars]",https://www.wired.com/story/nobody-knows-how-to-file-taxes-on-prediction-market-wins-and-losses/,2026-04-07T09:00:00+00:00,Wired,Kate Knibbs,"https://media.wired.com/photos/69d3f53296de4781bbc4d1b7/191:100/w_1280,c_limit/biz_taxes_GettyImages-1394303654.jpg"
When AI Efficiency Is A Red Flag; Partners Plus Partners,"Doctoring The Ads Days after a glowing report in The New York Times, telehealth startup Medvi faces scrutiny about its use of deceptive AI-generated ad creative.  Medvi was profiled as an example of AI efficiency, having reportedly earned $400 million last ye…","Doctoring The Ads
Days after a glowing report in The New York Times, telehealth startup Medvi faces scrutiny about its use of deceptive AI-generated ad creative. 
Medvi was profiled as an example o… [+5071 chars]","When AI Efficiency Is A Red Flag; Partners Plus Partners Doctoring The Ads Days after a glowing report in The New York Times, telehealth startup Medvi faces scrutiny about its use of deceptive AI-generated ad creative. Medvi was profiled as an example of AI efficiency, having reportedly earned $400 million last ye… Doctoring The Ads Days after a glowing report in The New York Times, telehealth startup Medvi faces scrutiny about its use of deceptive AI-generated ad creative. Medvi was profiled as an example o… [+5071 chars]",http://www.adexchanger.com/daily-news-roundup/2026-07-04/,2026-04-07T04:03:51+00:00,AdExchanger,AdExchanger,https://www.adexchanger.com/wp-content/uploads/2024/11/oasis-thumbnail.jpg
SpaceX’s IPO pitch centres on Elon Musk’s ability to ‘sell the dream’,SpaceX and investment bankers will host meetings to pressure-test the Elon Musk-led company’s targeted US$2 trillion valuation. Read here,"SpaceX and investment bankers will host meetings to pressure-test the Elon Musk-led companys targeted US$2 trillion valuation, a crucial step as it drives toward the largest-ever initial public offer… [+5121 chars]","SpaceX’s IPO pitch centres on Elon Musk’s ability to ‘sell the dream’ SpaceX and investment bankers will host meetings to pressure-test the Elon Musk-led company’s targeted US$2 trillion valuation. Read here SpaceX and investment bankers will host meetings to pressure-test the Elon Musk-led companys targeted US$2 trillion valuation, a crucial step as it drives toward the largest-ever initial public offer… [+5121 chars]",https://financialpost.com/investing/spacexs-ipo-pitch-centres-on-elon-musk,2026-04-06T20:29:33+00:00,Financial Post,Bloomberg News,https://smartcdn.gprod.postmedia.digital/financialpost/wp-content/uploads/2026/04/0407-mg-spacex.jpg
SpaceX’s IPO pitch centres on Elon Musk’s ability to ‘sell the dream’,SpaceX and investment bankers will host meetings to pressure-test the Elon Musk-led company’s targeted US$2 trillion valuation. Read here,"SpaceX and investment bankers will host meetings to pressure-test the Elon Musk-led companys targeted US$2 trillion valuation, a crucial step as it drives toward the largest-ever initial public offer… [+5111 chars]","SpaceX’s IPO pitch centres on Elon Musk’s ability to ‘sell the dream’ SpaceX and investment bankers will host meetings to pressure-test the Elon Musk-led company’s targeted US$2 trillion valuation. Read here SpaceX and investment bankers will host meetings to pressure-test the Elon Musk-led companys targeted US$2 trillion valuation, a crucial step as it drives toward the largest-ever initial public offer… [+5111 chars]",https://financialpost.com/news/economy/spacexs-ipo-pitch-centres-on-elon-musk,2026-04-06T20:29:33+00:00,Financial Post,Bloomberg News,https://smartcdn.gprod.postmedia.digital/financialpost/wp-content/uploads/2026/04/0407-mg-spacex.jpg
"Could NZ’s next Christchurch Call be a push for fairer, safer AI?","Kiwis are using artificial intelligence in growing numbers, but trust is low. Could the push toward safer, more responsible AI offer NZ an economic opportunity?","Getty Images
For New Zealanders, artificial intelligence (AI) is fast becoming as much a part of everyday life as smartphones and social media did before it.

According to the recently released 2026… [+6584 chars]","Could NZ’s next Christchurch Call be a push for fairer, safer AI? Kiwis are using artificial intelligence in growing numbers, but trust is low. Could the push toward safer, more responsible AI offer NZ an economic opportunity? Getty Images For New Zealanders, artificial intelligence (AI) is fast becoming as much a part of everyday life as smartphones and social media did before it. According to the recently released 2026… [+6584 chars]",https://theconversation.com/could-nzs-next-christchurch-call-be-a-push-for-fairer-safer-ai-279085,2026-04-06T18:20:22+00:00,The Conversation Africa,"Andrew Lensen, Senior Lecturer in Artificial Intelligence, Te Herenga Waka — Victoria University of Wellington, Ethan Plaut, Senior Lecturer (Communication) and Asst. Dean (AI for Teaching & Learning) Te Pūtahi Mātauranga | The Faculty of Arts and Education, University of Auckland, Waipapa Taumata Rau, Michael S. Daubs, Senior Lecturer in Media, Film, and Communication, University of Otago, Stephen Hill, Associate Professor of Psychology, Te Kunenga ki Pūrehuroa – Massey University",https://images.theconversation.com/files/726082/original/file-20260325-57-oefmpf.jpg?ixlib=rb-4.1.0&rect=0%2C0%2C6251%2C3125&q=45&auto=format&w=1356&h=668&fit=crop
