title,description,content,text_for_analysis,url,published_at,source,author,image_url
UBS Loves This ‘AI Moat’ at Palantir. Why Analysts Still Think You Should Buy PLTR Stock,,"If you click 'Accept all', we and our partners, including 251 who are part of the IAB Transparency &amp; Consent Framework, will also store and / or access information on a device (in other words, us… [+1046 chars]","UBS Loves This ‘AI Moat’ at Palantir. Why Analysts Still Think You Should Buy PLTR Stock If you click 'Accept all', we and our partners, including 251 who are part of the IAB Transparency Consent Framework, will also store and / or access information on a device (in other words, us… [+1046 chars]",https://consent.yahoo.com/v2/collectConsent?sessionId=1_cc-session_b73d9770-dd88-4599-afe1-9229bd4d6a5d,2026-04-06T17:53:51+00:00,Yahoo Entertainment,,
Forget Palantir: This Beaten-Down “Fed” AI Stock Has More Upside Potential,"Palantir Technologies Inc. (NASDAQ:PLTR) has been one of the most talked-about AI stocks of the past three years, delivering a 524% gain over five years...","<ul><li>Palantir Technologies (PLTR) has delivered a 520% five-year gain and captured retail imagination, but trades at a staggering premium.
</li><li>Booz Allen Hamilton (BAH) serves the identical … [+5002 chars]","Forget Palantir: This Beaten-Down “Fed” AI Stock Has More Upside Potential Palantir Technologies Inc. (NASDAQ:PLTR) has been one of the most talked-about AI stocks of the past three years, delivering a 524% gain over five years... Palantir Technologies (PLTR) has delivered a 520% five-year gain and captured retail imagination, but trades at a staggering premium. Booz Allen Hamilton (BAH) serves the identical … [+5002 chars]",https://247wallst.com/investing/2026/04/06/forget-palantir-this-beaten-down-fed-ai-stock-has-more-upside-potential/,2026-04-06T17:52:22+00:00,24/7 Wall St.,Omor Ibne Ehsan,https://s.yimg.com/ny/api/res/1.2/LgELUdSW.pj0DPhYLqTCqA--/YXBwaWQ9aGlnaGxhbmRlcjt3PTEyMDA7aD04MDA-/https://media.zenfs.com/en/24_7_wall_st__718/4ed390c86572b645313a2b954167a9b1
Tesla just pulled off an EV shocker no one saw coming,"Tesla(TSLA) is back in business after a brutal few quarters. It's at the top of the global battery-electric vehicle market, and the timing could not be more ...","Tesla(TSLA) is back in business after a brutal few quarters. It's at the top of the global battery-electric vehicle market, and the timing could not be more important.
The EV maker said it delivered… [+4344 chars]","Tesla just pulled off an EV shocker no one saw coming Tesla(TSLA) is back in business after a brutal few quarters. It's at the top of the global battery-electric vehicle market, and the timing could not be more ... Tesla(TSLA) is back in business after a brutal few quarters. It's at the top of the global battery-electric vehicle market, and the timing could not be more important. The EV maker said it delivered… [+4344 chars]",https://www.thestreet.com/investing/tesla-just-pulled-off-an-ev-shocker-no-one-saw-coming,2026-04-06T14:37:00+00:00,TheStreet,Faizan Farooque,https://s.yimg.com/os/en/thestreet_881/a103d2a43a66af1ae8f4f52b4d922697
How You Can Use Unusual Options Activity to Stalk Big-Money Trades,This simple guide explains how to use Barchart’s options data to track the institutional trades that could move markets next.,"Most traders watch price. Institutions watch positioning. And more often than not, that positioning shows up in the options market before the stock ever moves.
In a recent video explainer, Barchart … [+4330 chars]","How You Can Use Unusual Options Activity to Stalk Big-Money Trades This simple guide explains how to use Barchart’s options data to track the institutional trades that could move markets next. Most traders watch price. Institutions watch positioning. And more often than not, that positioning shows up in the options market before the stock ever moves. In a recent video explainer, Barchart … [+4330 chars]",https://www.barchart.com/story/news/1158971/how-you-can-use-unusual-options-activity-to-stalk-big-money-trades,2026-04-06T13:39:00+00:00,Barchart.com,Barchart Insights,https://s.yimg.com/ny/api/res/1.2/v8LSYuIdznUg51kfEk49mQ--/YXBwaWQ9aGlnaGxhbmRlcjt3PTEyMDA7aD02NzU-/https://media.zenfs.com/en/barchart_com_477/7eef62370bcc2aaf9b4d83ca3bd124cb
"Geopolitical Risk Analytics Platform Market to Reach USD 15.26 Billion by 2035, Owing to Rising Global Uncertainties and Demand for Real-Time Risk Insights | SNS Insider","The Geopolitical Risk Analytics Platform Market is expanding as organizations adopt AI-driven tools to monitor political and economic risks, with the U.S. segment growing from USD 1.22 billion in 2025 to USD 4.05 billion by 2035. The Geopolitical Risk Analyti…","Austin, April 06, 2026 (GLOBE NEWSWIRE) -- The Geopolitical Risk Analytics Platform Market size was valued at USD 4.02 Billion in 2025 and is projected to reach USD 15.26 Billion by 2035, growing at … [+7761 chars]","Geopolitical Risk Analytics Platform Market to Reach USD 15.26 Billion by 2035, Owing to Rising Global Uncertainties and Demand for Real-Time Risk Insights | SNS Insider The Geopolitical Risk Analytics Platform Market is expanding as organizations adopt AI-driven tools to monitor political and economic risks, with the U.S. segment growing from USD 1.22 billion in 2025 to USD 4.05 billion by 2035. The Geopolitical Risk Analyti… Austin, April 06, 2026 (GLOBE NEWSWIRE) -- The Geopolitical Risk Analytics Platform Market size was valued at USD 4.02 Billion in 2025 and is projected to reach USD 15.26 Billion by 2035, growing at … [+7761 chars]",https://www.globenewswire.com/news-release/2026/04/06/3268496/0/en/Geopolitical-Risk-Analytics-Platform-Market-to-Reach-USD-15-26-Billion-by-2035-Owing-to-Rising-Global-Uncertainties-and-Demand-for-Real-Time-Risk-Insights-SNS-Insider.html,2026-04-06T13:30:00+00:00,GlobeNewswire,SNS Insider pvt ltd,https://ml.globenewswire.com/Resource/Download/d6272c2e-d204-41b8-b545-a6e2e24f85c2
OneMedNet Announces Strong 2025 Financials and Advances AI-Driven iRWD™ powered by Palantir Foundry enabling Conversational Search on Real-Time Medical Data,OneMedNet Announces Strong 2025 Financials and Advances AI-Driven iRWD™ powered by Palantir Foundry enabling Conversational Search on Real-Time Medical Dat,"MINNEAPOLIS, April 06, 2026 (GLOBE NEWSWIRE) -- OneMedNet Corporation (Nasdaq: ONMD) (the OneMedNet, the Company, we, us or our), a leading provider of regulatory decision-grade, AI-Driven Real-World… [+5965 chars]","OneMedNet Announces Strong 2025 Financials and Advances AI-Driven iRWD™ powered by Palantir Foundry enabling Conversational Search on Real-Time Medical Data OneMedNet Announces Strong 2025 Financials and Advances AI-Driven iRWD™ powered by Palantir Foundry enabling Conversational Search on Real-Time Medical Dat MINNEAPOLIS, April 06, 2026 (GLOBE NEWSWIRE) -- OneMedNet Corporation (Nasdaq: ONMD) (the OneMedNet, the Company, we, us or our), a leading provider of regulatory decision-grade, AI-Driven Real-World… [+5965 chars]",https://www.globenewswire.com/news-release/2026/04/06/3268445/0/en/OneMedNet-Announces-Strong-2025-Financials-and-Advances-AI-Driven-iRWD-powered-by-Palantir-Foundry-enabling-Conversational-Search-on-Real-Time-Medical-Data.html,2026-04-06T12:50:00+00:00,GlobeNewswire,OneMedNet Corporation,https://ml.globenewswire.com/Resource/Download/a356ae1d-a3c0-49e3-81b5-f19be76513d0
"IT firms face subdued fourth quarter as war, AI concerns persist; weak rupee helps earnings","IT firms brace for a weak fourth quarter due to war, AI concerns, and a falling rupee impacting earnings.","Top Indian information technology firms are set to report another lacklustre quarter,
with revenue and profit seen rising around 10% year-on-year
largely on a weaker rupee rather than underlying gr… [+2785 chars]","IT firms face subdued fourth quarter as war, AI concerns persist; weak rupee helps earnings IT firms brace for a weak fourth quarter due to war, AI concerns, and a falling rupee impacting earnings. Top Indian information technology firms are set to report another lacklustre quarter, with revenue and profit seen rising around 10% year-on-year largely on a weaker rupee rather than underlying gr… [+2785 chars]",https://www.thehindubusinessline.com/info-tech/it-firms-face-subdued-fourth-quarter-as-war-ai-concerns-persist-weak-rupee-helps-earnings/article70829542.ece,2026-04-06T08:24:25+00:00,BusinessLine,Reuters,https://bl-i.thgim.com/public/incoming/k2ve72/article70829545.ece/alternates/LANDSCAPE_1200/BL19_Think_Data_analysing.jpg
"Indian IT firms face subdued fourth quarter as war, AI concerns persist; weak rupee helps earnings","BENGALURU, April 6 : Top Indian information technology firms are set to report another lacklustre quarter, with revenue and profit seen rising around 10 per cent year-on-year largely on a weaker rupee rather than underlying growth, seven brokerages said.Uncer…","BENGALURU, April 6 : Top Indian information technology firms are set to report another lacklustre quarter, with revenue and profit seen rising around 10 per cent year-on-year largely on a weaker rupe… [+2817 chars]","Indian IT firms face subdued fourth quarter as war, AI concerns persist; weak rupee helps earnings BENGALURU, April 6 : Top Indian information technology firms are set to report another lacklustre quarter, with revenue and profit seen rising around 10 per cent year-on-year largely on a weaker rupee rather than underlying growth, seven brokerages said.Uncer… BENGALURU, April 6 : Top Indian information technology firms are set to report another lacklustre quarter, with revenue and profit seen rising around 10 per cent year-on-year largely on a weaker rupe… [+2817 chars]",https://www.channelnewsasia.com/business/indian-it-firms-face-subdued-fourth-quarter-war-ai-concerns-persist-weak-rupee-helps-earnings-6038721,2026-04-06T08:23:53+00:00,CNA,,"https://dam.mediacorp.sg/image/upload/s--Uo_CJ6lO--/c_fill,g_auto,h_676,w_1200/fl_relative,g_south_east,l_mediacorp:cna:watermark:2024-04:reuters_1,w_0.1/f_auto,q_auto/v1/one-cms/core/2026-04-06T082316Z_1_LYNXMPEM3509L_RTROPTP_3_INDIA-IT-RESULTS-PREVIEW.JPG?itok=MsUexw1L"
"Indian IT firms face subdued fourth quarter as war, AI concerns persist; weak rupee helps earnings","INDIA IT-RESULTS/PREVIEW (PIX):GRAPHIC-Indian IT firms face subdued fourth quarter as war, AI concerns persist; weak rupee helps earnings","By Haripriya Suresh and Bharath Rajeswaran
BENGALURU, April 6 (Reuters) - Top Indian information technology firms are set to report another lacklustre quarter, with revenue and profit seen rising ar… [+2888 chars]","Indian IT firms face subdued fourth quarter as war, AI concerns persist; weak rupee helps earnings INDIA IT-RESULTS/PREVIEW (PIX):GRAPHIC-Indian IT firms face subdued fourth quarter as war, AI concerns persist; weak rupee helps earnings By Haripriya Suresh and Bharath Rajeswaran BENGALURU, April 6 (Reuters) - Top Indian information technology firms are set to report another lacklustre quarter, with revenue and profit seen rising ar… [+2888 chars]",https://www.livemint.com/companies/indian-it-firms-face-subdued-fourth-quarter-as-war-ai-concerns-persist-weak-rupee-helps-earnings-11775463276613.html,2026-04-06T08:14:36+00:00,Livemint,list.metadata.agency,https://www.livemint.com/lm-img/img/2024/12/06/1600x900/logo/company_1_1733464951182_1733464958176.png
Jim Cramer Says “I Don’t Think There’s a Compelling AI Disruption Case Against Shopify”,Shopify Inc. (NASDAQ:SHOP) is among the stocks in focus as Jim Cramer reviewed the S&P 500’s top performers and the Nasdaq 100’s biggest laggards for the...,Shopify Inc. (NASDAQ:SHOP) is among the stocks in focus as Jim Cramer reviewed the S&amp;P 500s top performers and the Nasdaq 100s biggest laggards for the first quarter. Cramer highlighted why the s… [+2484 chars],Jim Cramer Says “I Don’t Think There’s a Compelling AI Disruption Case Against Shopify” Shopify Inc. (NASDAQ:SHOP) is among the stocks in focus as Jim Cramer reviewed the S&P 500’s top performers and the Nasdaq 100’s biggest laggards for the... Shopify Inc. (NASDAQ:SHOP) is among the stocks in focus as Jim Cramer reviewed the SP 500s top performers and the Nasdaq 100s biggest laggards for the first quarter. Cramer highlighted why the s… [+2484 chars],https://finance.yahoo.com/markets/stocks/articles/jim-cramer-says-don-t-034521919.html,2026-04-06T03:45:21+00:00,Yahoo Entertainment,Syeda Seirut Javed,https://s.yimg.com/ny/api/res/1.2/DO.saPQm6rK52MR2jUz0zA--/YXBwaWQ9aGlnaGxhbmRlcjt3PTEyMDA7aD0xODAw/https://media.zenfs.com/en/insidermonkey.com/ae34a08d0d29f0247abd55a0dbd6bb1f
"If You Buy Palantir Stock Today, Here's Where It Could Be in 5 Years",,"If you click 'Accept all', we and our partners, including 251 who are part of the IAB Transparency &amp; Consent Framework, will also store and / or access information on a device (in other words, us… [+1046 chars]","If You Buy Palantir Stock Today, Here's Where It Could Be in 5 Years If you click 'Accept all', we and our partners, including 251 who are part of the IAB Transparency Consent Framework, will also store and / or access information on a device (in other words, us… [+1046 chars]",https://consent.yahoo.com/v2/collectConsent?sessionId=1_cc-session_7d0dc402-0b6b-4a82-8ad8-36b201085d40,2026-04-05T12:50:00+00:00,Yahoo Entertainment,,
"10 Reasons to Buy Palantir Stock in 2026: Explosive AI Growth, Record Contracts and Surging U.S. Demand","Palantir Technologies Inc. (NYSE: PLTR) has emerged as one of the standout artificial intelligence plays of the past several years, and analysts and investors are closely watching whether its momentum can carry into the rest of 2026 despite a volatile start t…","Palantir Technologies Inc. (NYSE: PLTR) has emerged as one of the standout artificial intelligence plays of the past several years, and analysts and investors are closely watching whether its momentu… [+6379 chars]","10 Reasons to Buy Palantir Stock in 2026: Explosive AI Growth, Record Contracts and Surging U.S. Demand Palantir Technologies Inc. (NYSE: PLTR) has emerged as one of the standout artificial intelligence plays of the past several years, and analysts and investors are closely watching whether its momentum can carry into the rest of 2026 despite a volatile start t… Palantir Technologies Inc. (NYSE: PLTR) has emerged as one of the standout artificial intelligence plays of the past several years, and analysts and investors are closely watching whether its momentu… [+6379 chars]",https://www.ibtimes.com.au/10-reasons-buy-palantir-stock-2026-explosive-ai-growth-record-contracts-surging-us-demand-1865446,2026-04-05T12:46:21+00:00,Ibtimes.com.au,Tony Jackson,https://d.ibtimes.com.au/en/full/1893347/10-reasons-buy-palantir-stock-2026.jpg
Top 5 Best Palantir Competitors in 2026 Led by Databricks Snowflake and Microsoft Fabric in Data AI Platforms,"Palantir Technologies remains a powerhouse in big data analytics, artificial intelligence and government contracting in 2026, but several strong competitors are challenging its dominance with scalable cloud platforms, collaborative tools and cost-effective al…","Palantir Technologies remains a powerhouse in big data analytics, artificial intelligence and government contracting in 2026, but several strong competitors are challenging its dominance with scalabl… [+7320 chars]","Top 5 Best Palantir Competitors in 2026 Led by Databricks Snowflake and Microsoft Fabric in Data AI Platforms Palantir Technologies remains a powerhouse in big data analytics, artificial intelligence and government contracting in 2026, but several strong competitors are challenging its dominance with scalable cloud platforms, collaborative tools and cost-effective al… Palantir Technologies remains a powerhouse in big data analytics, artificial intelligence and government contracting in 2026, but several strong competitors are challenging its dominance with scalabl… [+7320 chars]",https://www.ibtimes.com.au/top-5-best-palantir-competitors-2026-led-databricks-snowflake-microsoft-fabric-data-ai-platforms-1865435,2026-04-05T12:11:19+00:00,Ibtimes.com.au,Tony Jackson,https://d.ibtimes.com.au/en/full/1893340/databricks-booth-2023.jpg
Unpacking Peter Thiel's big bet on solar-powered cow collars | TechCrunch,Unpacking Peter Thiel's big bet on solar-powered cow collars | TechCrunchtechcrunch.com,Founders Fund has made its name backing what Peter Thiel calls “zero to one” companies — businesses that don’t just improve on existing ideas but create something entirely new. Its portfolio includes… [+6127 chars],Unpacking Peter Thiel's big bet on solar-powered cow collars | TechCrunch Unpacking Peter Thiel's big bet on solar-powered cow collars | TechCrunchtechcrunch.com Founders Fund has made its name backing what Peter Thiel calls “zero to one” companies — businesses that don’t just improve on existing ideas but create something entirely new. Its portfolio includes… [+6127 chars],https://techcrunch.com/2026/04/04/unpacking-peter-thiels-big-bet-on-solar-powered-cow-collars/,2026-04-04T21:34:32+00:00,TechCrunch,Connie Loizos,https://techcrunch.com/wp-content/uploads/2026/04/Craig-Piggott_Halter-CEO.jpg?w=1200
Investors Are Rotating Out of Palantir. Here's the Growth Stock I'm Buying Instead.,,"If you click 'Accept all', we and our partners, including 251 who are part of the IAB Transparency &amp; Consent Framework, will also store and / or access information on a device (in other words, us… [+1046 chars]","Investors Are Rotating Out of Palantir. Here's the Growth Stock I'm Buying Instead. If you click 'Accept all', we and our partners, including 251 who are part of the IAB Transparency Consent Framework, will also store and / or access information on a device (in other words, us… [+1046 chars]",https://consent.yahoo.com/v2/collectConsent?sessionId=1_cc-session_64e16c91-a9a7-44d9-9488-235e3d1d03ea,2026-04-04T11:35:00+00:00,Yahoo Entertainment,,
How does SpaceX justify a $1.75 trillion valuation?,Starlink’s growth may justify optimism – but critics of Elon Musk say the numbers still require heroic assumptions,"Elon Musks SpaceX is reportedly eyeing a June initial public offering (IPO), one that would value the company at $1.75 trillion (1.52 trillion).
SpaceX is part rocket company, part satellite interne… [+2319 chars]","How does SpaceX justify a $1.75 trillion valuation? Starlink’s growth may justify optimism – but critics of Elon Musk say the numbers still require heroic assumptions Elon Musks SpaceX is reportedly eyeing a June initial public offering (IPO), one that would value the company at $1.75 trillion (1.52 trillion). SpaceX is part rocket company, part satellite interne… [+2319 chars]",https://www.irishtimes.com/your-money/2026/04/04/how-does-spacex-justify-a-175-trillion-valuation/,2026-04-04T04:56:00+00:00,The Irish Times,Proinsias O'Mahony,https://www.irishtimes.com/resizer/v2/DTCBXJ5YK5ZH2IRVEPBYEBKM3E.jpg?smart=true&auth=c2650cdce411be61338b57a746bde0131327d813005ff02214eff84664277d4e&width=1200&height=630
"Big Companies Flock to Florida in 2026 Seeking Lower Taxes, Talent and Lifestyle Perks","MIAMI — Major corporations continue shifting headquarters and key operations to Florida in 2026, drawn by the state's longstanding lack of personal income tax, business-friendly regulations and appealing quality of life that contrast sharply with higher-cost,…","MIAMI — Major corporations continue shifting headquarters and key operations to Florida in 2026, drawn by the state's longstanding lack of personal income tax, business-friendly regulations and appea… [+8128 chars]","Big Companies Flock to Florida in 2026 Seeking Lower Taxes, Talent and Lifestyle Perks MIAMI — Major corporations continue shifting headquarters and key operations to Florida in 2026, drawn by the state's longstanding lack of personal income tax, business-friendly regulations and appealing quality of life that contrast sharply with higher-cost,… MIAMI — Major corporations continue shifting headquarters and key operations to Florida in 2026, drawn by the state's longstanding lack of personal income tax, business-friendly regulations and appea… [+8128 chars]",https://www.ibtimes.com.au/big-companies-flock-florida-2026-seeking-lower-taxes-talent-lifestyle-perks-1865376,2026-04-04T04:53:52+00:00,Ibtimes.com.au,Tony Jackson,https://d.ibtimes.com.au/en/full/1892686/royal-caribbeans-icon-seas-miami-florida.jpg
This company used to make weapons for the Nazis. Now it will do the same for Israel,Volkswagen is planning to convert one of its factories to produce Iron Dome components Read Full Article at RT.com,"One of Germany’s biggest and most iconic car manufacturers, Volkswagen (VW) and one of Israel’s most well-known arms manufacturers, Rafael Advanced Defense Systems, part of the global Rafael Group, a… [+8726 chars]","This company used to make weapons for the Nazis. Now it will do the same for Israel Volkswagen is planning to convert one of its factories to produce Iron Dome components Read Full Article at RT.com One of Germany’s biggest and most iconic car manufacturers, Volkswagen (VW) and one of Israel’s most well-known arms manufacturers, Rafael Advanced Defense Systems, part of the global Rafael Group, a… [+8726 chars]",https://www.rt.com/news/637190-vw-israel-iron-dome/,2026-04-03T17:06:20+00:00,RT,RT,https://mf.b37mrtl.ru/files/2026.04/article/69cfeb7985f54059db60b5ce.jpg
strata-market added to PyPI,"A layered, stateful framework for market regime estimation and decision support","A layered, stateful framework for market regime estimation and decision support.
STRATA does not predict prices. It maintains a continuous internal state representing current market conditions and p… [+8743 chars]","strata-market added to PyPI A layered, stateful framework for market regime estimation and decision support A layered, stateful framework for market regime estimation and decision support. STRATA does not predict prices. It maintains a continuous internal state representing current market conditions and p… [+8743 chars]",https://pypi.org/project/strata-market/,2026-04-03T16:35:31+00:00,Pypi.org,,https://pypi.org/static/images/twitter.abaf4b19.webp
"Here’s Why Palantir Is Winning Everywhere, Except in the Stock Market",,"If you click 'Accept all', we and our partners, including 251 who are part of the IAB Transparency &amp; Consent Framework, will also store and / or access information on a device (in other words, us… [+1046 chars]","Here’s Why Palantir Is Winning Everywhere, Except in the Stock Market If you click 'Accept all', we and our partners, including 251 who are part of the IAB Transparency Consent Framework, will also store and / or access information on a device (in other words, us… [+1046 chars]",https://consent.yahoo.com/v2/collectConsent?sessionId=1_cc-session_3788cba4-438a-4614-8ecf-35d6f2e258d5,2026-04-03T14:23:07+00:00,Yahoo Entertainment,,
Palantir At 80x Earnings: What Revenue Growth Rate Justifies The Valuation?,,"If you click 'Accept all', we and our partners, including 251 who are part of the IAB Transparency &amp; Consent Framework, will also store and / or access information on a device (in other words, us… [+1046 chars]","Palantir At 80x Earnings: What Revenue Growth Rate Justifies The Valuation? If you click 'Accept all', we and our partners, including 251 who are part of the IAB Transparency Consent Framework, will also store and / or access information on a device (in other words, us… [+1046 chars]",https://consent.yahoo.com/v2/collectConsent?sessionId=1_cc-session_ecb818a7-b4cc-4d79-b62c-70fe98dfb4ec,2026-04-03T13:40:12+00:00,Yahoo Entertainment,,
Pyth soars 9% following Polymarket integration. Will it rally higher?,"Key takeaways PYTH is up 9% in the last 24 hours, outperforming other major cryptocurrencies. The rally comes following Pyth Network’s integration with Polymarket. PYTH, the native coin of the Pyth Network, is one of the best performers in the crypto market o…","Key takeaways
<ul><li>PYTH is up 9% in the last 24 hours, outperforming other major cryptocurrencies.</li><li>The rally comes following Pyth Network’s integration with Polymarket.</li></ul>PYTH, the… [+2476 chars]","Pyth soars 9% following Polymarket integration. Will it rally higher? Key takeaways PYTH is up 9% in the last 24 hours, outperforming other major cryptocurrencies. The rally comes following Pyth Network’s integration with Polymarket. PYTH, the native coin of the Pyth Network, is one of the best performers in the crypto market o… Key takeaways PYTH is up 9% in the last 24 hours, outperforming other major cryptocurrencies.The rally comes following Pyth Network’s integration with Polymarket.PYTH, the… [+2476 chars]",https://coinjournal.net/news/pyth-soars-9-following-polymarket-integration-will-it-rally-higher/,2026-04-03T10:13:41+00:00,Coinjournal.net,Hassan Maishera,https://coinjournal.net/wp-content/uploads/2026/04/ChatGPT-Image-Apr-3-2026-11_05_54-AM.png
