source_name,author,title,description,url,url_to_image,published_at,content
ZDNet,Taylor Clemons,"LG C6 vs. LG C5: I compared two generations of OLED TVs, and it was pretty darn close","The LG C6 is a refreshed version of the brand's flagship OLED TV, but is it worth upgrading over the C5?",https://www.zdnet.com/home-and-office/home-entertainment/lg-c6-vs-lg-c5/,https://www.zdnet.com/a/img/resize/1d674835775a27e264e3f8abe70ac0dcbf90fde7/2026/04/07/4a8c1dee-f12d-449e-ab0e-d9164978a4f7/lg-c6-vs-c5.jpg?auto=webp&fit=crop&height=675&width=1200,2026-04-07T18:55:00Z,"Manufacturer or Full Name/ZDNET
Follow ZDNET: Add us as a preferred source on Google.
If you've been looking to upgrade your living room or home theater with a high-end OLED TV, LG is one of the to… [+4802 chars]"
GlobeNewswire,"Nutanix, Inc.","Nutanix to Extend Nutanix Agentic AI, Empowering Neoclouds to Deliver Higher Value AI Services","Nutanix will introduce new capabilities designed to help neoclouds deliver secure, scalable AI services to AI engineers and agentic AI developers....",https://www.globenewswire.com/news-release/2026/04/07/3269562/0/en/Nutanix-to-Extend-Nutanix-Agentic-AI-Empowering-Neoclouds-to-Deliver-Higher-Value-AI-Services.html,https://ml.globenewswire.com/Resource/Download/426e237f-d0dc-485d-9b5d-be003af059b0,2026-04-07T18:30:00Z,"<ul><li>Designed to complement AI infrastructure automation and AI platform services with a new multitenant and AI management portal</li><li>Will enable secure, governed self-service consumption by A… [+14148 chars]"
GlobeNewswire,"Nutanix, Inc.",Nutanix Delivers Complete Platform for the Agentic AI Era,Nutanix today announced new platform capabilities to help organizations with agentic AI workloads and hardware supply constraints....,https://www.globenewswire.com/news-release/2026/04/07/3269563/0/en/Nutanix-Delivers-Complete-Platform-for-the-Agentic-AI-Era.html,https://ml.globenewswire.com/Resource/Download/426e237f-d0dc-485d-9b5d-be003af059b0,2026-04-07T18:30:00Z,"<ul><li>New capabilities for Agentic AI infrastructure will enable enterprises and neoclouds to optimize, govern, and accelerate Agentic AI use cases</li><li>Growing ecosystem of infrastructure, clou… [+21426 chars]"
TechCrunch,Tim Fernholz,Intel signs on to Elon Musk's Terafab chips project | TechCrunch,The partnership brings semiconductor experience to Musk's latest high-tech project.,https://techcrunch.com/2026/04/07/intel-signs-on-to-elon-musks-terafab-chips-project/,https://techcrunch.com/wp-content/uploads/2026/04/HFTb6BbbcAANe5y-e1775584097859.jpeg?w=597,2026-04-07T18:11:13Z,"Intel will join SpaceX and Tesla in an effort to build a new U.S. semiconductor factory in Texas, although the scope of its contributions are unclear.
“Our ability to design, fabricate, and package … [+1647 chars]"
Yahoo Entertainment,,I've Changed My Mind on AMD Stock. The AI Supercycle Has Room for More Than Just Nvidia.,,https://consent.yahoo.com/v2/collectConsent?sessionId=1_cc-session_e4bf7ae9-75c9-4d52-ba41-1ef451386bf7,,2026-04-07T17:20:00Z,"If you click 'Accept all', we and our partners, including 251 who are part of the IAB Transparency &amp; Consent Framework, will also store and / or access information on a device (in other words, us… [+1046 chars]"
TheStreet,Thomas Richmond,"As AMD AI narrative changes, here's what comes next",AMD’s (AMD) AI story is starting to shift. The company is no longer just a beneficiary of rising AI demand. It is now generating meaningful revenue and...,https://www.thestreet.com/investing/stocks/as-amd-ai-narrative-changes-heres-what-comes-next,https://s.yimg.com/os/en/thestreet_881/c7983dd6a337d2c89ec9a93c2f047ab4,2026-04-07T17:07:00Z,"AMDs (AMD) AI story is starting to shift.
The company is no longer just a beneficiary of rising AI demand. It is now generating meaningful revenue and profit from its data-center business, giving in… [+5783 chars]"
Rlsbb.to,Ash,DxO FilmPack 7.22.0.23,"Description: DxO FilmPack 7 is the software that takes your digital images back in time to the golden era of film photography. A tribute to the darkroom, you can explore history and get inspired by beautiful renderings, authentically recreated with scientific…",https://post.rlsbb.to/dxo-filmpack-7-22-0-23/,,2026-04-07T16:09:51Z,"Description: DxO FilmPack 7 is the software that takes your digital images back in time to the golden era of film photography. A tribute to the darkroom, you can explore history and get inspired by b… [+918 chars]"
ComputerWeekly.com,Adrian Bridgwater,Nutanix aligns to agentic AI era with platform & ecosystem overhaul,Nutanix used its .NEXT 2026 Americas conference in Chicago this week to lay out a framework of technologies that it promises will deliver a complete platform for the agentic AI era. The hybrid ...,https://www.computerweekly.com/blog/CW-Developer-Network/Nutanix-aligns-to-agentic-AI-era-with-platform-ecosystem-overhaul,,2026-04-07T14:35:25Z,"Nutanix used its .NEXT 2026 Americas conference in Chicago this week to lay out a framework of technologies that it promises will deliver a complete platform for the agentic AI era.
The hybrid multi… [+11108 chars]"
Techpowerup.com,TheLostSwede,"(PR) ASUS Announces All-New Zenbook Lineup, Now Available in the United States","ASUS today announced the U.S. availability of its latest Zenbook lineup, headlined by the all-new Zenbook A16. Setting a new standard for groundbreaking performance, the Zenbook A16 debuts as the fastest Snapdragon -powered laptop on the market, equipped with…",https://www.techpowerup.com/348047/asus-announces-all-new-zenbook-lineup-now-available-in-the-united-states,https://www.techpowerup.com/img/YqKgXzUx7qWtP3TL.jpg,2026-04-07T14:03:50Z,"ASUS today announced the U.S. availability of its latest Zenbook lineup, headlined by the all-new Zenbook A16. Setting a new standard for groundbreaking performance, the Zenbook A16 debuts as the fas… [+5653 chars]"
MarketWatch,Barbara Kollmeyer,"A generational buying opportunity has opened up for U.S. tech stocks, says Goldman Sachs","Investors are now faced with the best opportunity in decades to buy beaten-down tech stocks, say Goldman Sachs strategists.",https://www.marketwatch.com/story/a-generational-buying-opportunity-has-opened-up-for-u-s-tech-stocks-says-goldman-sachs-df565a1c,https://s.yimg.com/ny/api/res/1.2/68q2eEWTu6Q9aXBhtpsWlg--/YXBwaWQ9aGlnaGxhbmRlcjt3PTEyMDA7aD02MDA-/https://media.zenfs.com/en/marketwatch_hosted_869/0747f91f2536059ceffb5804198b5741,2026-04-07T13:44:00Z,"Goldman sees a rare buying opportunity for beaten-down U.S. tech stocks right now. - angela weiss/Agence France-Presse/Getty Images
Tech stocks are suffering their worst stretch of performance again… [+6901 chars]"
GlobeNewswire,MEXT,MEXT Introduces AI-Driven Memory Optimization to Help Curb Rising Infrastructure Costs,MEXT AI-Powered Predictive Memory™ software expands usable memory capacity while enabling enterprises to control escalating infrastructure costs MEXT AI-Powered Predictive Memory™ software expands usable memory capacity while enabling enterprises to control e…,https://www.globenewswire.com/news-release/2026/04/07/3269309/0/en/MEXT-Introduces-AI-Driven-Memory-Optimization-to-Help-Curb-Rising-Infrastructure-Costs.html,,2026-04-07T13:30:00Z,"SANTA CLARA, Calif., April 07, 2026 (GLOBE NEWSWIRE) -- As AI infrastructure drives an unprecedented surge in memory demand, DRAM has become the scarcest and most expensive resource in computing. Tod… [+5808 chars]"
The Verge,Antonio G. Di Benedetto,Asus’ lightweight 16-inch laptop is a formidable MacBook Air alternative,"I already put Asus' new Zenbook A16 through the wringer when I brought a pre-production unit with me to CES. I loved it for its ample power in an impressively light 16-inch chassis. It's speedy enough for part-time content creation, it's got lengthy battery l…",https://www.theverge.com/tech/907864/asus-zenbook-a16-snapdragon-x2-elite-extreme-review,https://platform.theverge.com/wp-content/uploads/sites/2/2026/04/268251_Asus_Zenbook_A16_laptop_review_ADiBenedetto_0001.jpg?quality=90&strip=all&crop=0%2C10.732984293194%2C100%2C78.534031413613&w=1200,2026-04-07T13:07:56Z,"<ul><li></li><li></li><li></li></ul>
The Zenbook A16 is a large laptop that weighs very little and performs great.
If you buy something from a Verge link, Vox Media may earn a commission. See our e… [+12056 chars]"
TechCrunch,Rebecca Bellan,"The AI gold rush is pulling private wealth into riskier, earlier bets  | TechCrunch","On a recent episode of Equity, we talked to Arena Private Wealth to explore a growing trend: family offices bypassing VCs to gain direct exposure to AI startups, turning them from passive investors into active participants.",https://techcrunch.com/2026/04/07/the-ai-gold-rush-is-pulling-private-wealth-into-riskier-earlier-bets/,"https://techcrunch.com/wp-content/uploads/2026/04/GettyImages-493527752.jpg?resize=1200,906",2026-04-07T13:00:53Z,"For decades, buying stock in a hot startup meant being allowed to invest in the funds run by the top VCs. But with the AI boom causing an investment frenzy, more family offices and private wealth are… [+4180 chars]"
GlobeNewswire,"Outlook Therapeutics, Inc.",Outlook Therapeutics Announces Formal Dispute Resolution Request for ONS-5010/LYTENAVA™ (bevacizumab-vikg) Accepted by FDA,"ISELIN, N.J., April 07, 2026 (GLOBE NEWSWIRE) -- Outlook Therapeutics, Inc. (Nasdaq: OTLK), a biopharmaceutical company focused on enhancing the standard of care for bevacizumab for the treatment of retina diseases, today announced that it submitted a formal …",https://www.globenewswire.com/news-release/2026/04/07/3269178/0/en/Outlook-Therapeutics-Announces-Formal-Dispute-Resolution-Request-for-ONS-5010-LYTENAVA-bevacizumab-vikg-Accepted-by-FDA.html,https://ml.globenewswire.com/Resource/Download/cbff3302-f8d2-466a-beff-8c33252f9c70,2026-04-07T12:50:00Z,"ISELIN, N.J., April 07, 2026 (GLOBE NEWSWIRE) -- Outlook Therapeutics, Inc. (Nasdaq: OTLK), a biopharmaceutical company focused on enhancing the standard of care for bevacizumab for the treatment of … [+7614 chars]"
Tom's Hardware UK,Ben Stockton,"Snag this 1440p iBuyPower gaming PC with a 7800X3D and RTX 5070 for just $2,049 right now — 32GB of fast DDR5 RAM and a 2TB SSD round off powerhouse specs, with an extra $200 off this custom-built AMD rig","Save $200 on this awesome AMD build from iBuyPower, featuring an AMD Ryzen 7 7800X3D, RTX 5070, 32GB of DDR5 RAM, and a 2TB SSD, all for just $2,049 right now.",https://www.tomshardware.com/desktops/gaming-pcs/snag-this-1440p-ibuypower-gaming-pc-with-a-7800x3d-and-rtx-5070-for-just-usd2-049-right-now-32gb-of-fast-ddr5-ram-and-a-2tb-ssd-round-off-powerhouse-specs-with-an-extra-usd200-off-this-custom-built-amd-rig,https://cdn.mos.cms.futurecdn.net/EkvftxWompsDJTd5ikSXtQ-1920-80.jpg,2026-04-07T12:11:55Z,"There's a seriously great saving to be had on a brand new, custom-built gaming PC from builders iBuyPower right now. Costing just $2,049 is this customizable iBuyPower rig with an AMD Ryzen 7 7800X3D… [+3180 chars]"
GlobeNewswire,"Cognition Therapeutics, Inc.",Cognition Therapeutics to Present at Needham Virtual Healthcare Conference,"PURCHASE, N.Y., April 07, 2026 (GLOBE NEWSWIRE) -- Cognition Therapeutics, Inc. (Nasdaq: CGTX), a clinical-stage company developing drugs that treat neurodegenerative disorders, announced that the Company’s president and CEO, Lisa Ricciardi intends to present…",https://www.globenewswire.com/news-release/2026/04/07/3269000/0/en/Cognition-Therapeutics-to-Present-at-Needham-Virtual-Healthcare-Conference.html,https://ml.globenewswire.com/Resource/Download/a14fd627-7ccb-45e2-95fe-792bbfb83231,2026-04-07T11:30:00Z,"PURCHASE, N.Y., April 07, 2026 (GLOBE NEWSWIRE) -- Cognition Therapeutics, Inc. (Nasdaq: CGTX), a clinical-stage company developing drugs that treat neurodegenerative disorders, announced that the Co… [+7032 chars]"
Tom's Hardware UK,Luke James,Broadcom to supply Anthropic with 3.5 gigawatts of Google TPU capacity from 2027 — Claude pioneer says its annual revenue run rate has passed $30 billion,Broadcom disclosed in a securities filing on Monday that it’ll supply Anthropic with roughly 3.5 gigawatts of Google TPU capacity starting in 2027.,https://www.tomshardware.com/tech-industry/broadcom-expands-anthropic-deal-to-3-5gw-of-google-tpu-capacity-from-2027,https://cdn.mos.cms.futurecdn.net/zbt6xP22zQEtnhcUBfMSvS-2000-80.jpg,2026-04-07T11:26:13Z,"Broadcom disclosed in a securities filing on Monday that it’ll supply Anthropic with roughly 3.5 gigawatts of Google TPU capacity starting in 2027, and separately committed to designing and supplying… [+3249 chars]"
Barchart.com,Oleksandr Pylypenko,Stock Index Futures Slip as Trump’s Hormuz Deadline Looms,"June S&P 500 E-Mini futures (ESM26) are down -0.26%, and June Nasdaq 100 E-Mini futures (NQM26) are down -0.38% this morning as investors remain wary ahead...",https://www.barchart.com/story/news/1171867/stock-index-futures-muted-as-trumps-hormuz-deadline-looms,https://s.yimg.com/ny/api/res/1.2/Sxsc7AGptQxSOfq4Q2t5Uw--/YXBwaWQ9aGlnaGxhbmRlcjt3PTEyMDA7aD04MDA-/https://media.zenfs.com/en/barchart_com_477/ae7ee21b7adc3615d29d0e151145646a,2026-04-07T10:34:51Z,"June S&amp;P 500 E-Mini futures (ESM26) are down -0.26%, and June Nasdaq 100 E-Mini futures (NQM26) are down -0.38% this morning as investors remain wary ahead of President Trumps deadline for Iran t… [+10553 chars]"
PCWorld,Author: Matthew S. Smith,HyperX Omen OLED 27q review: This monitor is a budget champ,"At a glance
Expert's Rating


Pros

<ul>
<li>Excellent color performance and accuracy</li>



<li>Solid motion clarity for the price</li>



<li>Affordable $499.99 MSRP</li>
</ul>





Cons

<ul>
<li>Lacks USB connectivity</li>



<li>Limited image quali…",https://www.pcworld.com/article/3106098/hyperx-omen-oled-27q-review.html,https://www.pcworld.com/wp-content/uploads/2026/04/hyperx-omen-oled-27q-1.jpeg?quality=50&strip=all&w=1024,2026-04-07T10:30:00Z,"Skip to contentType your search and hit enter
When you purchase through links in our articles, we may earn a small commission. This doesn't affect our editorial independence
.
At a glance
<ul><li… [+11440 chars]"
Techpowerup.com,btarunr,(PR) IBASE Introduces MBB1002 AI-Ready eATX Motherboard,"IBASE Technology Inc., a leading manufacturer of embedded and edge computing solutions, launches the MBB1002, a powerful AI-ready eATX motherboard engineered to accelerate next-generation edge AI and data-intensive applications. Powered by AMD EPYC Embedded 8…",https://www.techpowerup.com/348038/ibase-introduces-mbb1002-ai-ready-eatx-motherboard,https://www.techpowerup.com/img/kgLRzJVkLXnBje6Z.jpg,2026-04-07T09:45:15Z,"IBASE Technology Inc., a leading manufacturer of embedded and edge computing solutions, launches the MBB1002, a powerful AI-ready eATX motherboard engineered to accelerate next-generation edge AI and… [+1802 chars]"
Geeky Gadgets,Julian Horsey,Why the Intel Arc Pro B70 Might Be the Ultimate Budget GPU for Local AI,"The Intel Arc Pro B70 is a professional-grade GPU designed to meet the needs of AI professionals and computational workloads, offering a balance between affordability and performance. With 32 GB of VRAM and a price under $1,000, it provides a cost-effective a…",https://www.geeky-gadgets.com/arc-pro-b70-benchmarks/,https://www.geeky-gadgets.com/wp-content/uploads/2026/04/intel-arc-pro-b70-vs-rtx-pro-4000.jpg,2026-04-07T09:41:00Z,"The Intel Arc Pro B70 is a professional-grade GPU designed to meet the needs of AI professionals and computational workloads, offering a balance between affordability and performance. With 32 GB of V… [+7615 chars]"
Yahoo Entertainment,Muhammad Ali Khalid,Wells Fargo Maintains Overweight Rating for Advanced Micro Devices (AMD),"Advanced Micro Devices Inc. (NASDAQ:AMD) is one of the 10 best AI chip stocks to buy according to hedge funds. On April 1, Wells Fargo maintained the price...",https://finance.yahoo.com/markets/stocks/articles/wells-fargo-maintains-overweight-rating-090145638.html,https://s.yimg.com/os/en/insidermonkey.com/fe0b16308278491a239b6a2819deebec,2026-04-07T09:01:45Z,"Advanced Micro Devices Inc. (NASDAQ:AMD) is one of the 10 best AI chip stocks to buy according to hedge funds.
On April 1, Wells Fargo maintained the price target on Advanced Micro Devices Inc. (NAS… [+1892 chars]"
TweakTown,Kosta Andreadis,Corsair's Ryzen AI MAX 'Strix Halo' AI Workstation 300 PC is now a lot more expensive,"Corsair's flagship AI Workstation 300 Desktop PC with its AMD Ryzen AI MAX+ 395 'Strix Halo' APU just got an $1,100 price increase.Continue reading at TweakTown",https://www.tweaktown.com/news/110905/corsairs-ryzen-ai-max-strix-halo-ai-workstation-300-pc-is-now-a-lot-more-expensive/index.html,https://static.tweaktown.com/news/1/1/110905_1_corsairs-ryzen-ai-max-strix-halo-workstation-300-pcs-are-now-lot-more-expensive_full.jpg,2026-04-07T04:03:02Z,"Corsair released its AI-focused AI Workstation 300 Desktop PC line last year, with the compact devices sporting powerful Ryzen AI MAX hardware with integrated Radeon graphics, and up to 128GB of unif… [+1370 chars]"
SamMobile,Asif Iqbal Shaik,"Samsung’s profit surged 8x in Q1 2026, driven by AI data center boom","Samsung announced today that its revenue reached KRW 133 trillion (around $100 billion) during the first quarter (Q1) of this year, while its operating profit stood at KRW 57.2 trillion (around $43 billion). That marks an eightfold increase compared to its pr…",https://www.sammobile.com/news/samsungs-q1-2026-profit-8x-ai-data-centre-boom/,https://www.sammobile.com/wp-content/uploads/2026/01/Samsung-Logo-CES-2026-1-1200x675.jpg,2026-04-07T03:31:18Z,"Samsung announced today that its revenue reached KRW 133 trillion (around $100 billion) during the first quarter (Q1) of this year, while its operating profit stood at KRW 57.2 trillion (around $43 b… [+1434 chars]"
TweakTown,Kosta Andreadis,Lenovo Legion Go 2 handheld prices soar by up to $650 due to the memory crisis,The flagship AMD Ryzen Z2 Extreme-powered Lenovo Legion Go 2 PC gaming handheld just got a massive $650 price increase thanks to the current memory crisis.Continue reading at TweakTown,https://www.tweaktown.com/news/110904/lenovo-legion-go-2-handheld-prices-soar-by-up-to-dollars650-due-to-the-memory-crisis/index.html,https://static.tweaktown.com/news/1/1/110904_1_lenovo-legion-go-2-handheld-prices-soar-by-up-to-650-due-the-memory-crisis_full.jpg,2026-04-07T03:31:02Z,"As an Amazon Associate, we earn from qualifying purchases. TweakTown may also earn commissions from Best Buy and other affiliate partners at no extra cost to you.It's no secret that the memory and st… [+1735 chars]"
Mercola.com,communities@mercola.com (Dr. Joseph Mercola),The Vast Dangers of Corticosteroids and the Safe Treatments for Autoimmunity,"A New Series of Health Insights Is on the Way




IMPORTANT


A New Series of Health Insights Is on the Way

Our team has been working behind the scenes to prepare new research and practical health strategies for our readers. While we finish preparing wha…",https://articles.mercola.com/sites/articles/archive/2026/04/07/vast-dangers-of-corticosteroids.aspx,https://media.mercola.com/ImageServer/Public/2025/May/FB/vast-dangers-of-corticosteroids-fb.jpg,2026-04-07T00:00:00Z,"A New Series of Health Insights Is on the Way
To regulate itself, the body often relies upon sensors that detect something amiss and then emit a signal that is amplified by the body so that a proces… [+20991 chars]"
SiliconANGLE News,Mark Albertson,Building for AI: Hybrid cloud strategy and partnerships power Nutanix’s ISV edge,"There is a massive investment underway in building digital infrastructure for the AI era, and enterprises are on the hunt for IT providers who offer complete solutions. This scenario sets up well for independent software vendors such as Nutanix Inc. who can o…",https://siliconangle.com/2026/04/06/ai-digital-infrastructure-hybrid-cloud-nutanix-nutanixnext/,https://d15shllkswkct0.cloudfront.net/wp-content/blogs.dir/1/files/2026/04/Industrial-scene-with-cloud-technologies-and-AI.png,2026-04-06T21:04:56Z,"There is a massive investment underway in building digital infrastructure for the AI era, and enterprises are on the hunt for IT providers who offer complete solutions. This scenario sets up well for… [+10640 chars]"
Yahoo Entertainment,,AMD Stock Pullback: Is Now the Time to Buy for Big Gains or Should You Avoid the Dip?,,https://consent.yahoo.com/v2/collectConsent?sessionId=1_cc-session_0c590e31-43c2-4d90-b439-85c4141b830e,,2026-04-06T19:18:35Z,"If you click 'Accept all', we and our partners, including 251 who are part of the IAB Transparency &amp; Consent Framework, will also store and / or access information on a device (in other words, us… [+1046 chars]"
Tom's Hardware UK,"editors@tomshardware.com (Kunal Khullar) , Kunal Khullar","HP’s flagship Omen Max 45L with an RTX 5090 is on sale for $1,000 off — get a top-shelf 4K gaming PC with 64GB DDR5 and 4TB SSD for $5,499",HP’s Omen Max 45L offers a powerful alternative to building your own PC amid rising component prices.,https://www.tomshardware.com/pc-components/hps-flagship-omen-max-45l-with-an-rtx-5090-is-on-sale-for-usd1-000-off-get-a-top-shelf-4k-gaming-pc-with-64gb-ddr5-and-4tb-ssd-for-usd5-499,https://cdn.mos.cms.futurecdn.net/9KLmwXup57zKJNDjuRs3i6-1920-80.jpg,2026-04-06T16:18:10Z,"Investing in a prebuilt gaming PC is a smart way to tackle the ongoing memory crisis and potentially avoid inflated pricing of RAM, storage, and graphics cards. For those who are on the lookout for t… [+2829 chars]"
Wccftech,Muhammad Zuhair,TSMC Is Set to Talk About the Biggest Risk It Faces with Chip Production Right Now; One That Could Derail the AI Frenzy,"TSMC's earnings call is scheduled for April 16, and one of the key factors the industry is watching is the potential consequence of supply chain disruptions, amid the Middle East crisis. Taiwan's Reliance on LNG Imports From the Middle East Has Turned Out To …",https://wccftech.com/tsmc-is-set-to-talk-about-the-biggest-risk-it-faces-with-chip-production/,https://cdn.wccftech.com/wp-content/uploads/2025/11/TSMC-1.jpg,2026-04-06T15:18:15Z,"TSMC's earnings call is scheduled for April 16, and one of the key factors the industry is watching is the potential consequence of supply chain disruptions, amid the Middle East crisis.
The AI indu… [+2646 chars]"
Barchart.com,Rich Asplund,Stocks Rise Amid Iran Ceasefire Hopes,"The S&P 500 Index ($SPX ) (SPY ) today is up +0.27%, the Dow Jones Industrial Average ($DOWI ) (DIA ) is up +0.19%, and the Nasdaq 100 Index ($IUXX ) (QQQ ) ...",https://www.barchart.com/story/news/1160307/stocks-rise-amid-iran-ceasefire-hopes,https://s.yimg.com/ny/api/res/1.2/F_ZJDS12E4olt5iHV3X55A--/YXBwaWQ9aGlnaGxhbmRlcjt3PTEyMDA7aD04MDA-/https://media.zenfs.com/en/barchart_com_477/fda4fa13493a27d0c8a4c56df32e0629,2026-04-06T15:13:35Z,"The S&amp;P 500 Index ($SPX) (SPY) today is up +0.27%, the Dow Jones Industrial Average ($DOWI) (DIA) is up +0.19%, and the Nasdaq 100 Index ($IUXX) (QQQ) is up +0.41%.  June E-mini S&amp;P futures (… [+6789 chars]"
Tom's Hardware UK,"editors@tomshardware.com (Kunal Khullar) , Kunal Khullar","Grab the Ryzen 7 9800X3D, 32GB of RAM, and MSI X870E bundle and get free 240mm AIO and game — $350 total savings on combo bundle",A high-end AM5 platform bundle that not only cuts costs but also includes a free 240mm AIO cooler and a bundled game.,https://www.tomshardware.com/pc-components/grab-the-ryzen-7-9800x3d-32gb-of-ram-and-msi-x870e-bundle-and-get-free-240mm-aio-and-game-usd350-total-savings-on-combo-bundle,https://cdn.mos.cms.futurecdn.net/SbSG4ALS6NJVL2D3WDZSPR-1920-80.jpg,2026-04-06T15:02:44Z,"PC components, including memory, SSDs, and graphics cards, continue to be priced significantly higher than they were late last year. The AI boom has forced DRAM and NAND manufacturers to prioritize h… [+2626 chars]"
Itsfoss.com,Sourav Rudra,The Linux Kernel is Finally Letting Go of i486 CPU Support,The support remained in the Linux kernel all these years after every other major platform dropped it.,https://itsfoss.com/news/linux-kernel-i486-cpu-support-removal/,https://itsfoss.com/content/images/2026/04/i486-support-linux-kernel-eol-banner.png,2026-04-06T13:44:36Z,"Plenty of CPU architectures have come and gone over the last few decades. The x86 family alone has seen a long line of chips rise to prominence and fade away as newer generations took over.
The i486… [+2710 chars]"
Ibtimes.com.au,Tony Jackson,10 Reasons to Buy Intel Stock in 2026 as Turnaround Gains Momentum,"NEW YORK — Intel Corp. shares have staged a remarkable recovery, climbing more than 100% over the past year and posting double-digit gains in early 2026, as the semiconductor giant executes a high-stakes turnaround centered on advanced manufacturing, artifici…",https://www.ibtimes.com.au/10-reasons-buy-intel-stock-2026-turnaround-gains-momentum-1865555,https://d.ibtimes.com.au/en/full/1879924/executives-silicon-valley-chip-maker-intel-say-fluid-us-trade-policies-regulatory-moves-have.jpg,2026-04-06T11:00:56Z,"NEW YORK — Intel Corp. shares have staged a remarkable recovery, climbing more than 100% over the past year and posting double-digit gains in early 2026, as the semiconductor giant executes a high-st… [+6837 chars]"
