source_name,author,title,description,url,url_to_image,published_at,content
SiliconANGLE News,Kelly Knight,"Today’s applications, tomorrow’s AI workloads — Nutanix is building the platform for both, says CEO","The enterprise computing stack is undergoing its most consequential transformation in decades, as agentic infrastructure shifts from an experimental workload to the organizing logic of every new application. That shift is forcing a fundamental rethink of what…",https://siliconangle.com/2026/04/08/agentic-infrastructure-new-model-ai-enterprise-nutanixnext/,https://d15shllkswkct0.cloudfront.net/wp-content/blogs.dir/1/files/2026/04/IMG_9230.jpg,2026-04-08T23:14:12Z,"The enterprise computing stack is undergoing its most consequential transformation in decades, as agentic infrastructure shifts from an experimental workload to the organizing logic of every new appl… [+5514 chars]"
PhoneArena,Ilia Temelkov,Galaxy S27’s Exynos 2700 processor benchmark leak is all good news,"Samsung may be on the right path with the Exynos 2700 chipset, which will power the Galaxy S27 series.",https://www.phonearena.com/news/galaxy-s27s-exynos-2700-processor-benchmark-leak-is-all-good-news_id179551,https://m-cdn.phonearena.com/images/article/179551-wide-two_1200/Galaxy-S27s-Exynos-2700-processor-benchmark-leak-is-all-good-news.jpg,2026-04-08T21:32:23Z,"Samsung is testing an early version of the Exynos 2700 chipset, as its CPU has shown up in the Geekbench database for the first time. The benchmark, which was spotted by Abhishek Yadav, was run on th… [+2805 chars]"
Liliputing,Brad Linder,Lenovo ThinkPad X13 spec bump brings Intel Panther Lake and AMD Ryzen AI PRO 400 options,"The Lenovo ThinkPad X13 Gen 7 is a thin and light laptop with a starting weight of just 936 grams, or less than 2.1 pounds. Lenovo did not introduce this year’s model during Mobile World Congress in March, instead focusing on the ThinkPad X13 Detachable. But …",https://liliputing.com/lenovo-thinkpad-x13-spec-bump-brings-intel-panther-lake-and-amd-ryzen-ai-pro-400-options/,https://liliputing.com/wp-content/uploads/2026/04/thinkpad-x13_02.jpg,2026-04-08T21:30:22Z,"The Lenovo ThinkPad X13 Gen 7 is a thin and light laptop with a starting weight of just 936 grams, or less than 2.1 pounds. Lenovo did not introduce this year’s model during Mobile World Congress in … [+2549 chars]"
pymnts.com,PYMNTS,"AI Coding Agents Spark Selloff, but Enterprise Software Holds Its Ground","Every few years, a new threat makes enterprise software look fragile. Cloud computing was supposed to kill it. Mobile was supposed to bypass it. It survived both. Now, artificial intelligence (AI) coding agents face their turn. The idea that tools like Claude…",https://www.pymnts.com/artificial-intelligence-2/2026/ai-coding-agents-spark-selloff-but-enterprise-software-holds-its-ground/,https://www.pymnts.com/wp-content/uploads/2026/04/SaaS-AI-agents-digital-transformation.jpeg,2026-04-08T21:09:56Z,"Every few years, a new threat makes enterprise software look fragile. Cloud computing was supposed to kill it. Mobile was supposed to bypass it. It survived both. Now, artificial intelligence (AI) co… [+4036 chars]"
CNET,Joshua Goldman,Computer Won't Run Windows 11? Google's ChromeOS Flex Is a Solid Alternative,Don't rush your old Windows 10 computer to the landfill just yet.,https://www.cnet.com/tech/computing/computer-wont-run-windows-11-googles-chromeos-flex-is-a-solid-alternative/,https://www.cnet.com/a/img/resize/f5647a2d4babfecd3883e7973c6b06ecb53aa7ba/hub/2022/08/25/e21ce503-743e-48b4-8466-97e897c720c6/chromeos-flex-install-05.jpg?auto=webp&fit=crop&height=675&width=1200,2026-04-08T20:31:31Z,"Google is issuing you its periodic reminder that you aren't tethered to Microsoft's operating system if you own a PC. In fact, the search giant is making it easier than ever to switch over to ChromeO… [+8236 chars]"
GlobeNewswire,"Advanced Micro Devices, Inc.",AMD to Report Fiscal First Quarter 2026 Financial Results,"SANTA CLARA, Calif., April 08, 2026 (GLOBE NEWSWIRE) -- AMD (NASDAQ: AMD) announced today that it will report fiscal first quarter 2026 financial results on Tuesday, May 5, 2026, after the market close. Management will conduct a conference call to discuss the…",https://www.globenewswire.com/news-release/2026/04/08/3270525/0/en/AMD-to-Report-Fiscal-First-Quarter-2026-Financial-Results.html,https://ml.globenewswire.com/Resource/Download/9782a337-07ac-424b-9c5a-f9cde47d8d55,2026-04-08T20:15:00Z,"SANTA CLARA, Calif., April 08, 2026 (GLOBE NEWSWIRE) -- AMD (NASDAQ: AMD) announced today that it will report fiscal first quarter 2026 financial results on Tuesday, May 5, 2026, after the market clo… [+1418 chars]"
Windows Central,Alexander Cope,“Still one of my favorites”: This dependable 2‑in‑1 is discounted again while modern laptops remain scarce,"The Lenovo Yoga 7 is a laptop from 2024 built with advanced AI-empowered hardware for powering through office work and creative productivity tasks that still hold in 2026, and it's now on sale for 27%",https://www.windowscentral.com/hardware/laptops/still-one-of-my-favorites-this-dependable-2-in-1-is-discounted-again-while-modern-laptops-remain-scarce,https://cdn.mos.cms.futurecdn.net/tcq9Vrgbk6QCuLX8CHwMsZ-1287-80.jpg,2026-04-08T20:07:00Z,"Many modern 2-in-1 laptops are taking a beating in terms of stock and discount availability thanks to the ongoing RAM Crisis.
In desperate times, it's best to turn to the past, as some older laptops… [+2742 chars]"
Tom's Hardware UK,"ashilov@gmail.com (Anton Shilov) , Anton Shilov",Intel and SambaNova team up on heterogenous AI inference platform — different hardware performs different workloads,"Intel and SambaNova announce heterogeneous inference platform that can take advantage of Intel Xeon 6 CPUs, SambaNova SN50 RDUs, and Nvidia GPUs.",https://www.tomshardware.com/tech-industry/artificial-intelligence/intel-and-sambanova-team-up-on-heterogenous-ai-inference-platform-different-hardware-performs-different-workloads,https://cdn.mos.cms.futurecdn.net/uA6Ne4z4gSbp9nZArMDYK8-1920-80.jpg,2026-04-08T19:45:25Z,"Intel and SambaNova on Wednesday announced their joint production-ready heterogeneous inference architecture that relies on AI accelerators or GPUs for prefill, SambaNova reconfigurable dataflow unit… [+3019 chars]"
Omgubuntu.co.uk,Joey Sneddon,"Little Snitch, the macOS network tool, is now available on Linux","A Linux version of Little Snitch, the iconic network monitoring and firewall tool for macOS, has been released. Little Snitch for Linux is written in Rust and uses eBPF for kernel-level traffic interception (which lets sandboxed code run inside the Linux kern…",https://www.omgubuntu.co.uk/2026/04/little-snitch-linux,https://www.omgubuntu.co.uk/wp-content/uploads/2026/04/littlesnitch-linux-dark-840x603.webp,2026-04-08T18:59:16Z,"A Linux version of Little Snitch, the iconic network monitoring and firewall tool for macOS, has been released.
Little Snitch for Linux is written in Rust and uses eBPF for kernel-level traffic inte… [+2764 chars]"
GlobeNewswire,Lynx Software Technologies Inc.,"Lynx Launches MOSA.ic.AI for Deterministic AI in Safety-Critical Systems, Addressing a $25B Market by 2030","New platform closes the AI Deployment Gap by delivering certifiable AI execution across heterogeneous CPU and GPU architectures, reducing certification complexity and risk New platform closes the AI Deployment Gap by delivering certifiable AI execution across…",https://www.globenewswire.com/news-release/2026/04/08/3270407/0/en/Lynx-Launches-MOSA-ic-AI-for-Deterministic-AI-in-Safety-Critical-Systems-Addressing-a-25B-Market-by-2030.html,https://ml.globenewswire.com/Resource/Download/e9008b8d-31d0-4ae4-b9a7-80bdee588c13,2026-04-08T16:26:00Z,"SAN JOSE, Calif., April 08, 2026 (GLOBE NEWSWIRE) -- Lynx,
 a leader in safe and secure software platforms for mission-critical edge systems, today announced the general availability of LYNX MOSA.ic… [+7967 chars]"
The Next Web,Alina Maria Stan,Intel joins Musk’s Terafab as foundry partner in $25B chip megaproject,"In short: Intel has signed on as the primary foundry partner for Elon Musk’s Terafab, a $25 billion joint venture between Tesla, SpaceX, and xAI targeting a terawatt of AI compute per year, handing the struggling chip giant the marquee customer it has been se…",https://thenextweb.com/news/intel-terafab-elon-musk-foundry-partnership/,https://cdn0.tnwcdn.com/wp-content/blogs.dir/1/files/2026/04/intel-terafab-elon-musk-foundry-partnership.png,2026-04-08T14:59:04Z,"In short: Intel has signed on as the primary foundry partner for Elon Musks Terafab, a $25 billion joint venture between Tesla, SpaceX, and xAI targeting a terawatt of AI compute per year, handing th… [+9451 chars]"
BleepingComputer,Sponsored by Specops Software,"Is a $30,000 GPU Good at Password Cracking?","A $30,000 AI GPU doesn't outperform consumer GPUs at password cracking. Specops explains why attackers don't need exotic hardware to break weak passwords. [...]",https://www.bleepingcomputer.com/news/security/is-a-30-000-gpu-good-at-password-cracking/,https://www.bleepstatic.com/content/posts/2026/04/01/specops-transporter.jpg,2026-04-08T14:00:10Z,"Compute power is growing at an extraordinary pace. The AI surge has driven massive investment in GPUs and specialized ‘accelerators’, with vendors building increasingly powerful hardware to train lar… [+6572 chars]"
Storagereview.com,Dylan Dougherty,Dell PowerEdge R770AP Review: Dell’s Purpose-Built Answer for Latency-Sensitive Workloads,"The Dell PowerEdge R770AP is not a general-purpose server, and that is entirely the point. Where most 2U dual-socket platforms chase flexibility, the R770AP strips it away, trading GPU support, mixed storage options, and raw memory capacity for the highest co…",https://www.storagereview.com/review/dell-poweredge-r770ap-review,https://www.storagereview.com/wp-content/uploads/2026/04/StorageReview-Dell-PowerEdge-R770AP-13.jpg,2026-04-08T13:51:55Z,"The Dell PowerEdge R770AP is not a general-purpose server, and that is entirely the point. Where most 2U dual-socket platforms chase flexibility, the R770AP strips it away, trading GPU support, mixed… [+23901 chars]"
Tom's Hardware UK,Andrew E. Freedman,Asus ROG Xbox Ally review: The cheapest Windows handheld gets points for showing up,"The Asus ROG Xbox Ally is the cheapest Windows-based PC gaming handheld you can get right now, but some technical hitches and a mediocre processor don't help it shine next to the Steam Deck OLED.",https://www.tomshardware.com/video-games/handheld-gaming/asus-rog-xbox-ally-ryzen-z2-a-review,https://cdn.mos.cms.futurecdn.net/tchp7cX2PZ3aSq8TpSFYaf-1920-80.jpg,2026-04-08T13:00:00Z,"Why you can trust Tom's Hardware
Our expert reviewers spend hours testing and comparing products and services so you can choose the best for you. Find out more about how we test.Gaming handhelds are… [+18099 chars]"
The Gadgeteer,Rei Padla,10 Gadgets Everyone’s Quietly Buying in 2026,"The gadget cycle in 2026 isn’t just fast. It’s punishing. Products launch, spike on social, hit backorder, and vanish before most outlets can finish unboxing them. We’ve been tracking the most heat across search trends, Kickstarter campaigns, and reader traff…",https://the-gadgeteer.com/2026/04/08/10-gadgets-everyones-quietly-buying-in-2026/,https://the-gadgeteer.com/wp-content/uploads/2026/04/10-Gadgets-Everyones-Quietly-Buying-in-2026.jpg,2026-04-08T12:30:24Z,"If you buy something from a link in this article, we may earn a commission. Learn more
The gadget cycle in 2026 isnt just fast. Its punishing. Products launch, spike on social, hit backorder, and va… [+8725 chars]"
Tom's Hardware UK,Ben Stockton,"Grab an entire RTX 5090 gaming PC for just $8 more than the GPU itself and score a whopping $1,600 off — huge HP discount requires a $39 controller or monitor to secure you a 4K powerhouse with a 9800X3D, 32GB DDR5, and a 1TB SSD","An epic deal over at HP's website is knocking over $1,600 off the price of this Omen Max gaming PC, fitted with an RTX 5090, 9800X3D, 32GB RAM, and a 1TB SSD, all for just $3,808.69 if you purchase it with a monitor or a $39 accessory.",https://www.tomshardware.com/desktops/gaming-pcs/grab-an-entire-rtx-5090-gaming-pc-for-just-usd8-more-than-the-gpu-itself-and-score-a-whopping-usd1-600-off-huge-hp-discount-requires-a-usd39-controller-or-monitor-to-secure-you-a-4k-powerhouse-with-a-9800x3d-32gb-ddr5-and-a-1tb-ssd,https://cdn.mos.cms.futurecdn.net/Y4SW9iaJ4f2frgmuRF3MtW-1920-80.png,2026-04-08T11:44:59Z,"HP is at it again. There's another huge, almost unbelievable deal to be had right now on the HP Omen Max 45L gaming PC, fitted with a 9800X3D, RTX 5090, and 32GB of DDR5 RAM for just $3,808.69 (custo… [+5460 chars]"
CNET,Adrian Marlow,This Unbelievable Deal Drops This 27-Inch Asus TUF Gaming Monitor to Just $60,Gamers can nab a new monitor for nearly $120 off its list price -- but a deal this good won't last long.,https://www.cnet.com/deals/asus-tuf-gaming-monitor-deal/,https://www.cnet.com/a/img/resize/94a8c2844bdf4567076eb2e88ed17fb32bfcc559/hub/2026/04/08/257345b4-4f08-497d-898d-5bd8533e325c/asus-tuf-gaming-monitor.png?auto=webp&fit=crop&height=675&width=1200,2026-04-08T11:32:00Z,You can grab the 27-inch Asus TUF gaming monitor from Amazon for just $60 right now. That's half off the already discounted price of $120. Just be sure to clip the on-page coupon for the full discoun… [+851 chars]
Tom's Hardware UK,Joe Shields,Get $100 off the ROG Xbox Ally handheld — Ryzen Z2 A-powered version with 16GB of RAM is under $500 again,"Powered by AMD’s Ryzen Z2 A chip and featuring a 120Hz display, the ROG Xbox Ally is now cheaper than ever",https://www.tomshardware.com/pc-components/get-usd100-off-the-rog-xbox-ally-handheld-ryzen-z2-a-powered-version-with-16gb-of-ram-is-under-usd500-again,https://cdn.mos.cms.futurecdn.net/UxAXkioyNFD6SQacS6Dzpn-1920-80.jpg,2026-04-08T11:25:17Z,"The ROG Xbox Ally, one of the first Xbox handheld devices from Microsoft in collaboration with Asus, is now available at a $100 discount on Amazon and Best Buy. Launched at a retail price of $599, yo… [+3640 chars]"
TechRadar,Darren Allan,More RAM price-hike misery? Framework warns of 'volatility and cost increases through the rest of 2026' just as some GPUs suddenly get more expensive,Laptop maker Framework cautions against getting carried away with a 'temporary reprieve' in RAM and SSD price hikes.,https://www.techradar.com/computing/memory/more-ram-price-hike-misery-framework-warns-of-volatility-and-cost-increases-through-the-rest-of-2026-just-as-some-gpus-suddenly-get-more-expensive,https://cdn.mos.cms.futurecdn.net/fB4xhGeRkAJAnQZ5YUNiLR-1920-80.jpg,2026-04-08T11:21:08Z,"<ul><li>Asus RX 9070 XT GPUs have been hit with a sudden price hike in the US</li><li>Framework has warned that while memory costs have stabilized in some areas, this is likely just a temporary repri… [+3962 chars]"
Tom's Hardware UK,Stewart Bendle,"Snap up 32GB of Corsair Vengeance RAM for just $192 when you pair it with AMD's 9800X3D processor and Asus X870E motherboard for $1,054 — bundle also includes a free 240mm AIO cooler and a copy of Crimson Desert","A premium Asus ROG Strix X870E motherboard, 9800X3D, 32GB Corsair Vengeance RAM, a free AIO cooler, and a copy of Crimson Desert are yours for just $1054.98",https://www.tomshardware.com/pc-components/snap-up-32gb-of-corsair-vengeance-ram-for-just-usd192-when-you-pair-it-with-amds-9800x3d-processor-and-asus-x870e-motherboard-for-usd1-054-bundle-also-includes-a-free-240mm-aio-cooler-and-a-copy-of-crimson-desert,https://cdn.mos.cms.futurecdn.net/oLtviEWhHiQBvPJpHy88yZ-1920-80.jpg,2026-04-08T11:21:00Z,More ways to save money on precious RAM: this Newegg combo bundle pairs a premium Asus ROG Strix X870E-E Gaming WiFi Motherboard with 32GB of Corsair Vengeance RGB DDR5-6400 RAM and AMD's Ryzen 7 980… [+2412 chars]
Macworld,Jason Cross,Apple’s chip ‘binning’ explained: What is it and why does it matter?,"Macworld







Over the past several weeks, you’ve probably heard the term “binned” when referring to the chips inside the iPhone 17e and MacBook Neo. But what does it mean? In simple terms, “binning” is the process of taking one whole group of something an…",https://www.macworld.com/article/3107278/apples-chip-binning-explained-what-is-it-and-why-does-it-matter.html,https://www.macworld.com/wp-content/uploads/2026/04/apple-binned-chip-graphic.jpg?quality=50&strip=all&w=1024,2026-04-08T10:30:00Z,"Skip to contentType your search and hit enter
When you purchase through links in our articles, we may earn a small commission. This doesn't affect our editorial independence
.
Over the past severa… [+7502 chars]"
GlobeNewswire,First Atlantic Nickel Corp.,"First Atlantic Nickel Has Commenced Drilling at New Alloy Max Zone Discovery, 7 Km North of RPM Zone, at the Pipestone XL Nickel-Cobalt Alloy Project","Drilling has commenced at First Atlantic's Alloy Max, a new 4 km by 1.2 km awaruite nickel-cobalt discovery at Pipestone XL in central Newfoundland....",https://www.globenewswire.com/news-release/2026/04/08/3269921/0/en/First-Atlantic-Nickel-Has-Commenced-Drilling-at-New-Alloy-Max-Zone-Discovery-7-Km-North-of-RPM-Zone-at-the-Pipestone-XL-Nickel-Cobalt-Alloy-Project.html,https://ml.globenewswire.com/Resource/Download/0d889205-fb7e-475c-8751-5d952cf3ece1,2026-04-08T10:00:00Z,"GRAND FALLS-WINDSOR, Newfoundland and Labrador, April 08, 2026 (GLOBE NEWSWIRE) -- First Atlantic Nickel Corp. (TSXV: FAN) (OTCQB: FANCF) (FSE: P21) (""First Atlantic"" or the ""Company"") is pleased to … [+21889 chars]"
Wccftech,Alessio Palumbo,Gothic Remake Pre-Orders Are Now Open Ahead of the June 5 Launch,"THQ Nordic has officially kicked off pre-orders for the long-awaited Gothic Remake ahead of the game's launch, slated for June 5 on PC, PlayStation 5, and Xbox Series S and X. The PC version is available to purchase for €49.99 and includes a special bonus: th…",https://wccftech.com/gothic-remake-preorders-now-open/,https://cdn.wccftech.com/wp-content/uploads/2026/04/unnamed-32-HD-1920x1080.jpeg,2026-04-08T09:00:00Z,"THQ Nordic has officially kicked off pre-orders for the long-awaited Gothic Remake ahead of the game's launch, slated for June 5 on PC, PlayStation 5, and Xbox Series S and X.
The PC version is avai… [+2412 chars]"
Weandthecolor.com,Dirk Petzold,"The Vavorite Video Editing Software of 2026 for Pros, Beginners & Hobbyists, and the Best Free Alternatives","Here’s Your Complete Guide to the Best Video Editing Software in 2026 for Professionals as Well as Beginners and Hobbyists—Plus the Best Free Alternatives Available Right Now. We expect technology to serve our creative vision instantly and seamlessly, but fin…",https://weandthecolor.com/the-vavorite-video-editing-software-of-2026-for-pros-beginners-hobbyists-and-the-best-free-alternatives/209090,https://weandthecolor.com/wp-content/uploads/2026/04/Best-Video-Editing-Software-2026.webp,2026-04-08T08:29:46Z,"This post contains affiliate links. We may earn a commission if you click on them and make a purchase. It’s at no extra cost to you and helps us run this site. Thanks for your support!
We expect tec… [+12131 chars]"
Ibtimes.com.au,Daniel Lee,"Samsung Electronics Q1 2026 Record Profit $38B: AI Chips Drive Best-Ever Results, Path to Dominance","SEOUL, South Korea — Samsung Electronics Co. on Tuesday reported the strongest quarterly results in South Korean corporate history, posting a preliminary operating profit of 57.2 trillion won ($37.9 billion) for the first quarter of 2026 — an eye-popping 755%…",https://www.ibtimes.com.au/samsung-electronics-q1-2026-record-profit-38b-ai-chips-drive-best-ever-results-path-dominance-1865733,https://d.ibtimes.com.au/en/full/1709620/samsung-crucial-south-koreas-economic-health.jpg,2026-04-08T04:25:42Z,"SEOUL, South Korea — Samsung Electronics Co. on Tuesday reported the strongest quarterly results in South Korean corporate history, posting a preliminary operating profit of 57.2 trillion won ($37.9 … [+5718 chars]"
TweakTown,Kosta Andreadis,ASUS raises prices for its Radeon RX 9070 XT GPUs by up to 17%,The ASUS Prime Radeon RX 9070 XT OC Edition and ASUS TUF GAMING Radeon RX 9070 XT OC Edition GPUs have both received notable price increases.Continue reading at TweakTown,https://www.tweaktown.com/news/110922/asus-raises-prices-for-its-radeon-rx-9070-xt-gpus-by-up-to-17-percent/index.html,https://static.tweaktown.com/news/1/1/110922_1_asus-raises-prices-for-radeon-rx-9070-xt-by-up-to-17-5-in-its-us-store_full.jpg,2026-04-08T03:28:02Z,"As an Amazon Associate, we earn from qualifying purchases. TweakTown may also earn commissions from Newegg and other affiliate partners at no extra cost to you.As spotted by VideoCardz, it looks like… [+1783 chars]"
GlobeNewswire,"Digital Realty Trust, L.P.",Digital Realty Opens First Asia Pacific Innovation Lab in Japan to Help Accelerate AI and Hybrid Cloud Deployment,"Digital Realty today announced the opening of the first Digital Realty Innovation Lab (DRIL) in Asia Pacific, located at the NRT12 in Japan....",https://www.globenewswire.com/news-release/2026/04/08/3269783/0/en/Digital-Realty-Opens-First-Asia-Pacific-Innovation-Lab-in-Japan-to-Help-Accelerate-AI-and-Hybrid-Cloud-Deployment.html,https://ml.globenewswire.com/Resource/Download/806daefd-c19b-4ed9-a50c-dc7d4e9de622,2026-04-08T02:30:00Z,"TOKYO, April 08, 2026 (GLOBE NEWSWIRE) -- Digital Realty (NYSE: DLR), the worlds largest cloud- and carrier-neutral data center platform, today announced the opening of the first Digital Realty Innov… [+7078 chars]"
TweakTown,Aaron Klotz,Core Ultra 7 270K Plus outperforms Ultra 9 285K in Cinebench R23 after a delid and a hefty 5.8GHz overclock,German overclocker Der8auer successfully outperformed an overclocked Core Ultra 9 285K with an overclocked Core Ultra 7 270K Plus in Cinebench R23.Continue reading at TweakTown,https://www.tweaktown.com/news/110919/core-ultra-7-270k-plus-outperforms-ultra-9-285k-in-cinebench-r23-after-a-delid-and-a-hefty-5-8ghz-overclock/index.html,https://static.tweaktown.com/news/1/1/110919_2702851316_this-hardcore-mod-takes-the-270k-plus-beyond-285k_full.png,2026-04-08T00:35:03Z,Overclocking wizard and PC enthusiast Der8auer delidded Intel's latest Core Ultra 7 270K Plus to see how far he could push the CPU. He found his specific sample was capable of achieving 5.8GHz on the… [+2458 chars]
Slickdeals.net,BeigeRoad455,AMD Ryzen 5 5500 + GIGABYTE B550M GAMING X WIFI6 Mobo + Team T-FORCE 16GB DDR4 3600 Memory + ASUS ROG Harpe Mini Mouse + ASUS NC01 Mouse Pad + Rosewill Cordless Air Duster $210.84,Newegg [newegg.com] has AMD Ryzen 5 5500 Zen 3 6-Core Desktop CPU Processor (Wraith Stealth cooler included) + GIGABYTE B550M GAMING X WIFI6 AM4 Micro ATX Motherboard + Team T-FORCE VULCAN Z 16GB (2...,https://slickdeals.net/f/19394721-amd-ryzen-5-5500-gigabyte-b550m-gaming-x-wifi6-mobo-team-t-force-16gb-ddr4-3600-memory-asus-rog-harpe-mini-mouse-asus-nc01-mouse-pad-rosewill-cordless-air-duster-210-84,https://slickdeals.net/attachment/2/9/2/8/0/8/2/0/450x450/20049465.thumb,2026-04-07T23:41:04Z,"As noted in my original deal post, the mouse is a filler item used to allow promo codes to apply to the newegg combo, making this deal $66 cheaper than the official combo price for the cpu+mobo+ram+a… [+2860 chars]"
PlayStation LifeStyle,Nicholas Tan,Sony Fans Are Betting Against a PS6 Reveal in 2026,Multiple reports on the PS6 release date have made many think that the console won't be announced in 2026. Do you think it's still on track?,https://www.playstationlifestyle.net/2026/04/07/ps6-playstation-6-bets-fans-doubt-announcement-2026-2027-release-feature/,"https://www.playstationlifestyle.net/wp-content/uploads/sites/9/2026/04/ps6-playstation-6-bets-fans-doubt-announcement-2026-2027-release-feature.jpg?resize=1200,630",2026-04-07T22:01:27Z,"Amid conflicting rumors on the PS6 release date, most fans dont believe that Sony will announce the console before 2027. Over the last six months, there have been multiple reports on whether the Play… [+3587 chars]"
Afterdawn.com,Petteri Pyyny,Linux will soon ditch 80486 support,"In a way, a historical moment is approaching, as Linux will most likely discontinue support for the 80486 processors by the end of this year.

The Register reported around Easter how changes have already been accepted into the Linux 7.1 codebase, which will r…",https://www.afterdawn.com/news/article.cfm/2026/04/07/linux-will-soon-ditch-80486-support,https://cdn.afterdawn.fi/v3/news/original/linux-penguin-phone-midjourney.png,2026-04-07T21:06:28Z,"The Registerreported around Easter how changes have already been accepted into the Linux 7.1 codebase, which will remove support for the 486 processor family from the Linux kernel (kernel).
The chan… [+775 chars]"
GlobeNewswire,NovaBridge Biosciences,NovaBridge Reports Full Year 2025 Financial Results and Provides Business Update,"ROCKVILLE, Md., April 07, 2026 (GLOBE NEWSWIRE) -- NovaBridge Biosciences (Nasdaq: NBP) (“NovaBridge” or the “Company”), a global biotechnology platform company committed to accelerating access to innovative medicines, today announced financial results for th…",https://www.globenewswire.com/news-release/2026/04/07/3269679/0/en/NovaBridge-Reports-Full-Year-2025-Financial-Results-and-Provides-Business-Update.html,https://ml.globenewswire.com/Resource/Download/0ea9f005-c7f7-4272-a3ac-cbf4ea4aef15,2026-04-07T20:50:00Z,"<ul><li>Successful transformation to global biotech platform with two mid-stage potential best-in-class/first-in-class programs, givastomig and VIS-101, with compelling proof-of-concept data</li><li>… [+58485 chars]"
