title,description,content,text_for_analysis,url,published_at,source,author,image_url
Which teams should take a quarterback in 2026 NFL Draft? Ranking needs for all 32,"Though not every NFL club needs to take a passer during this year's draft, a lot more might need to consider it than you might assume.","While theres a decent amount of mystery regarding what will happen in the 2026 NFL Draft, theres really none at the top, where its virtually inconceivable that the Las Vegas Raiders will do or consid… [+17821 chars]","Which teams should take a quarterback in 2026 NFL Draft? Ranking needs for all 32 Though not every NFL club needs to take a passer during this year's draft, a lot more might need to consider it than you might assume. While theres a decent amount of mystery regarding what will happen in the 2026 NFL Draft, theres really none at the top, where its virtually inconceivable that the Las Vegas Raiders will do or consid… [+17821 chars]",https://www.usatoday.com/story/sports/nfl/draft/2026/04/10/nfl-draft-quarterbacks-ranking-32-teams-by-need-ty-simpson/89548100007/,2026-04-10T11:38:18+00:00,USA Today,"Nate Davis, USA TODAY",https://s.yimg.com/ny/api/res/1.2/awcSMAgulSc9wXgPvPM5OA--/YXBwaWQ9aGlnaGxhbmRlcjt3PTEyMDA7aD04MzI7Y2Y9d2VicA--/https://media.zenfs.com/en/usa_today_sports_articles_558/8907d0fd86dd2d47b61dd534b229eb1d
"What's in a name? It's succession, legacy and celebration in Japan's Kabuki theater","Handing down a name over generations is a central part of the Japanese traditional theater art of Kabuki, and that ceremony gets celebrated at theaters and special events every few years","TOKYO -- Handing down a name over generations is a central part of the Japanese traditional theater art of Kabuki, and that ceremony gets celebrated at theaters and special events every few years.
N… [+5392 chars]","What's in a name? It's succession, legacy and celebration in Japan's Kabuki theater Handing down a name over generations is a central part of the Japanese traditional theater art of Kabuki, and that ceremony gets celebrated at theaters and special events every few years TOKYO -- Handing down a name over generations is a central part of the Japanese traditional theater art of Kabuki, and that ceremony gets celebrated at theaters and special events every few years. N… [+5392 chars]",https://abcnews.com/Entertainment/wireStory/succession-legacy-celebration-japans-kabuki-theater-131905641,2026-04-10T11:37:11+00:00,Abcnews.com,YURI KAGEYAMA Associated Press,https://i.abcnewsfe.com/a/73a830c3-1102-4ca3-895b-3b683725a07c/wirestory_d1e9621bc91385498314f36e1481b6fd_16x9.jpg?w=1600
"With the Pixel 10a, Google may have made the perfect smartphone for seniors","Google’s mid-range Pixel 10a is well suited for older adults who desire instant communication and a greater sense of security, which the Pixel phone series offers.","Every morning, when I go for a walk, I often meet elderly men and women sitting together, chatting. Many of them live alone, as their children have either gone abroad or settled outside Delhi. They d… [+10704 chars]","With the Pixel 10a, Google may have made the perfect smartphone for seniors Google’s mid-range Pixel 10a is well suited for older adults who desire instant communication and a greater sense of security, which the Pixel phone series offers. Every morning, when I go for a walk, I often meet elderly men and women sitting together, chatting. Many of them live alone, as their children have either gone abroad or settled outside Delhi. They d… [+10704 chars]",https://indianexpress.com/article/technology/tech-reviews/google-pixel-10a-review-10629607/,2026-04-10T11:24:04+00:00,The Indian Express,Anuj Bhatia,https://images.indianexpress.com/2026/04/IE-2026-04-10T131913.570.jpg
"Live again: Most affordable M5 MacBook Pro you can buy down at $1,400 on Amazon ($299 under the model Apple sells)","This deal almost surely will not last for long as this is the unicorn 512GB M5 MacBook Pro Apple no longer sells down at $1,399.99 shipped on Amazon right now. That’s the most affordable M5 MacBook Pro out there and one that might be gone for good very soon. …","This deal almost surely will not last for long as this is the unicorn 512GB M5 MacBook Pro Apple no longer sells down at $1,399.99 shipped on Amazon right now. Thats the most affordable M5 MacBook Pr… [+1499 chars]","Live again: Most affordable M5 MacBook Pro you can buy down at $1,400 on Amazon ($299 under the model Apple sells) This deal almost surely will not last for long as this is the unicorn 512GB M5 MacBook Pro Apple no longer sells down at $1,399.99 shipped on Amazon right now. That’s the most affordable M5 MacBook Pro out there and one that might be gone for good very soon. … This deal almost surely will not last for long as this is the unicorn 512GB M5 MacBook Pro Apple no longer sells down at $1,399.99 shipped on Amazon right now. Thats the most affordable M5 MacBook Pr… [+1499 chars]",http://9to5toys.com/2026/04/10/live-most-affordable-m5-macbook-pro/,2026-04-10T11:18:18+00:00,9to5Toys,Justin Kahn,https://i0.wp.com/9to5toys.com/wp-content/uploads/sites/5/2025/10/Apple-M5-MacBook-Pro-best-trade-in-value-2.jpg?resize=1200%2C628&quality=82&strip=all&ssl=1
Retail Stock Traders Turn Into Sellers as Rally Spurs Skepticism,A bout of equities volatility fueled by surging energy prices amid the Iran war is eroding confidence among some of the market’s most reliable bulls: retail investors.,"(Bloomberg) A bout of equities volatility fueled by surging energy prices amid the Iran war is eroding confidence among some of the markets most reliable bulls: retail investors.
THIS CONTENT IS RES… [+5262 chars]",Retail Stock Traders Turn Into Sellers as Rally Spurs Skepticism A bout of equities volatility fueled by surging energy prices amid the Iran war is eroding confidence among some of the market’s most reliable bulls: retail investors. (Bloomberg) A bout of equities volatility fueled by surging energy prices amid the Iran war is eroding confidence among some of the markets most reliable bulls: retail investors. THIS CONTENT IS RES… [+5262 chars],https://financialpost.com/pmn/business-pmn/retail-stock-traders-turn-into-sellers-as-rally-spurs-skepticism,2026-04-10T11:02:26+00:00,Financial Post,Bloomberg News,
Apple’s HomePod Mini 2 Delay is Intentional: The Secret Reason Revealed,"Apple’s decision to withhold updates to the HomePod Mini since its 2020 release has sparked curiosity among tech enthusiasts and industry analysts. While many of Apple’s flagship products receive regular updates, the HomePod Mini has remained largely unchange…",Apples decision to withhold updates to the HomePod Mini since its 2020 release has sparked curiosity among tech enthusiasts and industry analysts. While many of Apples flagship products receive regul… [+5936 chars],"Apple’s HomePod Mini 2 Delay is Intentional: The Secret Reason Revealed Apple’s decision to withhold updates to the HomePod Mini since its 2020 release has sparked curiosity among tech enthusiasts and industry analysts. While many of Apple’s flagship products receive regular updates, the HomePod Mini has remained largely unchange… Apples decision to withhold updates to the HomePod Mini since its 2020 release has sparked curiosity among tech enthusiasts and industry analysts. While many of Apples flagship products receive regul… [+5936 chars]",https://www.geeky-gadgets.com/apple-homepod-2-mini-delay/,2026-04-10T11:00:38+00:00,Geeky Gadgets,Roland Hutchinson,https://www.geeky-gadgets.com/wp-content/uploads/2026/04/HomePod-Mini-2.jpg
"Web Review, Week 2026-15","Let’s go for my web review for the week 2026-15.

France Launches Government Linux Desktop Plan as Windows Exit Begins
Tags: tech, foss, politics, desktop, france, europe
Well, what can I say? This is excellent news and I’m excited to see it happen. Let’s hop…","Let’s go for my web review for the week 2026-15.
France Launches Government Linux Desktop Plan as Windows Exit Begins
Tags: tech, foss, politics, desktop, france, europe
Well, what can I say? This… [+6395 chars]","Web Review, Week 2026-15 Let’s go for my web review for the week 2026-15. France Launches Government Linux Desktop Plan as Windows Exit Begins Tags: tech, foss, politics, desktop, france, europe Well, what can I say? This is excellent news and I’m excited to see it happen. Let’s hop… Let’s go for my web review for the week 2026-15. France Launches Government Linux Desktop Plan as Windows Exit Begins Tags: tech, foss, politics, desktop, france, europe Well, what can I say? This… [+6395 chars]",https://ervin.ipsquad.net/blog/2026/04/10/web-review-week-2026-15/,2026-04-10T10:43:03+00:00,Ipsquad.net,Kevin Ottens,https://ervin.ipsquad.net/home/explore-more-unsplash.jpg
"The 17 greatest bakeries in London, according to Good Food","The Dusty Knuckle, Toad Bakery and Chatsworth Bakehouse made the list alongside one fully gluten free patisserie","Go to the contentGo to the footer
No thanks Awesome, you're subscribed!
Thanks for subscribing! Look out for your first newsletter in your inbox soon!
Déjà vu! We already have this email. Try anot… [+4397 chars]","The 17 greatest bakeries in London, according to Good Food The Dusty Knuckle, Toad Bakery and Chatsworth Bakehouse made the list alongside one fully gluten free patisserie Go to the contentGo to the footer No thanks Awesome, you're subscribed! Thanks for subscribing! Look out for your first newsletter in your inbox soon! Déjà vu! We already have this email. Try anot… [+4397 chars]",https://www.timeout.com/london/news/the-17-greatest-bakeries-in-london-according-to-good-food-041026,2026-04-10T10:16:24+00:00,Time Out,Primary Author: Eloise Feilden,https://media.timeout.com/images/105859959/image.jpg
Apple M5 MacBook Air: Is the 2026 Upgrade Worth It?,"The MacBook Air, once synonymous with lightweight portability and affordability, now finds itself in a challenging position within Apple’s increasingly diverse MacBook lineup. With the introduction of the budget-friendly MacBook Neo and the high-performance M…","The MacBook Air, once synonymous with lightweight portability and affordability, now finds itself in a challenging position within Apple’s increasingly diverse MacBook lineup. With the introduction o… [+6568 chars]","Apple M5 MacBook Air: Is the 2026 Upgrade Worth It? The MacBook Air, once synonymous with lightweight portability and affordability, now finds itself in a challenging position within Apple’s increasingly diverse MacBook lineup. With the introduction of the budget-friendly MacBook Neo and the high-performance M… The MacBook Air, once synonymous with lightweight portability and affordability, now finds itself in a challenging position within Apple’s increasingly diverse MacBook lineup. With the introduction o… [+6568 chars]",https://www.geeky-gadgets.com/apple-m5-macbook-air-2/,2026-04-10T10:00:07+00:00,Geeky Gadgets,Roland Hutchinson,https://www.geeky-gadgets.com/wp-content/uploads/2026/04/M5-MacBook-Air-1.jpg
"What Hippies, Tradwives, and Trump Voters Have in Common","During this year’s Super Bowl, boxer Mike Tyson took a big bite out of an apple in a commercial that commanded us to “eat real food.” The ad felt more like a political gambit than a PSA. Here was a chance to show off the seemingly strange alliance of the seco…","Till Lauer
Get your news from a source thats not owned and controlled by oligarchs. Sign up for the free Mother Jones Daily.
During this years Super Bowl, boxer Mike Tyson took a big bite out of an… [+6119 chars]","What Hippies, Tradwives, and Trump Voters Have in Common During this year’s Super Bowl, boxer Mike Tyson took a big bite out of an apple in a commercial that commanded us to “eat real food.” The ad felt more like a political gambit than a PSA. Here was a chance to show off the seemingly strange alliance of the seco… Till Lauer Get your news from a source thats not owned and controlled by oligarchs. Sign up for the free Mother Jones Daily. During this years Super Bowl, boxer Mike Tyson took a big bite out of an… [+6119 chars]",https://www.motherjones.com/politics/2026/04/natural-maha-trans-rights-hormones-measles-rfk-jr-alex-clark/,2026-04-10T10:00:00+00:00,Mother Jones,Grace Byron,https://www.motherjones.com/wp-content/uploads/2026/03/513_KEYWORD_2000.jpg?w=1200&h=630&crop=1
"U.S. and Iran begin peace talks as Trump’s White House goes to war against the media, insider traders, and the Pope",Everything you need to know before you reach the office this morning.,Oil rose marginally to $97 per barrel this morning. S&amp;P 500 futures were flat before the open in New York. The index closed up 0.62% yesterday. Asia was up strongly today: Japans Nikkei 225 rose … [+8167 chars],"U.S. and Iran begin peace talks as Trump’s White House goes to war against the media, insider traders, and the Pope Everything you need to know before you reach the office this morning. Oil rose marginally to $97 per barrel this morning. SP 500 futures were flat before the open in New York. The index closed up 0.62% yesterday. Asia was up strongly today: Japans Nikkei 225 rose … [+8167 chars]",https://fortune.com/2026/04/10/us-iran-peace-talks-trump-wsj-insider-trading-pope/,2026-04-10T09:57:07+00:00,Fortune,Jim Edwards,"https://fortune.com/img-assets/wp-content/uploads/2026/04/GettyImages-2270167901.jpg?resize=1200,600"
Alphabet steamrolled BI's stock bracket. Here are 4 things your picks revealed.,Bracket voters largely opted for more proven companies that they interact with on a daily basis.,"After three weeks of voting and general bracket madness, First Trade readership has selected ALPHABETas the Magnificent 7 (plus Palantir) stock they'd most like to own for the next 10 years.
The Goo… [+2772 chars]","Alphabet steamrolled BI's stock bracket. Here are 4 things your picks revealed. Bracket voters largely opted for more proven companies that they interact with on a daily basis. After three weeks of voting and general bracket madness, First Trade readership has selected ALPHABETas the Magnificent 7 (plus Palantir) stock they'd most like to own for the next 10 years. The Goo… [+2772 chars]",https://www.businessinsider.com/march-madness-style-bracket-crowned-alphabet-as-top-stock-pick-2026-4,2026-04-10T09:50:01+00:00,Business Insider,jciolli@businessinsider.com (Joe Ciolli),https://i.insider.com/69d812f6f976785dcb190072?width=1200&format=jpeg
DJI's crazy-powerful motor rewrites the ebike rulebook all over again,"The specs race in high-end electric mountain bike motors has long had the feel of the 1990s processor wars – bigger numbers every year, but precious little difference when you're actually grinding through the mud. Avinox might have finally changed that. DJI's…","The specs race in high-end electric mountain bike motors has long had the feel of the 1990s processor wars bigger numbers every year, but precious little difference when you're actually grinding thro… [+4154 chars]","DJI's crazy-powerful motor rewrites the ebike rulebook all over again The specs race in high-end electric mountain bike motors has long had the feel of the 1990s processor wars – bigger numbers every year, but precious little difference when you're actually grinding through the mud. Avinox might have finally changed that. DJI's… The specs race in high-end electric mountain bike motors has long had the feel of the 1990s processor wars bigger numbers every year, but precious little difference when you're actually grinding thro… [+4154 chars]",https://newatlas.com/bicycles/dji-avinox-m2-m2s-drive-system/,2026-04-10T09:46:34+00:00,New Atlas,Omar Kardoudi,https://assets.newatlas.com/dims4/default/adf216c/2147483647/strip/true/crop/1200x630+0+85/resize/1200x630!/quality/85/?url=https%3A%2F%2Fnewatlas-brightspot.s3.amazonaws.com%2F55%2F99%2F6426c482433d93a0a6d2f586b526%2Favinox-m2-m2s-2.jpg&na.image_optimisation=0
Apple seeks Samsung's help to prove it doesn't run a monopoly on iPhone,"Samsung may not be the most willing of allies, though","Apple has reached out to an unlikely ally in its legal battle against the US government longtime rival, Samsung.
Well, it's not really reached out for help. Instead, it's trying to compel Samsung to… [+2054 chars]","Apple seeks Samsung's help to prove it doesn't run a monopoly on iPhone Samsung may not be the most willing of allies, though Apple has reached out to an unlikely ally in its legal battle against the US government longtime rival, Samsung. Well, it's not really reached out for help. Instead, it's trying to compel Samsung to… [+2054 chars]",https://www.androidpolice.com/does-apple-make-it-difficult-to-switch-to-android-apple-is-demanding-data-to-prove-it-doesnt/,2026-04-10T09:45:40+00:00,Android Police,Mark Jansen,https://static0.anpoimages.com/wordpress/wp-content/uploads/wm/2026/03/20260314_134225.jpg?w=1600&h=900&fit=crop
Samsung Galaxy S26 vs iPhone 17: Is Apple is Falling Behind?,"The Galaxy S26 and iPhone 17 represent two distinct approaches to smartphone design and functionality, each catering to different user needs. While the iPhone 17 focuses on delivering a seamless and polished user experience, the Galaxy S26 is designed for pow…","The Galaxy S26 and iPhone 17 represent two distinct approaches to smartphone design and functionality, each catering to different user needs. While the iPhone 17 focuses on delivering a seamless and … [+7004 chars]","Samsung Galaxy S26 vs iPhone 17: Is Apple is Falling Behind? The Galaxy S26 and iPhone 17 represent two distinct approaches to smartphone design and functionality, each catering to different user needs. While the iPhone 17 focuses on delivering a seamless and polished user experience, the Galaxy S26 is designed for pow… The Galaxy S26 and iPhone 17 represent two distinct approaches to smartphone design and functionality, each catering to different user needs. While the iPhone 17 focuses on delivering a seamless and … [+7004 chars]",https://www.geeky-gadgets.com/samsung-galaxy-s26-vs-iphone-17/,2026-04-10T09:30:12+00:00,Geeky Gadgets,Roland Hutchinson,https://www.geeky-gadgets.com/wp-content/uploads/2026/04/snapdragon-8-elite-gen-5-vs-a19-chipset.jpg
Meta's Muse Spark sent its AI app soaring up the App Store rankings,"Apple App Store rankings show Meta Superintelligence Labs struck a chord with the release of its first AI model, Muse Spark.","This is exactly the spark Mark Zuckerberg was hoping for.
According to Sensor Tower's estimates, Meta AI reached an all-time high in daily web visitors in the US. Meta's iOS AI app saw roughly 46,00… [+2171 chars]","Meta's Muse Spark sent its AI app soaring up the App Store rankings Apple App Store rankings show Meta Superintelligence Labs struck a chord with the release of its first AI model, Muse Spark. This is exactly the spark Mark Zuckerberg was hoping for. According to Sensor Tower's estimates, Meta AI reached an all-time high in daily web visitors in the US. Meta's iOS AI app saw roughly 46,00… [+2171 chars]",https://www.businessinsider.com/meta-ai-app-rankings-muse-spark-release-2026-4,2026-04-10T09:26:01+00:00,Business Insider,bgriffiths@insider.com (Brent D. Griffiths),https://i.insider.com/69d8130505c9b303c4e76c8a?width=1200&format=jpeg
Top-Performing Africa Fund Wagers on Urbanization to Drive Gains,A $250-million-dollar London-based equity fund is generating market-leading returns in Africa with wagers on banks and telecommunications companies.,"(Bloomberg) A $250-million-dollar London-based equity fund is generating market-leading returns in Africa with wagers on banks and telecommunications companies.
THIS CONTENT IS RESERVED FOR SUBSCRIB… [+5343 chars]",Top-Performing Africa Fund Wagers on Urbanization to Drive Gains A $250-million-dollar London-based equity fund is generating market-leading returns in Africa with wagers on banks and telecommunications companies. (Bloomberg) A $250-million-dollar London-based equity fund is generating market-leading returns in Africa with wagers on banks and telecommunications companies. THIS CONTENT IS RESERVED FOR SUBSCRIB… [+5343 chars],https://financialpost.com/pmn/business-pmn/top-performing-africa-fund-wagers-on-urbanization-to-drive-gains,2026-04-10T09:20:12+00:00,Financial Post,Bloomberg News,https://smartcdn.gprod.postmedia.digital/financialpost/wp-content/uploads/2026/04/africa-focused-fund-wagers-on-financials-and-telecoms.jpg
"Apple leads smartphone market even as overall shipments decline, Counterpoint says",,"We know it's a hassle to switch browsers but we want your experience with CNA to be fast, secure and the best it can possibly be.
To continue, upgrade to a supported browser or, for the finest exper… [+30 chars]","Apple leads smartphone market even as overall shipments decline, Counterpoint says We know it's a hassle to switch browsers but we want your experience with CNA to be fast, secure and the best it can possibly be. To continue, upgrade to a supported browser or, for the finest exper… [+30 chars]",https://www.channelnewsasia.com/business/apple-leads-smartphone-market-even-overall-shipments-decline-counterpoint-says-6048856,2026-04-10T09:06:06+00:00,CNA,,"https://dam.mediacorp.sg/image/upload/s--JVtH8f8x--/c_fill,g_auto,h_676,w_1200/fl_relative,g_south_east,l_mediacorp:cna:watermark:2024-04:reuters_1,w_0.1/f_auto,q_auto/v1/one-cms/core/2026-04-10T090606Z_1_LYNXMPEM390GF_RTROPTP_3_USA-CHINA-TECH.JPG?itok=417yVMXX"
"Apple leads smartphone market even as overall shipments decline, Counterpoint says","IPhone-maker Apple led global smartphone shipments in the first quarter of ‌2026, growing 5% year-on-year, even as ‌overall shipments fell due to a shortage of...","April 10 (Reuters) - IPhone-maker Apple led global smartphone shipments in the first quarter of 2026, growing 5% year-on-year, even as overall shipments fell due to a shortage of memory components, C… [+1070 chars]","Apple leads smartphone market even as overall shipments decline, Counterpoint says IPhone-maker Apple led global smartphone shipments in the first quarter of ‌2026, growing 5% year-on-year, even as ‌overall shipments fell due to a shortage of... April 10 (Reuters) - IPhone-maker Apple led global smartphone shipments in the first quarter of 2026, growing 5% year-on-year, even as overall shipments fell due to a shortage of memory components, C… [+1070 chars]",https://finance.yahoo.com/markets/stocks/articles/apple-leads-global-smartphone-shipments-090358471.html,2026-04-10T09:03:58+00:00,Yahoo Entertainment,Reuters,https://s.yimg.com/os/en/reuters-finance.com/532d7cab829546b5b30ae9954214f672
Forget the iPhone 18: The iPhone Fold Leaks Reveal a 7.8-Inch Monster,"Apple is reportedly preparing to unveil its first-ever foldable iPhone, a device that could reshape the foldable smartphone landscape. Expected to debut in 2026 alongside the iPhone 18 Pro lineup, this new product marks a significant departure from Apple’s tr…","Apple is reportedly preparing to unveil its first-ever foldable iPhone, a device that could reshape the foldable smartphone landscape. Expected to debut in 2026 alongside the iPhone 18 Pro lineup, th… [+6190 chars]","Forget the iPhone 18: The iPhone Fold Leaks Reveal a 7.8-Inch Monster Apple is reportedly preparing to unveil its first-ever foldable iPhone, a device that could reshape the foldable smartphone landscape. Expected to debut in 2026 alongside the iPhone 18 Pro lineup, this new product marks a significant departure from Apple’s tr… Apple is reportedly preparing to unveil its first-ever foldable iPhone, a device that could reshape the foldable smartphone landscape. Expected to debut in 2026 alongside the iPhone 18 Pro lineup, th… [+6190 chars]",https://www.geeky-gadgets.com/iphone-fold-7-8-display/,2026-04-10T09:00:48+00:00,Geeky Gadgets,Roland Hutchinson,https://www.geeky-gadgets.com/wp-content/uploads/2026/04/liquid-metal-hinge-apple-fold-phone.jpg
TSMC posts 35% jump in revenue to new record high as AI chip demand stays strong,TSMC is benefiting from sustained demand for advanced semiconductors from its key customers like Apple and Nvidia.,"Taiwan Semiconductor Manufacturing Co. on Friday posted another quarter of record revenue driven by demand for AI chips.
For January to March, the world's largest chipmaker reported revenue of 1.13 … [+2288 chars]","TSMC posts 35% jump in revenue to new record high as AI chip demand stays strong TSMC is benefiting from sustained demand for advanced semiconductors from its key customers like Apple and Nvidia. Taiwan Semiconductor Manufacturing Co. on Friday posted another quarter of record revenue driven by demand for AI chips. For January to March, the world's largest chipmaker reported revenue of 1.13 … [+2288 chars]",https://www.cnbc.com/2026/04/10/tsmc-q1-record-revenue-ai-chip-demand-strong.html,2026-04-10T08:13:07+00:00,CNBC,Arjun Kharpal,https://image.cnbcfm.com/api/v1/image/108263658-1770697651993-gettyimages-2251610250-TFSPI_15122025-3274.jpeg?v=1775806078&w=1920&h=1080
