title,description,content,text_for_analysis,url,published_at,source,author,image_url
Withit's Titanium Band for Apple Watch Dresses Up My Look at the Right Price,This link-style band pairs beautifully with my Apple Watch Ultra 3.,"I've always been a wannabe watch person. I see ads for luxury analog watches and admire their design and the precision engineering behind them, but my yearning never compelled me to drop several thou… [+5979 chars]","Withit's Titanium Band for Apple Watch Dresses Up My Look at the Right Price This link-style band pairs beautifully with my Apple Watch Ultra 3. I've always been a wannabe watch person. I see ads for luxury analog watches and admire their design and the precision engineering behind them, but my yearning never compelled me to drop several thou… [+5979 chars]",https://www.cnet.com/tech/mobile/withits-titanium-band-for-apple-watch-dresses-up-my-look-at-the-right-price/,2026-04-09T17:01:09+00:00,CNET,Jeff Carlson,https://www.cnet.com/a/img/resize/09cdac3a8697e90c60222f8f644952c11bad12ef/hub/2026/04/09/dd4a5a6d-cbfa-47e7-9627-5e641babb27d/withit-ti-band-ultra-hero.jpg?auto=webp&fit=crop&height=675&width=1200
How the Los Angeles Festival of Movies Became a ‘Unique and Personal’ Home for Indie Film,"""Everything at our festival is carefully curated,” festival co-founder Micah Gottlieb tells TheWrap
The post How the Los Angeles Festival of Movies Became a ‘Unique and Personal’ Home for Indie Film appeared first on TheWrap.","Micah Gottlieb and Sarah Winshall saw a gap in the Los Angeles film festival scene.
To the outside observer, that might sound a bit silly. Between AFI Fest, Beyond Fest, Animation Is Film Festival a… [+11547 chars]","How the Los Angeles Festival of Movies Became a ‘Unique and Personal’ Home for Indie Film ""Everything at our festival is carefully curated,” festival co-founder Micah Gottlieb tells TheWrap The post How the Los Angeles Festival of Movies Became a ‘Unique and Personal’ Home for Indie Film appeared first on TheWrap. Micah Gottlieb and Sarah Winshall saw a gap in the Los Angeles film festival scene. To the outside observer, that might sound a bit silly. Between AFI Fest, Beyond Fest, Animation Is Film Festival a… [+11547 chars]",https://www.thewrap.com/creative-content/movies/la-festival-of-movies-lafm-2026-micah-gottlieb-interview-mubi/,2026-04-09T17:01:04+00:00,TheWrap,Casey Loving,https://www.thewrap.com/wp-content/uploads/2026/04/LAFM.jpg
MacBook Neo helps power Mac to its best quarter in years,"Mac shipments reach impressive levels in the first quarter of 2026, partially driven by the popularity of the new MacBook Neo.
(via Cult of Mac - Your source for the latest Apple news, rumors, analysis, reviews, how-tos and deals.)","MacBook Neo, MacBook Pro and MacBook Air all pushed up Mac sales in Q1 2026. AI image: Apple/ChatGPT/Cult of Mac
Apple shipped more Macs in the first three months of 2026 than it has in any quarter … [+1633 chars]","MacBook Neo helps power Mac to its best quarter in years Mac shipments reach impressive levels in the first quarter of 2026, partially driven by the popularity of the new MacBook Neo. (via Cult of Mac - Your source for the latest Apple news, rumors, analysis, reviews, how-tos and deals.) MacBook Neo, MacBook Pro and MacBook Air all pushed up Mac sales in Q1 2026. AI image: Apple/ChatGPT/Cult of Mac Apple shipped more Macs in the first three months of 2026 than it has in any quarter … [+1633 chars]",https://www.cultofmac.com/news/mac-shipments-q1-2026,2026-04-09T17:00:35+00:00,Cult of Mac,Ed Hardy,https://www.cultofmac.com/wp-content/uploads/2026/04/MacBook-Neo-Pro-Air-Apple-store.jpg.webp
Ex-apple Engineers Launch Privacy-First AI Wearable,"Image Source – Pixabay
A new AI wearable from two ex-Apple Vision Pro engineers is drawing attention for its privacy-first approach, activating only when tapped rather than constantly listening. Inspired by the iPod Shuffle, its familiar, minimalist design in…","A new AI wearable from two ex-Apple Vision Pro engineers is drawing attention for its privacy-first approach, activating only when tapped rather than constantly listening. Inspired by the iPod Shuffl… [+8334 chars]","Ex-apple Engineers Launch Privacy-First AI Wearable Image Source – Pixabay A new AI wearable from two ex-Apple Vision Pro engineers is drawing attention for its privacy-first approach, activating only when tapped rather than constantly listening. Inspired by the iPod Shuffle, its familiar, minimalist design in… A new AI wearable from two ex-Apple Vision Pro engineers is drawing attention for its privacy-first approach, activating only when tapped rather than constantly listening. Inspired by the iPod Shuffl… [+8334 chars]",https://www.ponoko.com/blog/ponoko/ex-apple-engineers-launch-privacy-first-ai-wearable/,2026-04-09T17:00:00+00:00,Ponoko.com,Robin Mitchell,https://www.ponoko.com/blog/wp-content/uploads/2026/04/0.jpg
"New iPhone Ultra renders, battery capacity, and thickness details leaked",There's more than one reason to get excited for the iPhone Ultra.,"Apple has apparently decided to name the upcoming foldable iPhone the iPhone Ultra. Shortly after the new name leaked, a video came out that provided more renders as well as details about battery cap… [+2027 chars]","New iPhone Ultra renders, battery capacity, and thickness details leaked There's more than one reason to get excited for the iPhone Ultra. Apple has apparently decided to name the upcoming foldable iPhone the iPhone Ultra. Shortly after the new name leaked, a video came out that provided more renders as well as details about battery cap… [+2027 chars]",https://www.phonearena.com/news/new-iphone-ultra-renders-battery-capacity-thickness-details-leaked_id179582,2026-04-09T16:41:47+00:00,PhoneArena,Abdullah Asim,https://m-cdn.phonearena.com/images/article/179582-wide-two_1200/New-iPhone-Ultra-renders-battery-capacity-and-thickness-details-leaked.jpg
"First Person Singularities, Epistemic Supply Chains, and Load Bearing Euphemisms: An Interview with Claude.ai","I woke this morning to news that OpenAI plans on growing its advertising business from zero to more than $100 billion in the next four years. If that sounds utterly bonkers to you, well, you’re not alone. For OpenAI to accomplish such a monumental task, it wo…","Big dreams.
I woke this morning to news that OpenAI plans on growing its advertising business from zero to more than $100 billion in the next four years. If that sounds utterly bonkers to you, well,… [+40656 chars]","First Person Singularities, Epistemic Supply Chains, and Load Bearing Euphemisms: An Interview with Claude.ai I woke this morning to news that OpenAI plans on growing its advertising business from zero to more than $100 billion in the next four years. If that sounds utterly bonkers to you, well, you’re not alone. For OpenAI to accomplish such a monumental task, it wo… Big dreams. I woke this morning to news that OpenAI plans on growing its advertising business from zero to more than $100 billion in the next four years. If that sounds utterly bonkers to you, well,… [+40656 chars]",https://battellemedia.com/archives/2026/04/first-person-singularities-epistemic-supply-chains-and-load-bearing-euphemisms-an-interview-with-claude-ai,2026-04-09T16:29:04+00:00,Battellemedia.com,John Battelle,https://battellemedia.com/wp-content/uploads/2026/04/Screenshot-2026-04-09-at-12.25.57-PM-1024x656.png
Your feedback tool is not there to tell you what to build,"By Mehdi Boudoukhane and Thibaut Nyssens – from their work building feedback systems at Cycle, now part of Atlassian
The post Your feedback tool is not there to tell you what to build appeared first on Work Life by Atlassian.","We spent years building and selling a feedback tool. We talked to thousands of product teams. In most of those conversations, the ask was the same: “I want to find trends in my feedback data.” Every … [+9805 chars]","Your feedback tool is not there to tell you what to build By Mehdi Boudoukhane and Thibaut Nyssens – from their work building feedback systems at Cycle, now part of Atlassian The post Your feedback tool is not there to tell you what to build appeared first on Work Life by Atlassian. We spent years building and selling a feedback tool. We talked to thousands of product teams. In most of those conversations, the ask was the same: “I want to find trends in my feedback data.” Every … [+9805 chars]",https://www.atlassian.com/blog/jira-product-discovery/lesson-from-building-feedback-system,2026-04-09T16:27:29+00:00,Atlassian.com,Christopher Cheung,
Russian censors target Google in VPN takedown push,"As Russia doubles down against VPN usage, Google seems to be resisting removal requests so far, despite a popular app, ZoogVPN, having reportedly been removed from Google Play. Here's all we know.","<ul><li>Google reportedly hit by 233 VPN removal orders in Russia in March</li><li>Requests to remove 500 URLs from Search were also issued in April</li><li>ZoogVPN was removed from Google Play, but … [+4623 chars]","Russian censors target Google in VPN takedown push As Russia doubles down against VPN usage, Google seems to be resisting removal requests so far, despite a popular app, ZoogVPN, having reportedly been removed from Google Play. Here's all we know. Google reportedly hit by 233 VPN removal orders in Russia in MarchRequests to remove 500 URLs from Search were also issued in AprilZoogVPN was removed from Google Play, but … [+4623 chars]",https://www.techradar.com/vpn/vpn-privacy-security/russian-censors-target-google-in-vpn-takedown-push,2026-04-09T16:25:47+00:00,TechRadar,"chiara.castro@futurenet.com (Chiara Castro) , Chiara Castro",https://cdn.mos.cms.futurecdn.net/Uc3ATHMszjrAEZXFF8yXgg-1920-80.jpg
Goldman Sachs spots a buying opportunity in bruised Big Tech,"Technology stocks have had a rough stretch. Goldman Sachs thinks that is exactly the point. In a research note published April 7, Goldman Sachs strategists...","Technology stocks have had a rough stretch. Goldman Sachs thinks that is exactly the point.
In a research note published April 7, Goldman Sachs strategists led by Chief Global Equity Strategist Pete… [+5447 chars]","Goldman Sachs spots a buying opportunity in bruised Big Tech Technology stocks have had a rough stretch. Goldman Sachs thinks that is exactly the point. In a research note published April 7, Goldman Sachs strategists... Technology stocks have had a rough stretch. Goldman Sachs thinks that is exactly the point. In a research note published April 7, Goldman Sachs strategists led by Chief Global Equity Strategist Pete… [+5447 chars]",https://www.thestreet.com/investing/goldman-sachs-spots-a-buying-opportunity-in-bruised-big-tech,2026-04-09T16:21:22+00:00,TheStreet,Hillary Remy,https://s.yimg.com/os/en/thestreet_881/a75f5b2767d2aa105d98ed9c6d94fd7e
IDC Reports 2.5 Percent PC Sales Growth in Q1,"The market researchers at IDC report that PC makers sold 65.6 million units in the first quarter, up 2.5 percent year-over-year (YOY).
The post IDC Reports 2.5 Percent PC Sales Growth in Q1 appeared first on Thurrott.com.","The market researchers at IDC report that PC makers sold 65.6 million units in the first quarter, up 2.5 percent year-over-year (YOY).
“As expected, 2026 will be characterized by market share shifts… [+1249 chars]","IDC Reports 2.5 Percent PC Sales Growth in Q1 The market researchers at IDC report that PC makers sold 65.6 million units in the first quarter, up 2.5 percent year-over-year (YOY). The post IDC Reports 2.5 Percent PC Sales Growth in Q1 appeared first on Thurrott.com. The market researchers at IDC report that PC makers sold 65.6 million units in the first quarter, up 2.5 percent year-over-year (YOY). “As expected, 2026 will be characterized by market share shifts… [+1249 chars]",https://www.thurrott.com/hardware/334712/idc-reports-2-5-percent-pc-sales-growth-in-q1,2026-04-09T16:16:19+00:00,Thurrott.com,Paul Thurrott,https://thurrott-assets.nyc3.digitaloceanspaces.com/web/wp-content/uploads/sites/2/2026/04/IDC-Q1-2026.jpg
Foldable iPhones Are Reportedly Still on Track for September. Should You Buy AAPL Stock Here?,,"If you click 'Accept all', we and our partners, including 251 who are part of the IAB Transparency &amp; Consent Framework, will also store and / or access information on a device (in other words, us… [+1046 chars]","Foldable iPhones Are Reportedly Still on Track for September. Should You Buy AAPL Stock Here? If you click 'Accept all', we and our partners, including 251 who are part of the IAB Transparency Consent Framework, will also store and / or access information on a device (in other words, us… [+1046 chars]",https://consent.yahoo.com/v2/collectConsent?sessionId=1_cc-session_aa4dcf58-7d22-41d2-aeb7-bcba8ff4b34b,2026-04-09T16:07:25+00:00,Yahoo Entertainment,,
Amazon Outlet Electronics Deals: Up to 70% off + free shipping w/ Prime,"Get deals on clearance electronics items and accessories in this Amazon Outlet sale. Discounts are spread across charging items, batteries, audio, and more. Stock on select items may be limited. Shop Now at Amazon","moreWoot has discounted a new selection of open-box items, with big savings on Apple devices and MacBooks, smartwatches, laptops, routers, and more. They're all new, but won't ship in their original … [+163 chars]","Amazon Outlet Electronics Deals: Up to 70% off + free shipping w/ Prime Get deals on clearance electronics items and accessories in this Amazon Outlet sale. Discounts are spread across charging items, batteries, audio, and more. Stock on select items may be limited. Shop Now at Amazon moreWoot has discounted a new selection of open-box items, with big savings on Apple devices and MacBooks, smartwatches, laptops, routers, and more. They're all new, but won't ship in their original … [+163 chars]",https://www.dealnews.com/Amazon-Outlet-Electronics-Deals-Up-to-70-off-free-shipping-w-Prime/21821055.html,2026-04-09T16:04:18+00:00,Dealnews.com,,https://d.dlnws.com/64599/1738088392-klipsch-portable-bluetooth-speaker-bpcy.jpeg?h=572&w=1024
David Pogue’s Apple Book,"“Apple: The First 50 Years” 1. To tell you the truth, I finished this book almost a week ago, and I forgot most of what I wanted to say about it. Primarily the business insights. Not that I don’t remember the facts. Not that I haven’t internalized the message…","“Apple: The First 50 Years”
1. To tell you the truth, I finished this book almost a week ago, and I forgot most of what I wanted to say about it. Primarily the business insights.
Not that I don’t r… [+11940 chars]","David Pogue’s Apple Book “Apple: The First 50 Years” 1. To tell you the truth, I finished this book almost a week ago, and I forgot most of what I wanted to say about it. Primarily the business insights. Not that I don’t remember the facts. Not that I haven’t internalized the message… “Apple: The First 50 Years” 1. To tell you the truth, I finished this book almost a week ago, and I forgot most of what I wanted to say about it. Primarily the business insights. Not that I don’t r… [+11940 chars]",https://ritholtz.com/2026/04/david-pogues-apple-book/,2026-04-09T16:00:38+00:00,Ritholtz.com,Bob Lefsetz,https://ritholtz.com/wp-content/uploads/2026/04/Apple-50.png
OpenClaw is Dead. Long Live OpenClaw.,"I didn’t wake up last Saturday morning planning to rethink my OpenClaw infrastructure and cost model. Then I got an email from Anthropic. It was short, polite, and to the point: third‑party harnesses like OpenClaw would no longer be covered under my Claude Ma…","I didnt wake up last Saturday morning planning to rethink my OpenClaw infrastructure and cost model. Then I got an email from Anthropic.
It was short, polite, and to the point: thirdparty harnesses … [+6302 chars]","OpenClaw is Dead. Long Live OpenClaw. I didn’t wake up last Saturday morning planning to rethink my OpenClaw infrastructure and cost model. Then I got an email from Anthropic. It was short, polite, and to the point: third‑party harnesses like OpenClaw would no longer be covered under my Claude Ma… I didnt wake up last Saturday morning planning to rethink my OpenClaw infrastructure and cost model. Then I got an email from Anthropic. It was short, polite, and to the point: thirdparty harnesses … [+6302 chars]",https://www.forrester.com/blogs/openclaw-is-dead-long-live-openclaw/,2026-04-09T15:50:28+00:00,Forrester.com,Charles Betz,https://go.forrester.com/wp-content/uploads/2022/03/FMK_FORR_GenericSocialImage_220314.jpg
More defensive versatility? Best safety fits for Patriots in NFL Draft,Can the Patriots find the next Craig Woodson in this year's NFL Draft? Phil Perry highlights the best safety fits for New England in the 2026 class.,"More defensive versatility? Best safety fits for Patriots in NFL Draft originally appeared on NBC Sports Boston
Editors Note: In the lead-up to the 2026 NFL Draft, Phil Perry is identifying the best… [+8140 chars]","More defensive versatility? Best safety fits for Patriots in NFL Draft Can the Patriots find the next Craig Woodson in this year's NFL Draft? Phil Perry highlights the best safety fits for New England in the 2026 class. More defensive versatility? Best safety fits for Patriots in NFL Draft originally appeared on NBC Sports Boston Editors Note: In the lead-up to the 2026 NFL Draft, Phil Perry is identifying the best… [+8140 chars]",https://www.nbcsportsboston.com/nfl/new-england-patriots/best-safety-fits-2026-nfl-draft/780919/?partner=yahoo,2026-04-09T15:48:00+00:00,Nbcsportsboston.com,Phil Perry,https://s.yimg.com/os/en/csnne.com/01f502e002b008775d0dcd21158e5387
Wedbush: What You Need to Know About the Latest ‘Victory’ for Apple Stock,"Analysts remain bullish, citing Apple’s AI push, strong margins, and loyal user base as long-term growth drivers.","The Magnificent 7 have held up better than many investors expected through a choppy stretch in the market, and Apple (AAPL) is no exception. The stock climbed in late 2025 on the back of strong iPhon… [+6185 chars]","Wedbush: What You Need to Know About the Latest ‘Victory’ for Apple Stock Analysts remain bullish, citing Apple’s AI push, strong margins, and loyal user base as long-term growth drivers. The Magnificent 7 have held up better than many investors expected through a choppy stretch in the market, and Apple (AAPL) is no exception. The stock climbed in late 2025 on the back of strong iPhon… [+6185 chars]",https://www.barchart.com/story/news/1224388/wedbush-what-you-need-to-know-about-the-latest-victory-for-apple-stock,2026-04-09T15:43:52+00:00,Barchart.com,Nauman Khan,https://s.yimg.com/ny/api/res/1.2/JXfR1XRlHvEGITJZeX1NMQ--/YXBwaWQ9aGlnaGxhbmRlcjt3PTEyMDA7aD04MDA-/https://media.zenfs.com/en/barchart_com_477/a4977b80534dae3398e391c09fa8763e
"Deals: 1TB M5 MacBook Air $150 off, Apple Thunderbolt 5 cables up to 48% off, Magic Keyboard Amazon low, more","Today’s 9to5Toys Lunch Break is headlined by Apple’s most affordable 1TB M5 MacBook Air at $150 off via Amazon and in all colors). Alongside the rare $99 price drops on Apple Watch Ultra 3, we also have refurb deals at $164 off joined by Apple’s least pricey …","Today’s 9to5Toys Lunch Break is headlined by Apple’s most affordable 1TB M5 MacBook Air at $150 off via Amazon and in all colors). Alongside the rare $99 price drops on Apple Watch Ultra 3, we also h… [+6660 chars]","Deals: 1TB M5 MacBook Air $150 off, Apple Thunderbolt 5 cables up to 48% off, Magic Keyboard Amazon low, more Today’s 9to5Toys Lunch Break is headlined by Apple’s most affordable 1TB M5 MacBook Air at $150 off via Amazon and in all colors). Alongside the rare $99 price drops on Apple Watch Ultra 3, we also have refurb deals at $164 off joined by Apple’s least pricey … Today’s 9to5Toys Lunch Break is headlined by Apple’s most affordable 1TB M5 MacBook Air at $150 off via Amazon and in all colors). Alongside the rare $99 price drops on Apple Watch Ultra 3, we also h… [+6660 chars]",https://9to5mac.com/2026/04/09/deals-1tb-m5-macbook-air-apple-thunderbolt-5-cables/,2026-04-09T15:40:39+00:00,9to5Mac,Justin Kahn,https://i0.wp.com/9to5mac.com/wp-content/uploads/sites/6/2026/04/Apple-deals-1TB-MacBook-Air-Magic-Keyboard-Thunderbolt-5.jpg?resize=1200%2C628&quality=82&strip=all&ssl=1
Wedbush Is Bullish on Magnificent 7 Amid the 2-Week Ceasefire. Nvidia Is the Top-Rated Stock to Buy Now.,"A ceasefire announcement sparked a rebound in tech stocks, and Wedbush sees momentum returning to the ‘Magnificent Seven.’ So, NVIDIA stock could be a top...","The Magnificent 7 NVIDIA Corporation (NVDA), Apple (AAPL), Amazon.com (AMZN), Tesla (TSLA), Meta Platforms (META), Alphabet (GOOGL) (GOOG), and Microsoft Corporation (MSFT) have long been the markets… [+7039 chars]","Wedbush Is Bullish on Magnificent 7 Amid the 2-Week Ceasefire. Nvidia Is the Top-Rated Stock to Buy Now. A ceasefire announcement sparked a rebound in tech stocks, and Wedbush sees momentum returning to the ‘Magnificent Seven.’ So, NVIDIA stock could be a top... The Magnificent 7 NVIDIA Corporation (NVDA), Apple (AAPL), Amazon.com (AMZN), Tesla (TSLA), Meta Platforms (META), Alphabet (GOOGL) (GOOG), and Microsoft Corporation (MSFT) have long been the markets… [+7039 chars]",https://www.barchart.com/story/news/1224306/wedbush-is-bullish-on-magnificent-7-amid-the-2-week-ceasefire-nvidia-is-the-top-rated-stock-to-buy-now,2026-04-09T15:38:24+00:00,Barchart.com,Sristi Suman Jayaswal,https://s.yimg.com/ny/api/res/1.2/piIjxh2sHfFBxpUyGwV0yQ--/YXBwaWQ9aGlnaGxhbmRlcjt3PTEyMDA7aD04MDA-/https://media.zenfs.com/en/barchart_com_477/828805b72adb05952504a4fefd6c1a8a
This One-Day Best Buy Deal Puts a New 4K TV in Your House for Just $130,You've only got a few hours left to snag this 43-inch Pioneer 4K Roku TV for $80 off the usual price.,"If you're on the hunt for a budget-friendly TV, you won't want to miss this one-day deal at Best Buy. The tech retailer has knocked $80 off this Pioneer 43-inch Class LED 4K Roku TV, which brings the… [+888 chars]","This One-Day Best Buy Deal Puts a New 4K TV in Your House for Just $130 You've only got a few hours left to snag this 43-inch Pioneer 4K Roku TV for $80 off the usual price. If you're on the hunt for a budget-friendly TV, you won't want to miss this one-day deal at Best Buy. The tech retailer has knocked $80 off this Pioneer 43-inch Class LED 4K Roku TV, which brings the… [+888 chars]",https://www.cnet.com/deals/pioneer-class-led-roku-tv-deal/,2026-04-09T15:12:00+00:00,CNET,Max McHone,https://www.cnet.com/a/img/resize/145f85e7de2b471d5c02d57cbb462aa43d9eb3aa/hub/2026/04/09/fc246e87-49f3-4c56-8d3d-7b5ef22d225c/pioneer-class-led-roku-tv.jpg?auto=webp&fit=crop&height=675&width=1200
Why more carmakers race to adopt iPhone car keys,"As automakers adopt iPhone car keys at a faster clip, we think it could become as standard as seat belts and touchscreens.
(via Cult of Mac - Your source for the latest Apple news, rumors, analysis, reviews, how-tos and deals.)","Apple wants to make your iPhone into your car key, if it can keep getting automakers to cooperate. Photo: Apple/Cult of Mac
From a single BMW model in 2020 to dozens of brands today, Apple Wallet’s … [+5964 chars]","Why more carmakers race to adopt iPhone car keys As automakers adopt iPhone car keys at a faster clip, we think it could become as standard as seat belts and touchscreens. (via Cult of Mac - Your source for the latest Apple news, rumors, analysis, reviews, how-tos and deals.) Apple wants to make your iPhone into your car key, if it can keep getting automakers to cooperate. Photo: Apple/Cult of Mac From a single BMW model in 2020 to dozens of brands today, Apple Wallet’s … [+5964 chars]",https://www.cultofmac.com/news/automakers-adopt-apple-car-key,2026-04-09T15:09:15+00:00,Cult of Mac,David Snow,https://www.cultofmac.com/wp-content/uploads/2023/02/Apple-Car-Keys-on-iPhone.jpg
"Investors are getting the SpaceX IPO wrong, and the real value is in its 'sovereign AI,' hedge fund manager Gene Munster says",A longtime tech investor argues that SpaceX could achieve a level of AI capability unmatched by other major companies working on the technology.,"Wall Street is eager to get a piece of SpaceX's historic IPO, but one prominent hedge fund manager thinks investors are missing the big picture regarding what could end up being the biggest driver of… [+2355 chars]","Investors are getting the SpaceX IPO wrong, and the real value is in its 'sovereign AI,' hedge fund manager Gene Munster says A longtime tech investor argues that SpaceX could achieve a level of AI capability unmatched by other major companies working on the technology. Wall Street is eager to get a piece of SpaceX's historic IPO, but one prominent hedge fund manager thinks investors are missing the big picture regarding what could end up being the biggest driver of… [+2355 chars]",https://www.businessinsider.com/spacex-ipo-gene-munster-elon-musk-terafab-ai-satellites-2026-4,2026-04-09T15:07:20+00:00,Business Insider,sobrient@insider.com (Samuel O'Brient),https://i.insider.com/69d6be5df36fd1a78c05215d?width=1200&format=jpeg
