title,description,content,text_for_analysis,url,published_at,source,author,image_url
China's 6G wait: SoC vendors brace for years of sluggish smartphone demand,"Chinese smartphone brands have recently encountered significant headwinds. Government subsidy effects have largely lost their ability to further stimulate sales, while product prices have risen across the board due to increasing costs of components such as me…","Keep me signed in
Some subscribers prefer to save their log-in information so they do not have to enter their User ID and Password each time they visit the site. To activate this function, check the… [+285 chars]","China's 6G wait: SoC vendors brace for years of sluggish smartphone demand Chinese smartphone brands have recently encountered significant headwinds. Government subsidy effects have largely lost their ability to further stimulate sales, while product prices have risen across the board due to increasing costs of components such as me… Keep me signed in Some subscribers prefer to save their log-in information so they do not have to enter their User ID and Password each time they visit the site. To activate this function, check the… [+285 chars]",https://www.digitimes.com/news/a20260409PD218/smartphone-flagship-6g-soc-growth.html,2026-04-10T00:04:21+00:00,Digitimes,DIGITIMES,https://img.digitimes.com/newsshow/20260409pd218_files/1_b.jpg
"Apple Mac Shipments Grew 9% in Q1 2026, Outpacing Overall PC Market","Apple's Mac shipments grew 9 percent during the first quarter of 2026, according to estimated shipment data shared this week by IDC.





Apple's growth outpaced overall PC market growth of 2.5 percent thanks to the M5 MacBook Pro that was released late last …","Apple's Mac shipments grew 9 percent during the first quarter of 2026, according to estimated shipment data shared this week by IDC.
Apple's growth outpaced overall PC market growth of 2.5 percent t… [+1261 chars]","Apple Mac Shipments Grew 9% in Q1 2026, Outpacing Overall PC Market Apple's Mac shipments grew 9 percent during the first quarter of 2026, according to estimated shipment data shared this week by IDC. Apple's growth outpaced overall PC market growth of 2.5 percent thanks to the M5 MacBook Pro that was released late last … Apple's Mac shipments grew 9 percent during the first quarter of 2026, according to estimated shipment data shared this week by IDC. Apple's growth outpaced overall PC market growth of 2.5 percent t… [+1261 chars]",https://www.macrumors.com/2026/04/09/apple-mac-shipments-q1-2026/,2026-04-09T22:21:27+00:00,MacRumors,Juli Clover,https://images.macrumors.com/t/ODBxznj2f_nSvqVrd4tdmK3uCR8=/2500x/article-new/2026/01/m5-macbook-pro-purple.jpeg
Agentic Payments In B2C Commerce: Where We Are Now,In November we answered five questions on the state of agentic payments and provided a key timeline of critical announcements up to that point. It's time to take a fresh look.,In November we answered five questions on the state of agentic payments and provided a key timeline of critical announcements up to that point. It’s time to take a fresh look. To summarize the bigges… [+11097 chars],Agentic Payments In B2C Commerce: Where We Are Now In November we answered five questions on the state of agentic payments and provided a key timeline of critical announcements up to that point. It's time to take a fresh look. In November we answered five questions on the state of agentic payments and provided a key timeline of critical announcements up to that point. It’s time to take a fresh look. To summarize the bigges… [+11097 chars],https://www.forrester.com/blogs/agentic-payments-in-b2c-commerce-where-we-are-now/,2026-04-09T22:06:45+00:00,Forrester.com,Lily Varon,https://go.forrester.com/wp-content/uploads/2022/03/FMK_FORR_GenericSocialImage_220314.jpg
"Tagsley GPS Tracking Card Claims Evaluated 2026: Apple Find My Wallet Tracker Battery Life, Bluetooth Range, and What to Verify on the Official Website Before Use","Tagsley GPS Tracking Card claims evaluated: 2026 Apple Find My wallet tracker battery, Bluetooth range, and official website details verified....","Los Angeles, CA, April 09, 2026 (GLOBE NEWSWIRE) -- This article contains affiliate links. If a purchase is made through these links, a commission may be earned at no additional cost to the buyer. Th… [+18301 chars]","Tagsley GPS Tracking Card Claims Evaluated 2026: Apple Find My Wallet Tracker Battery Life, Bluetooth Range, and What to Verify on the Official Website Before Use Tagsley GPS Tracking Card claims evaluated: 2026 Apple Find My wallet tracker battery, Bluetooth range, and official website details verified.... Los Angeles, CA, April 09, 2026 (GLOBE NEWSWIRE) -- This article contains affiliate links. If a purchase is made through these links, a commission may be earned at no additional cost to the buyer. Th… [+18301 chars]",https://www.globenewswire.com/news-release/2026/04/09/3271469/0/en/Tagsley-GPS-Tracking-Card-Claims-Evaluated-2026-Apple-Find-My-Wallet-Tracker-Battery-Life-Bluetooth-Range-and-What-to-Verify-on-the-Official-Website-Before-Use.html,2026-04-09T21:51:00+00:00,GlobeNewswire,Tagsley,https://ml.globenewswire.com/Resource/Download/d8885a58-60a8-4f4d-b702-8ef62d2d9914
What founders can learn from Anjuna’s layoffs and recovery | TechCrunch,"In 2021, Anjuna Security was growing fast, hiring aggressively, and chasing a market that seemed limitless. By the end of that year, the venture-backed cybersecurity company had scaled to around 75 employees, building out sales, customer success, and support …","In 2021, Anjuna Security was growing fast, hiring aggressively, and chasing a market that seemed limitless. By the end of that year, the venture-backed cybersecurity company had scaled to around 75 e… [+3349 chars]","What founders can learn from Anjuna’s layoffs and recovery | TechCrunch In 2021, Anjuna Security was growing fast, hiring aggressively, and chasing a market that seemed limitless. By the end of that year, the venture-backed cybersecurity company had scaled to around 75 employees, building out sales, customer success, and support … In 2021, Anjuna Security was growing fast, hiring aggressively, and chasing a market that seemed limitless. By the end of that year, the venture-backed cybersecurity company had scaled to around 75 e… [+3349 chars]",https://techcrunch.com/2026/04/09/what-founders-can-learn-from-anjunas-layoffs-and-recovery/,2026-04-09T21:17:30+00:00,TechCrunch,Maggie Nye,"https://techcrunch.com/wp-content/uploads/2026/04/bms2e8-feature-pic.png?resize=1200,675"
"Thai Randolph Launches NILE & Co., Creator-Driven Media Company That Has Acquired BuzzFeed’s As/Is and Goodful Brands","Entertainment industry veteran Thai Randolph has taken the wraps off her new venture: NILE & Co., described as a content and commerce platform that works with “creators who move culture.” Randolph is the former CEO and co-founder of Kevin Hart’s Hartbeat, whi…","Entertainment industry veteran Thai Randolph has taken the wraps off her new venture: NILE &amp; Co., described as a content and commerce platform that works with “creators who move culture.”
Randol… [+4210 chars]","Thai Randolph Launches NILE & Co., Creator-Driven Media Company That Has Acquired BuzzFeed’s As/Is and Goodful Brands Entertainment industry veteran Thai Randolph has taken the wraps off her new venture: NILE & Co., described as a content and commerce platform that works with “creators who move culture.” Randolph is the former CEO and co-founder of Kevin Hart’s Hartbeat, whi… Entertainment industry veteran Thai Randolph has taken the wraps off her new venture: NILE Co., described as a content and commerce platform that works with “creators who move culture.” Randol… [+4210 chars]",https://variety.com/2026/digital/news/thai-randolph-nile-co-acquires-as-is-goodful-buzzfeed-1236712898/,2026-04-09T20:53:09+00:00,Variety,Todd Spangler,https://variety.com/wp-content/uploads/2026/04/Thai-Randolph.jpg?w=1000&h=563&crop=1
What Netflix Has Been Up To Since Losing Bid For Warner Bros. Discovery,Netflix announced it was raising prices as well as continuing to invest heavily in more content after dropping its bid for rival Warner Bros. Discovery in February.,"Netflix announced it was raising prices and continuing to invest heavily in more content after dropping its bid for rival Warner Bros. Discovery in February.
The world’s largest streaming service en… [+4480 chars]",What Netflix Has Been Up To Since Losing Bid For Warner Bros. Discovery Netflix announced it was raising prices as well as continuing to invest heavily in more content after dropping its bid for rival Warner Bros. Discovery in February. Netflix announced it was raising prices and continuing to invest heavily in more content after dropping its bid for rival Warner Bros. Discovery in February. The world’s largest streaming service en… [+4480 chars],https://dailycaller.com/2026/04/09/netflix-since-losing-bid-warner-bros-discovery/,2026-04-09T20:30:43+00:00,The Daily Caller,Ryan Meilstrup,"https://images.dailycaller.com/image/width=1280,height=549,fit=cover,format=webp,f=auto/https://cdn01.dailycaller.com/wp-content/uploads/2025/12/GettyImages-971177838-scaled-e1765229972727.jpg"
2026 Rivian R2 Performance vs. 2026 Tesla Model Y: Which Crossover EV Should You Choose?,We examine whether you should wait for the R2 you want or buy a Tesla today by pointing out key differences between these two EV crossovers.,"Autoblog and Yahoo may earn commission from links in this article.
EVs come in different flavors, but one dominates all.
Theres an EV out there for almost every kind of driver. Whether you want a b… [+10613 chars]","2026 Rivian R2 Performance vs. 2026 Tesla Model Y: Which Crossover EV Should You Choose? We examine whether you should wait for the R2 you want or buy a Tesla today by pointing out key differences between these two EV crossovers. Autoblog and Yahoo may earn commission from links in this article. EVs come in different flavors, but one dominates all. Theres an EV out there for almost every kind of driver. Whether you want a b… [+10613 chars]",https://www.autoblog.com/features/2026-rivian-r2-performance-vs-2026-tesla-model-y-which-crossover-ev-should-you-choose,2026-04-09T20:11:00+00:00,Autoblog,James Ochoa,https://s.yimg.com/os/en/autoblog_arena_articles_145/6ac172cb5fad90e06a82aeff590579a2
"20VC x SaaStr: Anthropic Hit $30 Billion and Training Costs a Quarter of OpenAI’s, SpaceX Files at $1.75 Trillion, and Why the Big Three Will Dwarf Every IPO of the Last 25 Years Combined","With Harry Stebbings, Jason Lemkin, and Rory O’Driscoll Anthropic just hit $30 billion in annualized revenue. Up from $9 billion at the start of the year. That’s 3.3x growth in four months. It took Salesforce 25 years to get to $30 billion. Anthropic got ther…","With Harry Stebbings, Jason Lemkin, and Rory O’Driscoll
Anthropic just hit $30 billion in annualized revenue. Up from $9 billion at the start of the year. That’s 3.3x growth in four months. It took … [+22306 chars]","20VC x SaaStr: Anthropic Hit $30 Billion and Training Costs a Quarter of OpenAI’s, SpaceX Files at $1.75 Trillion, and Why the Big Three Will Dwarf Every IPO of the Last 25 Years Combined With Harry Stebbings, Jason Lemkin, and Rory O’Driscoll Anthropic just hit $30 billion in annualized revenue. Up from $9 billion at the start of the year. That’s 3.3x growth in four months. It took Salesforce 25 years to get to $30 billion. Anthropic got ther… With Harry Stebbings, Jason Lemkin, and Rory O’Driscoll Anthropic just hit $30 billion in annualized revenue. Up from $9 billion at the start of the year. That’s 3.3x growth in four months. It took … [+22306 chars]",https://www.saastr.com/20vc-x-saastr-anthropic-hit-30-billion-and-training-costs-a-quarter-of-openais-spacex-files-at-1-75-trillion-and-why-the-big-three-will-dwarf-every-ipo-of-the-last-25-years-combined/,2026-04-09T20:03:38+00:00,Saastr.com,Jason Lemkin,https://i0.wp.com/www.saastr.com/wp-content/uploads/2026/04/harry51-scaled.jpg?fit=1000%2C563&quality=70&ssl=1
"BAB, Inc. Reports Results for 1st Quarter FY 2026","DEERFIELD, Ill., April 09, 2026 (GLOBE NEWSWIRE) -- BAB, Inc. (OTCQB: BABB), announced its financial results for the first quarter ended February 28, 2026. For the quarter ended February 28, 2026, BAB had revenues of $724,000 and net income of $119,000, or ea…","DEERFIELD, Ill., April 09, 2026 (GLOBE NEWSWIRE) -- BAB, Inc. (OTCQB: BABB), announced its financial results for the first quarter ended February 28, 2026. For the quarter ended February 28, 2026, BA… [+5929 chars]","BAB, Inc. Reports Results for 1st Quarter FY 2026 DEERFIELD, Ill., April 09, 2026 (GLOBE NEWSWIRE) -- BAB, Inc. (OTCQB: BABB), announced its financial results for the first quarter ended February 28, 2026. For the quarter ended February 28, 2026, BAB had revenues of $724,000 and net income of $119,000, or ea… DEERFIELD, Ill., April 09, 2026 (GLOBE NEWSWIRE) -- BAB, Inc. (OTCQB: BABB), announced its financial results for the first quarter ended February 28, 2026. For the quarter ended February 28, 2026, BA… [+5929 chars]",https://www.globenewswire.com/news-release/2026/04/09/3271384/0/en/BAB-Inc-Reports-Results-for-1st-Quarter-FY-2026.html,2026-04-09T19:17:00+00:00,GlobeNewswire,"BAB, Inc.",
I Can’t Believe I Just Found This For $16 On Amazon,One of our Disney World must-haves is on sale for just $16 for a limited time!,"One of the must-haves on our Disney World packing list is on sale for almost 40% off right now!
Cinderella Castle
Between booking Lightning Lanes, managing dining reservations, and taking tons of p… [+3004 chars]","I Can’t Believe I Just Found This For $16 On Amazon One of our Disney World must-haves is on sale for just $16 for a limited time! One of the must-haves on our Disney World packing list is on sale for almost 40% off right now! Cinderella Castle Between booking Lightning Lanes, managing dining reservations, and taking tons of p… [+3004 chars]",https://www.disneyfoodblog.com/2026/04/09/i-cant-believe-i-just-found-this-for-16-on-amazon/,2026-04-09T19:00:04+00:00,disneyfoodblog.com,Brianna LeCompte,https://www.disneyfoodblog.com/wp-content/uploads/2025/05/2025-WDW-port-orleans-riverside-atmo-2-700x525.jpg
"Jack White announces summer tour, two NYC shows. Get tickets today",The virtuosic axeman will melt a face or three at the Brooklyn Paramount on July 11-12.,"New York Post may be compensated and/or receive an affiliate commission if you click or buy through our links. Featured pricing is subject to change.
We’re keeping our fingers crossed that Jack Blac… [+9934 chars]","Jack White announces summer tour, two NYC shows. Get tickets today The virtuosic axeman will melt a face or three at the Brooklyn Paramount on July 11-12. New York Post may be compensated and/or receive an affiliate commission if you click or buy through our links. Featured pricing is subject to change. We’re keeping our fingers crossed that Jack Blac… [+9934 chars]",https://nypost.com/2026/04/09/ticket-sales/jack-white-summer-tour-2026-where-to-buy-tickets-schedule/,2026-04-09T18:46:41+00:00,New York Post,Matt Levy,https://nypost.com/wp-content/uploads/sites/2/2026/04/Jack-White.jpg?quality=75&strip=all&w=1200
Boosting Brand Awareness via Influencer Marketing 2023,"In the best case, high brand awareness gives your company a positive reputation, trust, and consequently more customers. Increase this in 2023 with influencer marketing.","Key Takeaways
<ul><li>Values that brands can achieve by means of high brand awareness: Reputation, trust, and loyalty of their customers, which in the long run can lead to business success and the a… [+7714 chars]","Boosting Brand Awareness via Influencer Marketing 2023 In the best case, high brand awareness gives your company a positive reputation, trust, and consequently more customers. Increase this in 2023 with influencer marketing. Key Takeaways Values that brands can achieve by means of high brand awareness: Reputation, trust, and loyalty of their customers, which in the long run can lead to business success and the a… [+7714 chars]",https://www.kolsquare.com/en/blog/how-to-increase-brand-awareness-with-influencer-marketing-in-2023,2026-04-09T18:42:37+00:00,Kolsquare.com,,https://cdn.prod.website-files.com/657de0bae2fcd55519d3fe50/657de0bae2fcd55519d400f9_how-to-increase-brand-awareness-in-2023.webp
"Toll Brothers Announces New Luxury Home Community Coming Soon to Southeast, New York","Toll Brothers at Fortune Ridge offers estate-sized homes and premier amenities in Southeast, New York Toll Brothers at Fortune Ridge offers estate-sized homes and premier amenities in Southeast, New York","SOUTHEAST, N.Y., April 09, 2026 (GLOBE NEWSWIRE) -- Toll Brothers, Inc. (NYSE:TOL), the nation's leading builder of luxury homes, today announced its newest community, Toll Brothers at Fortune Ridge,… [+3594 chars]","Toll Brothers Announces New Luxury Home Community Coming Soon to Southeast, New York Toll Brothers at Fortune Ridge offers estate-sized homes and premier amenities in Southeast, New York Toll Brothers at Fortune Ridge offers estate-sized homes and premier amenities in Southeast, New York SOUTHEAST, N.Y., April 09, 2026 (GLOBE NEWSWIRE) -- Toll Brothers, Inc. (NYSE:TOL), the nation's leading builder of luxury homes, today announced its newest community, Toll Brothers at Fortune Ridge,… [+3594 chars]",https://www.globenewswire.com/news-release/2026/04/09/3271357/1924/en/Toll-Brothers-Announces-New-Luxury-Home-Community-Coming-Soon-to-Southeast-New-York.html,2026-04-09T18:36:00+00:00,GlobeNewswire,"Toll Brothers, Inc.",https://ml.globenewswire.com/Resource/Download/13f0213b-c481-4ab4-bd94-925e06f8a946
"Sharge Disk Pro Review: An SSD Hub with a Fan, and You Certainly Hear It","I've seen storage manufacturers try all sorts of ways to mitigate heat, with the most popular option being a design that facilitates passive cooling. Sharge went a different route, though, and packed a tiny fan into the wallet-sized DiskPro. It's different, b…","I’ve seen storage manufacturers try all sorts of ways to mitigate heat, with the most popular option being a design that facilitates passive cooling. Sharge went a different route, though, and packed… [+9503 chars]","Sharge Disk Pro Review: An SSD Hub with a Fan, and You Certainly Hear It I've seen storage manufacturers try all sorts of ways to mitigate heat, with the most popular option being a design that facilitates passive cooling. Sharge went a different route, though, and packed a tiny fan into the wallet-sized DiskPro. It's different, b… I’ve seen storage manufacturers try all sorts of ways to mitigate heat, with the most popular option being a design that facilitates passive cooling. Sharge went a different route, though, and packed… [+9503 chars]",https://petapixel.com/2026/04/09/sharge-disk-pro-review-an-ssd-hub-with-a-fan-and-you-certainly-hear-it/,2026-04-09T18:31:14+00:00,PetaPixel,Jaron Schneider,https://petapixel.com/assets/uploads/2026/04/Sharge-Disk-Pro-Review-An-SSD-Hub-with-a-Fan-and-You-Certainly-Hear-It.jpg
Filmhub Acquires Indie Dramedy ‘Burt’ Ahead of World Parkinson’s Day (EXCLUSIVE),"Global sales and distribution company Filmhub has acquired the rights to “Burt,” a micro-indie dramedy about an estranged father and son navigating Parkinson’s Disease. The film stars Oliver Cooper and Burt Berger, who plays the title role of Burt, an aging s…","Global sales and distribution company Filmhub has acquired the rights to “Burt,” a micro-indie dramedy about an estranged father and son navigating Parkinson’s Disease. 
The film stars Oliver Cooper… [+2099 chars]","Filmhub Acquires Indie Dramedy ‘Burt’ Ahead of World Parkinson’s Day (EXCLUSIVE) Global sales and distribution company Filmhub has acquired the rights to “Burt,” a micro-indie dramedy about an estranged father and son navigating Parkinson’s Disease. The film stars Oliver Cooper and Burt Berger, who plays the title role of Burt, an aging s… Global sales and distribution company Filmhub has acquired the rights to “Burt,” a micro-indie dramedy about an estranged father and son navigating Parkinson’s Disease. The film stars Oliver Cooper… [+2099 chars]",https://variety.com/2026/film/news/filmhub-indie-dramedy-burt-world-parkinsons-day-1236712108/,2026-04-09T18:15:00+00:00,Variety,Angelique Jackson,https://variety.com/wp-content/uploads/2026/04/BURT_MAIN-PIC-CC-1.jpg?w=1000&h=563&crop=1
"Apple said to be locked into Samsung for foldable iPhone screens, but surprisingly starting small","Three years, one supplier, and the early numbers are telling.","Samsung is both Apple's fiercest smartphone rival and its only option for foldable displays. A new report reveals just how deep that dependency runs, with a three-year exclusivity deal that locks App… [+2416 chars]","Apple said to be locked into Samsung for foldable iPhone screens, but surprisingly starting small Three years, one supplier, and the early numbers are telling. Samsung is both Apple's fiercest smartphone rival and its only option for foldable displays. A new report reveals just how deep that dependency runs, with a three-year exclusivity deal that locks App… [+2416 chars]",https://www.phonearena.com/news/apple-said-to-be-locked-into-samsung-for-foldable-iphone-screens-but-surprisingly-starting-small_id179583,2026-04-09T17:58:27+00:00,PhoneArena,Johanna Romero,https://m-cdn.phonearena.com/images/article/179583-wide-two_1200/Apple-said-to-be-locked-into-Samsung-for-foldable-iPhone-screens-but-surprisingly-starting-small.jpg
"London’s Times Newspaper Reduces Story-Count, Increases Readership","Across the whole newsroom, The Times has gone from publishing more than 200 stories a day to about 150 – a 25% cut. – Press-Gazette","The Times says a strategy of publishing fewer, better stories has led to three consecutive months of record-breaking global audience growth.
The Times news desk has reduced the number of stories it … [+8337 chars]","London’s Times Newspaper Reduces Story-Count, Increases Readership Across the whole newsroom, The Times has gone from publishing more than 200 stories a day to about 150 – a 25% cut. – Press-Gazette The Times says a strategy of publishing fewer, better stories has led to three consecutive months of record-breaking global audience growth. The Times news desk has reduced the number of stories it … [+8337 chars]",https://pressgazette.co.uk/publishers/digital-journalism/times-fewer-better-stories-strategy-leads-to-run-of-audience-growth/,2026-04-09T17:44:00+00:00,Press Gazette,Press Gazette,https://pressgazette.co.uk/wp-content/uploads/sites/7/2026/04/timesdigital-800x418.webp?1775758088
Samsung’s Wide Fold may herald the return of this power-user feature,"Samsung could reintroduce S Pen support on one of its next foldables, with the Wide Fold looking like the likeliest fit.","<ul><li>Samsung may bring S Pen support back to one of its next foldables.</li><li>The report mentions both the new Wide Fold and the S Pen, but doesnt confirm which foldable might get the stylus.</l… [+1742 chars]","Samsung’s Wide Fold may herald the return of this power-user feature Samsung could reintroduce S Pen support on one of its next foldables, with the Wide Fold looking like the likeliest fit. Samsung may bring S Pen support back to one of its next foldables.The report mentions both the new Wide Fold and the S Pen, but doesnt confirm which foldable might get the stylus.</l… [+1742 chars]",https://www.androidauthority.com/samsung-galaxy-z-wide-fold-s-pen-rumor-3656307/,2026-04-09T17:41:35+00:00,Android Authority,Matt Horne,https://www.androidauthority.com/wp-content/uploads/2025/01/Samsung-Galaxy-S25-Ultra-S-Pen-usage.jpg
Refurb Unlocked Apple iPhone 16 Pro Max 512GB Smart Phone for $824 + free shipping,"At eBay, get the Refurb Unlocked Apple iPhone 16 Pro Max 512GB Smart Phone for the lowest price we could find by $13. A one-year Allstate warranty is provided with purchase. Buy Now at eBay","moreUsing the adidas Outlet promo code ""SPRING50"", you can knock the price of men's sneakers as low as $12 right now at eBay. It puts lots of popular pairs at just $25 or less. Stock is low and going… [+193 chars]","Refurb Unlocked Apple iPhone 16 Pro Max 512GB Smart Phone for $824 + free shipping At eBay, get the Refurb Unlocked Apple iPhone 16 Pro Max 512GB Smart Phone for the lowest price we could find by $13. A one-year Allstate warranty is provided with purchase. Buy Now at eBay moreUsing the adidas Outlet promo code ""SPRING50"", you can knock the price of men's sneakers as low as $12 right now at eBay. It puts lots of popular pairs at just $25 or less. Stock is low and going… [+193 chars]",https://www.dealnews.com/Refurb-Unlocked-Apple-iPhone-16-Pro-Max-512-GB-Smart-Phone-for-824-free-shipping/21821081.html,2026-04-09T17:33:46+00:00,Dealnews.com,,https://d.dlnws.com/64599/1775755745-gold-apple-iphone-triple-camera-gley.webp?h=1024&w=816
