title,description,content,text_for_analysis,url,published_at,source,author,image_url
"Malaysia Enterprise ICT Intelligence Report 2025 Featuring Microsoft, Telekom Malaysia, Alibaba, Apple, and Accenture","The Malaysian enterprise ICT market is poised for growth, driven by digital investments, government initiatives, and infrastructure upgrades. Key opportunities lie in IoT, particularly in manufacturing, retail, energy, and transport sectors, as they adopt Ind…","Dublin, April 10, 2026 (GLOBE NEWSWIRE) -- The ""Malaysia - Enterprise ICT Country Intelligence Report"" report has been added to ResearchAndMarkets.com's offering.
The report provides an in-depth ana… [+4618 chars]","Malaysia Enterprise ICT Intelligence Report 2025 Featuring Microsoft, Telekom Malaysia, Alibaba, Apple, and Accenture The Malaysian enterprise ICT market is poised for growth, driven by digital investments, government initiatives, and infrastructure upgrades. Key opportunities lie in IoT, particularly in manufacturing, retail, energy, and transport sectors, as they adopt Ind… Dublin, April 10, 2026 (GLOBE NEWSWIRE) -- The ""Malaysia - Enterprise ICT Country Intelligence Report"" report has been added to ResearchAndMarkets.com's offering. The report provides an in-depth ana… [+4618 chars]",https://www.globenewswire.com/news-release/2026/04/10/3271556/28124/en/Malaysia-Enterprise-ICT-Intelligence-Report-2025-Featuring-Microsoft-Telekom-Malaysia-Alibaba-Apple-and-Accenture.html,2026-04-10T08:06:00+00:00,GlobeNewswire,Research and Markets,https://ml.globenewswire.com/Resource/Download/908fb457-7f8e-4a08-9081-5565e3dfb3d7
Why pay thousands for a new laptop? This MacBook Air refurb gets the job done for under $200,"Macworld







TL;DR: This refurbished 2017 MacBook Air delivers reliable everyday performance with 8GB RAM, a fast 128GB SSD, and up to 12 hours of battery life, all for just $199.97 (MSRP $999) through April 19.




If your current laptop struggles to ke…","Skip to contentType your search and hit enter
When you purchase through links in our articles, we may earn a small commission. This doesn't affect our editorial independence
.
TL;DR: This refurbis… [+1574 chars]","Why pay thousands for a new laptop? This MacBook Air refurb gets the job done for under $200 Macworld TL;DR: This refurbished 2017 MacBook Air delivers reliable everyday performance with 8GB RAM, a fast 128GB SSD, and up to 12 hours of battery life, all for just $199.97 (MSRP $999) through April 19. If your current laptop struggles to ke… Skip to contentType your search and hit enter When you purchase through links in our articles, we may earn a small commission. This doesn't affect our editorial independence . TL;DR: This refurbis… [+1574 chars]",https://www.macworld.com/article/3107361/why-pay-thousands-for-a-new-laptop-this-macbook-air-refurb-gets-the-job-done-for-under-200.html,2026-04-10T08:00:00+00:00,Macworld,DealPost Team,https://www.macworld.com/wp-content/uploads/2026/04/MacBook-Air.jpg?quality=50&strip=all&w=1024
What Anthropic’s too-dangerous-to-release AI model means for its upcoming IPO,Anthropic says it has built its most capable AI model ever. It's also decided you can't have it.,"Anthropic has a new product with a major catchits too powerful to be released. For a company valued at around $380 billion and reportedly preparing for an IPO this year, its an unusual stancebut one … [+9354 chars]","What Anthropic’s too-dangerous-to-release AI model means for its upcoming IPO Anthropic says it has built its most capable AI model ever. It's also decided you can't have it. Anthropic has a new product with a major catchits too powerful to be released. For a company valued at around $380 billion and reportedly preparing for an IPO this year, its an unusual stancebut one … [+9354 chars]",https://fortune.com/2026/04/10/anthropic-too-dangerous-to-release-ai-model-means-for-its-upcoming-ipo/,2026-04-10T07:52:38+00:00,Fortune,Beatrice Nolan,"https://fortune.com/img-assets/wp-content/uploads/2026/04/GettyImages-2261864825-2-e1775770945351.jpg?resize=1200,600"
Trump clashes with Europe over fines of more than €6 billion on US tech giants,"Tension between Washington and Brussels over Big Tech escalates
The post Trump clashes with Europe over fines of more than €6 billion on US tech giants appeared first on ProtoThema English.","The European Union’s fines to Big Tech are becoming a major point of friction, with Donald Trump’s administration increasingly clashing with Brussels over the regulatory framework and sanctions.
Goo… [+2670 chars]","Trump clashes with Europe over fines of more than €6 billion on US tech giants Tension between Washington and Brussels over Big Tech escalates The post Trump clashes with Europe over fines of more than €6 billion on US tech giants appeared first on ProtoThema English. The European Union’s fines to Big Tech are becoming a major point of friction, with Donald Trump’s administration increasingly clashing with Brussels over the regulatory framework and sanctions. Goo… [+2670 chars]",https://en.protothema.gr/2026/04/10/trump-clashes-with-europe-over-fines-of-more-than-e6-billion-on-us-tech-giants/,2026-04-10T07:19:00+00:00,Protothema.gr,admin,https://en.protothema.gr/wp-content/uploads/2026/04/trump-mak-3.jpg-3.jpg
IT stocks tumble up to 3% after TCS Q4 earnings. What's spooking investors?,"IT stocks fell up to 3% after TCS reported Q4 results that failed to impress the Street, dragging the Nifty IT index over 2%. Despite broader market gains, investor sentiment weakened amid muted demand outlook, cautious brokerage commentary and renewed concer…","Shares of IT companies like Infosys, HCLTech and others tumbled up to 3% on Friday despite overall bullish sentiment on Dalal Street, as India's largest IT services provider, Tata Consultancy Service… [+2825 chars]","IT stocks tumble up to 3% after TCS Q4 earnings. What's spooking investors? IT stocks fell up to 3% after TCS reported Q4 results that failed to impress the Street, dragging the Nifty IT index over 2%. Despite broader market gains, investor sentiment weakened amid muted demand outlook, cautious brokerage commentary and renewed concer… Shares of IT companies like Infosys, HCLTech and others tumbled up to 3% on Friday despite overall bullish sentiment on Dalal Street, as India's largest IT services provider, Tata Consultancy Service… [+2825 chars]",https://economictimes.indiatimes.com/markets/stocks/news/it-stocks-tumble-up-to-3-after-tcs-q4-earnings-whats-spooking-investors/articleshow/130162512.cms,2026-04-10T07:14:37+00:00,The Times of India,Debaroti Adhikary,"https://img.etimg.com/thumb/msid-130162520,width-1200,height-630,imgsize-56974,overlay-etmarkets/articleshow.jpg"
"Global PC shipments actually grew in Q1 2026, despite memory crisis and price crunch",A report from the International Data Corporation (IDC) covering global PC shipments shows growth despite 'deteriorating macroeconomic conditions.'.Continue reading at TweakTown,"According to the latest report from the International Data Corporation (IDC), global PC shipments grew year-over-year for the first three months of 2026. Although it was only 2.5%, the PC market deli… [+1626 chars]","Global PC shipments actually grew in Q1 2026, despite memory crisis and price crunch A report from the International Data Corporation (IDC) covering global PC shipments shows growth despite 'deteriorating macroeconomic conditions.'.Continue reading at TweakTown According to the latest report from the International Data Corporation (IDC), global PC shipments grew year-over-year for the first three months of 2026. Although it was only 2.5%, the PC market deli… [+1626 chars]",https://www.tweaktown.com/news/110956/global-pc-shipments-actually-grew-in-q1-2026-despite-memory-crisis-and-price-crunch/index.html,2026-04-10T06:59:03+00:00,TweakTown,Kosta Andreadis,https://static.tweaktown.com/news/1/1/110956_1_global-pc-shipments-actually-grew-in-q1-2026-despite-memory-crisis-and-price-crunch_full.jpg
BBC: Boost for Man Utd as EPL rivals open to selling ‘unbelievable’ full-back wanted by INEOS,"Manchester United might stand a genuine chance of landing Myles Lewis-Skelly this summer, with Arsenal opening the door for a sale.The Red Devils are searching the market for a left-back who can take ...","Manchester United might stand a genuine chance of landing Myles Lewis-Skelly this summer, with Arsenal opening the door for a sale.
The Red Devils are searching the market for a left-back who can ta… [+2440 chars]","BBC: Boost for Man Utd as EPL rivals open to selling ‘unbelievable’ full-back wanted by INEOS Manchester United might stand a genuine chance of landing Myles Lewis-Skelly this summer, with Arsenal opening the door for a sale.The Red Devils are searching the market for a left-back who can take ... Manchester United might stand a genuine chance of landing Myles Lewis-Skelly this summer, with Arsenal opening the door for a sale. The Red Devils are searching the market for a left-back who can ta… [+2440 chars]",https://strettynews.com/2026/04/10/arsenal-man-utd-myles-lewis-skelly/,2026-04-10T06:50:00+00:00,Strettynews.com,Stretty News,https://s.yimg.com/os/en/stretty_news_articles_240/9636687421293d17d31ff073b2094fb9
Champ’s Choice: Rory McIlroy served himself first at Augusta,"After some controversy over McIlroy’s lack of love for Irish cuisine this week, Patrick Hanlon says the golfer’s Augusta dinner reflected global tastes over local roots, and that’s OK.",RORY MCILROY PULLED off a bit of a risky fart this week. At a press conference in advance of hosting the Masters Champions Dinner in Augusta the Holywood-born Pro threw out a half-serious comment abo… [+5901 chars],"Champ’s Choice: Rory McIlroy served himself first at Augusta After some controversy over McIlroy’s lack of love for Irish cuisine this week, Patrick Hanlon says the golfer’s Augusta dinner reflected global tastes over local roots, and that’s OK. RORY MCILROY PULLED off a bit of a risky fart this week. At a press conference in advance of hosting the Masters Champions Dinner in Augusta the Holywood-born Pro threw out a half-serious comment abo… [+5901 chars]",https://www.thejournal.ie/readme/rory-mcilroy-and-irish-food-7008168-Apr2026/,2026-04-10T06:00:50+00:00,TheJournal.ie,Patrick Hanlon,https://img2.thejournal.ie/article/7008168/river/?height=400&version=7008173
iPhone Fold Leaks: Why This 7.8-Inch ‘Ultra’ is Better Than an iPad Mini,"Apple is reportedly gearing up to launch its first foldable iPhone, tentatively named the “iPhone Fold” or “iPhone Ultra.” This highly anticipated device is expected to combine Apple’s signature design philosophy with innovative foldable technology, potential…","Apple is reportedly gearing up to launch its first foldable iPhone, tentatively named the “iPhone Fold” or “iPhone Ultra.” This highly anticipated device is expected to combine Apples signature desig… [+6400 chars]","iPhone Fold Leaks: Why This 7.8-Inch ‘Ultra’ is Better Than an iPad Mini Apple is reportedly gearing up to launch its first foldable iPhone, tentatively named the “iPhone Fold” or “iPhone Ultra.” This highly anticipated device is expected to combine Apple’s signature design philosophy with innovative foldable technology, potential… Apple is reportedly gearing up to launch its first foldable iPhone, tentatively named the “iPhone Fold” or “iPhone Ultra.” This highly anticipated device is expected to combine Apples signature desig… [+6400 chars]",https://www.geeky-gadgets.com/apple-foldable-iphone-specs-2/,2026-04-10T06:00:39+00:00,Geeky Gadgets,Roland Hutchinson,https://www.geeky-gadgets.com/wp-content/uploads/2026/04/iphone-fold-hole-punch-camera-cutout.jpg
TSMC’s Sales Beat Estimates After War Fails to Dent AI Demand,"Taiwan Semiconductor Manufacturing Co. reported a 35% increase in quarterly revenue, suggesting global AI chip demand remained intact during the first weeks of war in the Middle East.","(Bloomberg) Taiwan Semiconductor Manufacturing Co. reported a 35% increase in quarterly revenue, suggesting global AI chip demand remained intact during the first weeks of war in the Middle East.
TH… [+4760 chars]","TSMC’s Sales Beat Estimates After War Fails to Dent AI Demand Taiwan Semiconductor Manufacturing Co. reported a 35% increase in quarterly revenue, suggesting global AI chip demand remained intact during the first weeks of war in the Middle East. (Bloomberg) Taiwan Semiconductor Manufacturing Co. reported a 35% increase in quarterly revenue, suggesting global AI chip demand remained intact during the first weeks of war in the Middle East. TH… [+4760 chars]",https://financialpost.com/pmn/business-pmn/tsmcs-sales-beat-estimates-after-war-fails-to-dent-ai-demand,2026-04-10T06:00:32+00:00,Financial Post,Bloomberg News,https://smartcdn.gprod.postmedia.digital/financialpost/wp-content/uploads/2026/04/tsmc-shares-shrug-off-concerns-over-war-ai-bubble-stock-re.jpg
"TSMC's Q1 revenue jumps 35% y/y, beats market forecast","TAIPEI, April 10 : TSMC, the world's largest contract chipmaker, reported on Friday first-quarter revenue of T$1.134 trillion ($35.71 billion), beating the market forecasts and up 35 per cent on the year ago period on surging interest in artificial intelligen…","TAIPEI, April 10 : TSMC, the world's largest contract chipmaker, reported on Friday first-quarter revenue of T$1.134 trillion ($35.71 billion), beating the market forecasts and up 35 per cent on the … [+323 chars]","TSMC's Q1 revenue jumps 35% y/y, beats market forecast TAIPEI, April 10 : TSMC, the world's largest contract chipmaker, reported on Friday first-quarter revenue of T$1.134 trillion ($35.71 billion), beating the market forecasts and up 35 per cent on the year ago period on surging interest in artificial intelligen… TAIPEI, April 10 : TSMC, the world's largest contract chipmaker, reported on Friday first-quarter revenue of T$1.134 trillion ($35.71 billion), beating the market forecasts and up 35 per cent on the … [+323 chars]",https://www.channelnewsasia.com/business/tsmcs-q1-revenue-jumps-35-yy-beats-market-forecast-6048561,2026-04-10T05:37:11+00:00,CNA,,"https://dam.mediacorp.sg/image/upload/s--IIQ0NjtA--/c_fill,g_auto,h_676,w_1200/fl_relative,g_south_east,l_mediacorp:cna:watermark:2024-04:reuters_1,w_0.1/f_auto,q_auto/v1/one-cms/core/2026-04-10T053612Z_1_LYNXMPEM3908A_RTROPTP_3_TSMC-RESULTS.JPG?itok=WZJlNU3y"
Names take center stage in Japan's traditional theater of Kabuki,"Handing down a name over generations is a central part of the Japanese traditional theater art of Kabuki, and that ceremony gets celebrated at theaters and special events every few years. Now, the ritual is taking place with the eighth Kikugoro, who had that …","TOKYO (AP) Handing down a name over generations is a central part of the Japanese traditional theater art of Kabuki, and that ceremony gets celebrated at theaters and special events every few years.
… [+5543 chars]","Names take center stage in Japan's traditional theater of Kabuki Handing down a name over generations is a central part of the Japanese traditional theater art of Kabuki, and that ceremony gets celebrated at theaters and special events every few years. Now, the ritual is taking place with the eighth Kikugoro, who had that … TOKYO (AP) Handing down a name over generations is a central part of the Japanese traditional theater art of Kabuki, and that ceremony gets celebrated at theaters and special events every few years. … [+5543 chars]",https://apnews.com/article/kabuki-name-succession-japan-tradition-theater-d1e9621bc91385498314f36e1481b6fd,2026-04-10T05:28:52+00:00,Associated Press,Yuri Kageyama,https://dims.apnews.com/dims4/default/9033f68/2147483647/strip/true/crop/8000x5331+0+358/resize/980x653!/quality/90/?url=https%3A%2F%2Fassets.apnews.com%2Fe7%2F53%2Fe516de99c7fd95e6faeb7aadf115%2F246bf37f3a3f4599b05f3b56f6370caf
LEIF LARSON: Satellite-Based GPS Becoming National Security Problem,"The United States needs a resilient, terrestrial complement and backup to GPS, with Positioning, Navigation and Timing (PNT) systems, to keep pace with other","The United States needs a resilient, terrestrial complement and backup to GPS, with Positioning, Navigation and Timing (PNT) systems, to keep pace with other developed nations that already have these… [+4998 chars]","LEIF LARSON: Satellite-Based GPS Becoming National Security Problem The United States needs a resilient, terrestrial complement and backup to GPS, with Positioning, Navigation and Timing (PNT) systems, to keep pace with other The United States needs a resilient, terrestrial complement and backup to GPS, with Positioning, Navigation and Timing (PNT) systems, to keep pace with other developed nations that already have these… [+4998 chars]",https://dailycaller.com/2026/04/10/opinion-satellite-based-gps-becoming-national-security-problem-leif-larson/,2026-04-10T05:07:51+00:00,The Daily Caller,Leif Larson,"https://images.dailycaller.com/image/width=1280,height=549,fit=cover,format=webp,f=auto/https://cdn01.dailycaller.com/wp-content/uploads/2025/09/GettyImages-2215644444-1-e1758315688245.jpg"
The Trump administration is getting angry as EU Big Tech fines top $7 billion in 2 years,The European Commission and Trump administration are increasingly clashing over the bloc's actions against U.S. tech companies.,"The Trump administration is increasingly on a collision course with the European Union over Big Tech fines.
Google, Apple and Meta are contesting fines from the EU over violations of the bloc's anti… [+5769 chars]","The Trump administration is getting angry as EU Big Tech fines top $7 billion in 2 years The European Commission and Trump administration are increasingly clashing over the bloc's actions against U.S. tech companies. The Trump administration is increasingly on a collision course with the European Union over Big Tech fines. Google, Apple and Meta are contesting fines from the EU over violations of the bloc's anti… [+5769 chars]",https://www.cnbc.com/2026/04/10/google-meta-big-tech-6-billion-euros-eu-fine.html,2026-04-10T05:00:01+00:00,CNBC,Kai Nicol-Schwarz,https://image.cnbcfm.com/api/v1/image/106871436-1618996381081-gettyimages-1230188864-AFP_8XC7VQ.jpeg?v=1775567469&w=1920&h=1080
From Japanese ‘swicy’ to Mexican smoke: How to cook like a flavour tourist at home,"You don’t need a boarding pass to eat well right now – just a decent pan and a willingness to go further than your usual midweek rota. These recipes make a case for staying in and cooking with intent. Consider it travel, minus the airport","Your support helps us to tell the story
From reproductive rights to climate change to Big Tech, The Independent is on the ground when the story is developing. Whether it's investigating the financia… [+8402 chars]","From Japanese ‘swicy’ to Mexican smoke: How to cook like a flavour tourist at home You don’t need a boarding pass to eat well right now – just a decent pan and a willingness to go further than your usual midweek rota. These recipes make a case for staying in and cooking with intent. Consider it travel, minus the airport Your support helps us to tell the story From reproductive rights to climate change to Big Tech, The Independent is on the ground when the story is developing. Whether it's investigating the financia… [+8402 chars]",https://www.the-independent.com/life-style/food-and-drink/recipes/flavour-tourist-japanese-korean-mexican-recipes-b2953545.html,2026-04-10T05:00:00+00:00,The-independent.com,Hannah Twiggs,https://static.the-independent.com/2026/04/08/7/52/flavour-tourist-recipes.jpeg?width=1200&height=800&crop=1200:800
Former DeepMind researchers bet on visual AI with new startup,"Andrew Dai has launched Elorian, a startup aiming to improve AI’s ability to understand and reason about visual information. Backed by major investors, the company is developing specialized models to support real-world applications like robotics and design, a…","Former Google DeepMind researcher Andrew Dai believes that the artificial intelligence models at big labs have the intelligence of a 3-year-old kid, at least when it comes to making sense of visual p… [+4418 chars]","Former DeepMind researchers bet on visual AI with new startup Andrew Dai has launched Elorian, a startup aiming to improve AI’s ability to understand and reason about visual information. Backed by major investors, the company is developing specialized models to support real-world applications like robotics and design, a… Former Google DeepMind researcher Andrew Dai believes that the artificial intelligence models at big labs have the intelligence of a 3-year-old kid, at least when it comes to making sense of visual p… [+4418 chars]",https://economictimes.indiatimes.com/tech/artificial-intelligence/former-deepmind-researchers-bet-on-visual-ai-with-new-startup/articleshow/130159486.cms,2026-04-10T04:41:41+00:00,The Times of India,Bloomberg,"https://img.etimg.com/thumb/width-1200,height-900,imgsize-288828,resizemode-75,msid-130159486/tech/artificial-intelligence/former-deepmind-researchers-bet-on-visual-ai-with-new-startup.jpg"
Report: Apple saw 9% growth in Mac shipments during Q1 2026,"A new report from IDC shows that while the overall PC market posted slight year-over-year shipment growth in the first quarter, Apple saw one of the strongest gains among its peers. Here are the details.



 more…","A new report from IDC shows that while the overall PC market posted slight year-over-year shipment growth in the first quarter, Apple saw one of the strongest gains among its peers. Here are the deta… [+2157 chars]","Report: Apple saw 9% growth in Mac shipments during Q1 2026 A new report from IDC shows that while the overall PC market posted slight year-over-year shipment growth in the first quarter, Apple saw one of the strongest gains among its peers. Here are the details. more… A new report from IDC shows that while the overall PC market posted slight year-over-year shipment growth in the first quarter, Apple saw one of the strongest gains among its peers. Here are the deta… [+2157 chars]",https://9to5mac.com/2026/04/09/report-apple-saw-9-growth-in-mac-shipments-during-q1-2026/,2026-04-10T02:19:07+00:00,9to5Mac,Marcus Mendes,https://i0.wp.com/9to5mac.com/wp-content/uploads/sites/6/2025/12/macbook-lid-glow.jpg?resize=1200%2C628&quality=82&strip=all&ssl=1
"The iPhone Air was our most polarising phone of 2025, but this 28% discount makes it an easy recommendation","TechRadar’s international team of experts were split on the thin and light iPhone Air, but we can all agree it’s the better buy when it’s cheaper than the 256GB iPhone 17.","Not long after the thin and light iPhone Air was launched in September, we crowned it the Phone of the Year for 2025 — not because it was the best phone ever, but because it was the most talked about… [+2458 chars]","The iPhone Air was our most polarising phone of 2025, but this 28% discount makes it an easy recommendation TechRadar’s international team of experts were split on the thin and light iPhone Air, but we can all agree it’s the better buy when it’s cheaper than the 256GB iPhone 17. Not long after the thin and light iPhone Air was launched in September, we crowned it the Phone of the Year for 2025 — not because it was the best phone ever, but because it was the most talked about… [+2458 chars]",https://www.techradar.com/phones/iphone/the-iphone-air-was-our-most-polarising-phone-of-2025-but-this-28-percent-discount-makes-it-an-easy-recommendation,2026-04-10T01:57:27+00:00,TechRadar,"nico.arboleda@futurenet.com (Nico Arboleda) , Nico Arboleda",https://cdn.mos.cms.futurecdn.net/NTLyJysXDWXetFwNKs4kWG-2000-80.jpg
Anthropic’s AI model scare sparks urgent US warning to bank CEOs,Anthropic said Mythos can identify and then exploit vulnerabilities in every major operating system and web browser. Read more at straitstimes.com. Read more at straitstimes.com.,NEW YORK US Treasury Secretary Scott Bessent and Federal Reserve chair Jerome Powell summoned Wall Street leaders to an urgent meeting on concerns that the latest artificial intelligence model from A… [+2445 chars],Anthropic’s AI model scare sparks urgent US warning to bank CEOs Anthropic said Mythos can identify and then exploit vulnerabilities in every major operating system and web browser. Read more at straitstimes.com. Read more at straitstimes.com. NEW YORK US Treasury Secretary Scott Bessent and Federal Reserve chair Jerome Powell summoned Wall Street leaders to an urgent meeting on concerns that the latest artificial intelligence model from A… [+2445 chars],https://www.straitstimes.com/business/companies-markets/anthropics-ai-model-scare-sparks-urgent-bessent-powell-warning-to-us-bank-ceos,2026-04-10T01:42:00+00:00,The Straits Times,,https://cassette.sphdigital.com.sg/image/straitstimes/63568489d3d4a16f073a6b7e9b840bd2d0e8fca4e46ae8dd0054203d708e6659
