title,description,content,text_for_analysis,url,published_at,source,author,image_url
"Intel, Google to double down on AI CPUs with expanded partnership",Intel and Google are deepening their collaboration. They will advance artificial intelligence CPUs and create custom infrastructure processors. This move responds to the growing need for generalist chips as AI shifts from training to deployment. Google will u…,"Intel and Google have expanded their partnership to advance the use of artificial intelligence-focused central processing units and to develop custom infrastructure processors, as shifting use of AI … [+1651 chars]","Intel, Google to double down on AI CPUs with expanded partnership Intel and Google are deepening their collaboration. They will advance artificial intelligence CPUs and create custom infrastructure processors. This move responds to the growing need for generalist chips as AI shifts from training to deployment. Google will u… Intel and Google have expanded their partnership to advance the use of artificial intelligence-focused central processing units and to develop custom infrastructure processors, as shifting use of AI … [+1651 chars]",https://economictimes.indiatimes.com/tech/artificial-intelligence/intel-google-to-double-down-on-ai-cpus-with-expanded-partnership/articleshow/130144706.cms,2026-04-09T13:38:35+00:00,The Times of India,Reuters,"https://img.etimg.com/thumb/width-1200,height-900,imgsize-55652,resizemode-75,msid-130144706/tech/artificial-intelligence/intel-google-to-double-down-on-ai-cpus-with-expanded-partnership.jpg"
Peace President's Iran war piles more pain on already battered PC market,"Memory costs were already through the roof - now freight's spiking too, and budget systems face extinction America's war with Iran is jacking up the pressure on computing markets already struggling with memory shortages and component cost inflation, meaning b…","America's war with Iran is jacking up the pressure on computing markets already struggling with memory shortages and component cost inflation, meaning buyers should brace themselves for even higher p… [+3727 chars]","Peace President's Iran war piles more pain on already battered PC market Memory costs were already through the roof - now freight's spiking too, and budget systems face extinction America's war with Iran is jacking up the pressure on computing markets already struggling with memory shortages and component cost inflation, meaning b… America's war with Iran is jacking up the pressure on computing markets already struggling with memory shortages and component cost inflation, meaning buyers should brace themselves for even higher p… [+3727 chars]",https://www.theregister.com/2026/04/09/middle_east_madness_to_hike/,2026-04-09T13:38:09+00:00,Theregister.com,Dan Robinson,https://regmedia.co.uk/2026/04/09/trump_at_desk.jpg
Intel Stock Is Up 225% in a Year but Wall Street Still Isn’t Buying It,,"If you click 'Accept all', we and our partners, including 251 who are part of the IAB Transparency &amp; Consent Framework, will also store and / or access information on a device (in other words, us… [+1046 chars]","Intel Stock Is Up 225% in a Year but Wall Street Still Isn’t Buying It If you click 'Accept all', we and our partners, including 251 who are part of the IAB Transparency Consent Framework, will also store and / or access information on a device (in other words, us… [+1046 chars]",https://consent.yahoo.com/v2/collectConsent?sessionId=1_cc-session_6ca59f32-5afb-42eb-a782-018e0935f329,2026-04-09T13:25:47+00:00,Yahoo Entertainment,,
"Dear Intel Stock Fans, Mark Your Calendars for April 23",,"If you click 'Accept all', we and our partners, including 251 who are part of the IAB Transparency &amp; Consent Framework, will also store and / or access information on a device (in other words, us… [+1046 chars]","Dear Intel Stock Fans, Mark Your Calendars for April 23 If you click 'Accept all', we and our partners, including 251 who are part of the IAB Transparency Consent Framework, will also store and / or access information on a device (in other words, us… [+1046 chars]",https://consent.yahoo.com/v2/collectConsent?sessionId=1_cc-session_06676161-d0bf-4c26-80a6-8e8595a70b0b,2026-04-09T13:15:01+00:00,Yahoo Entertainment,,
"SiFive raises $400 million from Atreides, Nvidia for data-center chip technology","SAN FRANCISCO, April 9 : Silicon Valley startup SiFive said on Thursday it has raised a $400 million round of funding from Atreides Management, Nvidia and others to enter the booming market for data-center central processor chips.The round brings SiFive's val…","SAN FRANCISCO, April 9 : Silicon Valley startup SiFive said on Thursday it has raised a $400 million round of funding from Atreides Management, Nvidia and others to enter the booming market for data-… [+1868 chars]","SiFive raises $400 million from Atreides, Nvidia for data-center chip technology SAN FRANCISCO, April 9 : Silicon Valley startup SiFive said on Thursday it has raised a $400 million round of funding from Atreides Management, Nvidia and others to enter the booming market for data-center central processor chips.The round brings SiFive's val… SAN FRANCISCO, April 9 : Silicon Valley startup SiFive said on Thursday it has raised a $400 million round of funding from Atreides Management, Nvidia and others to enter the booming market for data-… [+1868 chars]",https://www.channelnewsasia.com/business/sifive-raises-400-million-atreides-nvidia-data-center-chip-technology-6046856,2026-04-09T13:07:45+00:00,CNA,,"https://dam.mediacorp.sg/image/upload/s--MH_IIMFP--/c_fill,g_auto,h_676,w_1200/fl_relative,g_south_east,l_mediacorp:cna:watermark:2024-04:reuters_1,w_0.1/f_auto,q_auto/v1/one-cms/core/2026-04-09T130536Z_1_LYNXMPEM380T7_RTROPTP_3_SIFIVE-FUNDING.JPG?itok=qmhoiHzg"
Intel and Google to double down on AI CPUs with expanded partnership,"April 9 : Intel and Google have expanded their partnership to advance the use of artificial intelligence-focused central processing units and to develop custom infrastructure processors, as shifting use of AI drives renewed demand for traditional computing ch…","April 9 : Intel and Google have expanded their partnership to advance the use of artificial intelligence-focused central processing units and to develop custom infrastructure processors, as shifting … [+1663 chars]","Intel and Google to double down on AI CPUs with expanded partnership April 9 : Intel and Google have expanded their partnership to advance the use of artificial intelligence-focused central processing units and to develop custom infrastructure processors, as shifting use of AI drives renewed demand for traditional computing ch… April 9 : Intel and Google have expanded their partnership to advance the use of artificial intelligence-focused central processing units and to develop custom infrastructure processors, as shifting … [+1663 chars]",https://www.channelnewsasia.com/business/intel-and-google-double-down-ai-cpus-expanded-partnership-6046846,2026-04-09T13:02:25+00:00,CNA,,"https://dam.mediacorp.sg/image/upload/s---3GqK_ql--/c_fill,g_auto,h_676,w_1200/fl_relative,g_south_east,l_mediacorp:cna:watermark:2024-04:reuters_1,w_0.1/f_auto,q_auto/v1/one-cms/core/2026-04-09T130225Z_1_LYNXMPEM380T0_RTROPTP_3_SPACEX-TESLA-CHIPS-INTEL.JPG?itok=pwX_KRu0"
Intel and Google to double down on AI CPUs with expanded partnership,Intel and Google have expanded their partnership to advance the use of artificial intelligence-focused central processing units and ‌to develop custom...,"April 9 (Reuters) - Intel and Google have expanded their partnership to advance the use of artificial intelligence-focused central processing units and to develop custom infrastructure processors, as… [+1744 chars]","Intel and Google to double down on AI CPUs with expanded partnership Intel and Google have expanded their partnership to advance the use of artificial intelligence-focused central processing units and ‌to develop custom... April 9 (Reuters) - Intel and Google have expanded their partnership to advance the use of artificial intelligence-focused central processing units and to develop custom infrastructure processors, as… [+1744 chars]",https://finance.yahoo.com/sectors/technology/articles/intel-google-double-down-ai-130225134.html,2026-04-09T13:02:25+00:00,Yahoo Entertainment,Reuters,https://s.yimg.com/os/en/reuters-finance.com/e0c96cba61d335757b5d2ca94ffad87c
The MacBook Neo is the best thing to happen to Windows in years,"If there's one thing I know about Microsoft after covering the company for more than 20 years, it's that it will always respond to a competitive threat. Apple's MacBook Air convinced Microsoft and Intel to launch thin and light laptops with the Ultrabook init…","<ul><li></li><li></li><li></li></ul>
Microsoft always responds to a threat to Windows by improving the operating system.
Microsoft always responds to a threat to Windows by improving the operating … [+12999 chars]","The MacBook Neo is the best thing to happen to Windows in years If there's one thing I know about Microsoft after covering the company for more than 20 years, it's that it will always respond to a competitive threat. Apple's MacBook Air convinced Microsoft and Intel to launch thin and light laptops with the Ultrabook init… Microsoft always responds to a threat to Windows by improving the operating system. Microsoft always responds to a threat to Windows by improving the operating … [+12999 chars]",https://www.theverge.com/tech/909140/microsoft-windows-11-fixes-macbook-neo-response-notepad,2026-04-09T13:02:21+00:00,The Verge,Tom Warren,https://platform.theverge.com/wp-content/uploads/sites/2/2026/03/268387_Apple_MacBook_Neo_AKrales_0507.jpg?quality=90&strip=all&crop=0%2C10.732984293194%2C100%2C78.534031413613&w=1200
Google expands partnership with Intel for AI chips,"Google has committed to using multiple generations of Intel chips to power its AI data centers, in an expansion of an existing partnership.","Google has committed to using multiple generations of Intel central processing units in its artificial intelligence data centers, an expansion of an existing partnership.
The internet giant has long… [+3103 chars]","Google expands partnership with Intel for AI chips Google has committed to using multiple generations of Intel chips to power its AI data centers, in an expansion of an existing partnership. Google has committed to using multiple generations of Intel central processing units in its artificial intelligence data centers, an expansion of an existing partnership. The internet giant has long… [+3103 chars]",https://www.cnbc.com/2026/04/09/google-expands-partnership-with-intel-for-ai-chips-.html,2026-04-09T13:00:01+00:00,CNBC,Katie Tarasov,https://image.cnbcfm.com/api/v1/image/108209988-1760019895734-lib-bu-tan-wafer-ultra-core-3-1024x726.jpg?v=1769029098&w=1920&h=1080
(PR) Global PC Shipments Grew 3% in 1Q26 as Supply Chain Impacts Emerged,"According to the latest research from Omdia, total shipments of desktops, notebooks, and workstations in 1Q26 increased by 3.2% year-over-year to 64.8 million units. Notebooks (including mobile workstations) saw a modest year-over-year increase of 2.6% in Q1 …","According to the latest research from Omdia, total shipments of desktops, notebooks, and workstations in 1Q26 increased by 3.2% year-over-year to 64.8 million units. Notebooks (including mobile works… [+2669 chars]","(PR) Global PC Shipments Grew 3% in 1Q26 as Supply Chain Impacts Emerged According to the latest research from Omdia, total shipments of desktops, notebooks, and workstations in 1Q26 increased by 3.2% year-over-year to 64.8 million units. Notebooks (including mobile workstations) saw a modest year-over-year increase of 2.6% in Q1 … According to the latest research from Omdia, total shipments of desktops, notebooks, and workstations in 1Q26 increased by 3.2% year-over-year to 64.8 million units. Notebooks (including mobile works… [+2669 chars]",https://www.techpowerup.com/348111/global-pc-shipments-grew-3-in-1q26-as-supply-chain-impacts-emerged,2026-04-09T12:52:30+00:00,Techpowerup.com,Nomad76,https://www.techpowerup.com/img/PnjDIL85jSy9n9rS.jpg
"Build a $5,000 AM5 gaming PC for just $2,771 with this Newegg combo deal — 9800X3D and RTX 5070 also come with 128GB of DDR5 RAM, 4TB SSD, X870E motherboard, and AIO cooler","Build a gaming PC worth $5,019 for just $2,771.98 in this epic Newegg combo deal with a 9800X3D, a whopping 128GB of DDR5 RAM, an MSI X870E motherboard, and a RTX 5070, along with a free 4TB SSD, MSI MAG liquid cooler, and three free games, saving you over $2…","A truly epic gaming PC build could be yours if you fancy building it yourself, and it's all thanks to Newegg. The company have dropped a bundle to beat them all, combining a set of parts with a list … [+3894 chars]","Build a $5,000 AM5 gaming PC for just $2,771 with this Newegg combo deal — 9800X3D and RTX 5070 also come with 128GB of DDR5 RAM, 4TB SSD, X870E motherboard, and AIO cooler Build a gaming PC worth $5,019 for just $2,771.98 in this epic Newegg combo deal with a 9800X3D, a whopping 128GB of DDR5 RAM, an MSI X870E motherboard, and a RTX 5070, along with a free 4TB SSD, MSI MAG liquid cooler, and three free games, saving you over $2… A truly epic gaming PC build could be yours if you fancy building it yourself, and it's all thanks to Newegg. The company have dropped a bundle to beat them all, combining a set of parts with a list … [+3894 chars]",https://www.tomshardware.com/desktops/gaming-pcs/build-a-usd5-000-am5-gaming-pc-for-just-usd2-771-with-this-newegg-combo-deal-9800x3d-and-rtx-5070-also-come-with-128gb-of-ddr5-ram-4tb-ssd-x870e-motherboard-and-aio-cooler,2026-04-09T12:07:29+00:00,Tom's Hardware UK,Ben Stockton,https://cdn.mos.cms.futurecdn.net/T8kHQyJbdmenjCJrn4qPin-1920-80.jpg
"Intel developing two-lever retention mechanism for LGA 1954 socket, according to new leak — Premium Nova Lake-S motherboards will feature 2L-ILM sockets","Some high-end motherboards for Intel's upcoming Nova Lake processors have been tipped to include a dual-lever retention mechanism called ""2L-ILM."" We've seen something similar before with LGA 2011, but that a server platform. Boards with 2L-ILM will live alon…","Intel's upcoming Nova Lake-S lineup of desktop CPUs has a lot to live up to, given the rumor mill surrounding the next-gen family. The latest leak in the cycle comes from Videocardz, which is claimin… [+2488 chars]","Intel developing two-lever retention mechanism for LGA 1954 socket, according to new leak — Premium Nova Lake-S motherboards will feature 2L-ILM sockets Some high-end motherboards for Intel's upcoming Nova Lake processors have been tipped to include a dual-lever retention mechanism called ""2L-ILM."" We've seen something similar before with LGA 2011, but that a server platform. Boards with 2L-ILM will live alon… Intel's upcoming Nova Lake-S lineup of desktop CPUs has a lot to live up to, given the rumor mill surrounding the next-gen family. The latest leak in the cycle comes from Videocardz, which is claimin… [+2488 chars]",https://www.tomshardware.com/pc-components/cpus/intel-developing-two-lever-retention-mechanism-for-lga-1954-socket-according-to-new-leak-premium-nova-lake-s-motherboards-will-feature-2l-ilm-sockets,2026-04-09T12:01:06+00:00,Tom's Hardware UK,"editors@tomshardware.com (Hassam Nasir) , Hassam Nasir",https://cdn.mos.cms.futurecdn.net/6dhScSyVh9hBM75rUoJ4qN-2560-80.jpg
"AirJoule Technologies Named ""Water Tech Innovation of the Year"" in 2026 CleanTech Breakthrough Awards Program","Independent recognition highlights AirJoule’s breakthrough water-from-air platform and accelerating momentum toward commercial deployment  RONAN, Mont.,...","Independent recognition highlights AirJoules breakthrough water-from-air platform and accelerating momentum toward commercial deployment
RONAN, Mont., April 09, 2026 (GLOBE NEWSWIRE) -- AirJoule Tec… [+9845 chars]","AirJoule Technologies Named ""Water Tech Innovation of the Year"" in 2026 CleanTech Breakthrough Awards Program Independent recognition highlights AirJoule’s breakthrough water-from-air platform and accelerating momentum toward commercial deployment RONAN, Mont.,... Independent recognition highlights AirJoules breakthrough water-from-air platform and accelerating momentum toward commercial deployment RONAN, Mont., April 09, 2026 (GLOBE NEWSWIRE) -- AirJoule Tec… [+9845 chars]",https://www.globenewswire.com/news-release/2026/04/09/3270910/0/en/AirJoule-Technologies-Named-Water-Tech-Innovation-of-the-Year-in-2026-CleanTech-Breakthrough-Awards-Program.html,2026-04-09T12:01:00+00:00,GlobeNewswire,AirJoule Technologies Corporation,https://ml.globenewswire.com/Resource/Download/b72aa74f-2b5d-4c9f-9ee9-4f8c7bbeeaea
Republicans shrug as 'socialist' Trump accusations fly,"WASHINGTON — President Donald Trump has overseen an unprecedented melding of the private sector with the federal government — so much so that critics say it smells of socialism.Since Trump re-entered the White House, America has taken a stake in at least 10 p…","WASHINGTON President Donald Trump has overseen an unprecedented melding of the private sector with the federal government so much so that critics say it smells of socialism.
Since Trump re-entered t… [+9445 chars]","Republicans shrug as 'socialist' Trump accusations fly WASHINGTON — President Donald Trump has overseen an unprecedented melding of the private sector with the federal government — so much so that critics say it smells of socialism.Since Trump re-entered the White House, America has taken a stake in at least 10 p… WASHINGTON President Donald Trump has overseen an unprecedented melding of the private sector with the federal government so much so that critics say it smells of socialism. Since Trump re-entered t… [+9445 chars]",https://www.rawstory.com/raw-investigates/trump-socialism/,2026-04-09T11:58:31+00:00,Raw Story,Matt Laslo,https://www.rawstory.com/media-library/image.jpg?id=65489991&width=1200&height=600&coordinates=0%2C190%2C0%2C191
Intel Arc Pro B70 Quad-GPU Setup Reportedly Consumes Up To 720W In Inference Workloads,"With limited reviews available, you will hardly hear about the Arc Pro B70's performance. Here's a sneak peek into the analysis by Hardware Luxx. Hardware Luxx Intel Arc Pro B70 Review Reveals GPU's Performance Against Its Competitors Intel's flagship worksta…","With limited reviews available, you will hardly hear about the Arc Pro B70's performance. Here's a sneak peek into the analysis by Hardware Luxx.
Intel's flagship workstation Big Battlemage GPUs wer… [+2104 chars]","Intel Arc Pro B70 Quad-GPU Setup Reportedly Consumes Up To 720W In Inference Workloads With limited reviews available, you will hardly hear about the Arc Pro B70's performance. Here's a sneak peek into the analysis by Hardware Luxx. Hardware Luxx Intel Arc Pro B70 Review Reveals GPU's Performance Against Its Competitors Intel's flagship worksta… With limited reviews available, you will hardly hear about the Arc Pro B70's performance. Here's a sneak peek into the analysis by Hardware Luxx. Intel's flagship workstation Big Battlemage GPUs wer… [+2104 chars]",https://wccftech.com/intel-arc-pro-b70-quad-gpu-setup-reportedly-consumes-up-to-720w-in-inference-workloads/,2026-04-09T11:48:50+00:00,Wccftech,Sarfraz Khan,https://cdn.wccftech.com/wp-content/uploads/2026/03/Intel-Arc-Pro-B70-B65-1920x1076.jpg
"Semiconductor Intellectual Property Market Research and Global Forecast Report 2026-2032: Modular Architectures, Hybrid Licensing and Built-In Security Redefine Competitive Strategies","Opportunities in semiconductor IP include strategic IP selection, modular architectures, evolving licensing, supply chain resilience, cross-domain collaboration, and security integration. Opportunities in semiconductor IP include strategic IP selection, modul…","Dublin, April 09, 2026 (GLOBE NEWSWIRE) -- The ""Semiconductor Intellectual Property Market - Global Forecast 2026-2032"" report has been added to ResearchAndMarkets.com's offering.
The Semiconductor … [+6971 chars]","Semiconductor Intellectual Property Market Research and Global Forecast Report 2026-2032: Modular Architectures, Hybrid Licensing and Built-In Security Redefine Competitive Strategies Opportunities in semiconductor IP include strategic IP selection, modular architectures, evolving licensing, supply chain resilience, cross-domain collaboration, and security integration. Opportunities in semiconductor IP include strategic IP selection, modul… Dublin, April 09, 2026 (GLOBE NEWSWIRE) -- The ""Semiconductor Intellectual Property Market - Global Forecast 2026-2032"" report has been added to ResearchAndMarkets.com's offering. The Semiconductor … [+6971 chars]",https://www.globenewswire.com/news-release/2026/04/09/3270836/28124/en/Semiconductor-Intellectual-Property-Market-Research-and-Global-Forecast-Report-2026-2032-Modular-Architectures-Hybrid-Licensing-and-Built-In-Security-Redefine-Competitive-Strategie.html,2026-04-09T11:32:00+00:00,GlobeNewswire,Research and Markets,https://ml.globenewswire.com/Resource/Download/d678139b-64f5-4ed0-95b3-1d42fc368ae9
"Polymarket promo code NYPMAX: Deposit $20, get $20 for the Masters",The Polymarket promo code NYPMAX will unlock a $20 bonus after you make your first deposit of $20.,"Gambling content 21+. The New York Post may receive an affiliate commission if you sign up through our links. Read our editorial standards for more information.
The first round of the 2026 Masters k… [+2593 chars]","Polymarket promo code NYPMAX: Deposit $20, get $20 for the Masters The Polymarket promo code NYPMAX will unlock a $20 bonus after you make your first deposit of $20. Gambling content 21+. The New York Post may receive an affiliate commission if you sign up through our links. Read our editorial standards for more information. The first round of the 2026 Masters k… [+2593 chars]",https://nypost.com/2026/04/09/betting/polymarket-promo-code-nypmax-deposit-20-get-20-for-the-masters-3/,2026-04-09T11:00:00+00:00,New York Post,Sean Treppedi,https://nypost.com/wp-content/uploads/sites/2/2026/04/crop-39030880_f41da0.jpg?quality=75&strip=all&w=1200
China Watches Trump Blink,A blockade of Taiwan would hurt the global economy more than Iran’s blockade of the Strait of Hormuz.,"China stands to learn a lot from the war in Iran. Red lines and deadlines imposed by the United States, even when backed by the threat of genocide, can turn out to be rather wobbly. The American mili… [+5216 chars]","China Watches Trump Blink A blockade of Taiwan would hurt the global economy more than Iran’s blockade of the Strait of Hormuz. China stands to learn a lot from the war in Iran. Red lines and deadlines imposed by the United States, even when backed by the threat of genocide, can turn out to be rather wobbly. The American mili… [+5216 chars]",https://www.theatlantic.com/national-security/2026/04/china-taiwan-trump-iran-war/686738/,2026-04-09T11:00:00+00:00,The Atlantic,Simon Shuster,https://cdn.theatlantic.com/thumbor/RJJH7zKSTJ0mV5xoBvuL6dONZl8=/0x85:3994x2165/1200x625/media/img/mt/2026/04/2026_04_09_What_the_Mess_in_the_Strait_of_Hormuz_Has_Taught_China_About_the_Taiwan_Strait/original.jpg
David Cornwall’s key takeaways from the events circuit so far in 2026,"The documentary veteran and Scorpion TV MD delivers his key takeaways from the start of 2026, including a squeezed middle, a complicated rights picture and the continued importance of brands. How would...","By David Cornwall 09-04-2026
The documentary veteran and Scorpion TV MD delivers his key takeaways from the start of 2026, including a squeezed middle, a complicated rights picture and the continued… [+7898 chars]","David Cornwall’s key takeaways from the events circuit so far in 2026 The documentary veteran and Scorpion TV MD delivers his key takeaways from the start of 2026, including a squeezed middle, a complicated rights picture and the continued importance of brands. How would... By David Cornwall 09-04-2026 The documentary veteran and Scorpion TV MD delivers his key takeaways from the start of 2026, including a squeezed middle, a complicated rights picture and the continued… [+7898 chars]",https://www.c21media.net/perspective/david-cornwalls-key-takeaways-from-the-events-circuit-so-far-in-2026/,2026-04-09T10:39:02+00:00,C21media.net,C21 Reporters,https://cdn.c21media.net/wp-content/uploads/2026/04/david-cornwall-photo-medium1.jpg
3 things investors learned from the market's latest TACO-trade bonanza,The market is throwing off signals about how things might look if the Iran war continues to deescalate.,"If you like me are enmeshed in the day-to-day swings of the market, it can be easy to take the volatility for granted. Between COVID and Trump 2.0, chaotic market gyrations have become the norm.
Sti… [+2679 chars]","3 things investors learned from the market's latest TACO-trade bonanza The market is throwing off signals about how things might look if the Iran war continues to deescalate. If you like me are enmeshed in the day-to-day swings of the market, it can be easy to take the volatility for granted. Between COVID and Trump 2.0, chaotic market gyrations have become the norm. Sti… [+2679 chars]",https://www.businessinsider.com/taco-trade-wti-brent-crude-oil-price-outlook-stock-market-2026-4,2026-04-09T09:50:03+00:00,Business Insider,jciolli@businessinsider.com (Joe Ciolli),https://i.insider.com/69d6c8a8f36fd1a78c0521ae?width=1024&format=jpeg
