title,description,content,text_for_analysis,url,published_at,source,author,image_url
"The Tech Download: Reputational damage, supply chain issues and local investment. What's next for Middle East tech?","A two-week ceasefire was agreed between the U.S. and Iran on Wednesday, prompting hopes of the beginnings of the end of the conflict.","This report is from this week's The Tech Download newsletter. Like what you see? You can subscribe here.
The past week has seen some progress, albeit uneasy and stilted, being made towards ending th… [+5271 chars]","The Tech Download: Reputational damage, supply chain issues and local investment. What's next for Middle East tech? A two-week ceasefire was agreed between the U.S. and Iran on Wednesday, prompting hopes of the beginnings of the end of the conflict. This report is from this week's The Tech Download newsletter. Like what you see? You can subscribe here. The past week has seen some progress, albeit uneasy and stilted, being made towards ending th… [+5271 chars]",https://www.cnbc.com/2026/04/10/tech-download-iran-war-whats-next-helium-chips.html,2026-04-10T11:00:01+00:00,CNBC,Kai Nicol-Schwarz,https://image.cnbcfm.com/api/v1/image/108286327-1775081004470-gettyimages-2268781497-AFP_A6FZ8QY.jpeg?v=1775081072&w=1920&h=1080
10 Best AI Chip Makers in 2026: NVIDIA Dominates AI Chip Race as Market Surges Toward $500 Billion Milestone,"SAN FRANCISCO — NVIDIA Corp. solidified its commanding lead in the exploding artificial intelligence chip sector in early 2026, capturing roughly 80-85% of the AI accelerator market while the broader AI semiconductor industry hurtled toward half a trillion do…","SAN FRANCISCO — NVIDIA Corp. solidified its commanding lead in the exploding artificial intelligence chip sector in early 2026, capturing roughly 80-85% of the AI accelerator market while the broader… [+8971 chars]","10 Best AI Chip Makers in 2026: NVIDIA Dominates AI Chip Race as Market Surges Toward $500 Billion Milestone SAN FRANCISCO — NVIDIA Corp. solidified its commanding lead in the exploding artificial intelligence chip sector in early 2026, capturing roughly 80-85% of the AI accelerator market while the broader AI semiconductor industry hurtled toward half a trillion do… SAN FRANCISCO — NVIDIA Corp. solidified its commanding lead in the exploding artificial intelligence chip sector in early 2026, capturing roughly 80-85% of the AI accelerator market while the broader… [+8971 chars]",https://www.ibtimes.com.au/10-best-ai-chip-makers-2026-nvidia-dominates-ai-chip-race-market-surges-toward-500-billion-1866051,2026-04-10T09:46:44+00:00,Ibtimes.com.au,Daniel Lee,https://d.ibtimes.com.au/en/full/1858708/tech-giants-ai-race-have-been-spending-billions-dollars-gpus-made-nvidia-considered-leader.jpg
"Ambitious hacker reduces worst-case memory latency by up to 93%, but with severe downsides — 1960s bottleneck overcome by hedging memory accesses to avoid running into DRAM refresh stalls","The clever software trick works on both x86 and Arm to radically reduce worst-case memory latency, but it has severe limitations, too.","A method devised by YouTuber, Googler, and security researcher LaurieWired could have huge implications for a very few specific use cases and workloads that are highly sensitive to ""tail latency,"" or… [+7720 chars]","Ambitious hacker reduces worst-case memory latency by up to 93%, but with severe downsides — 1960s bottleneck overcome by hedging memory accesses to avoid running into DRAM refresh stalls The clever software trick works on both x86 and Arm to radically reduce worst-case memory latency, but it has severe limitations, too. A method devised by YouTuber, Googler, and security researcher LaurieWired could have huge implications for a very few specific use cases and workloads that are highly sensitive to ""tail latency,"" or… [+7720 chars]",https://www.tomshardware.com/software/ambitious-hacker-reduces-worst-case-memory-latency-by-up-to-93-percent-but-with-severe-downsides-1960s-bottleneck-overcome-by-hedging-memory-accesses-to-avoid-running-into-dram-refresh-stalls,2026-04-10T09:26:17+00:00,Tom's Hardware UK,Zak Killian,https://cdn.mos.cms.futurecdn.net/NQmsyhzefFY96H2vVzpPZJ-1920-80.jpg
TSMC posts 35% jump in revenue to new record high as AI chip demand stays strong,TSMC is benefiting from sustained demand for advanced semiconductors from its key customers like Apple and Nvidia.,"Taiwan Semiconductor Manufacturing Co. on Friday posted another quarter of record revenue driven by demand for AI chips.
For January to March, the world's largest chipmaker reported revenue of 1.13 … [+2288 chars]","TSMC posts 35% jump in revenue to new record high as AI chip demand stays strong TSMC is benefiting from sustained demand for advanced semiconductors from its key customers like Apple and Nvidia. Taiwan Semiconductor Manufacturing Co. on Friday posted another quarter of record revenue driven by demand for AI chips. For January to March, the world's largest chipmaker reported revenue of 1.13 … [+2288 chars]",https://www.cnbc.com/2026/04/10/tsmc-q1-record-revenue-ai-chip-demand-strong.html,2026-04-10T08:13:07+00:00,CNBC,Arjun Kharpal,https://image.cnbcfm.com/api/v1/image/108263658-1770697651993-gettyimages-2251610250-TFSPI_15122025-3274.jpeg?v=1775806078&w=1920&h=1080
Augmented Reality in Automotive Strategic Intelligence Report 2026 - Automakers Should Invest in AR Heads-up Displays,"AR offers significant opportunities in the automotive sector by enhancing design processes, improving vehicle safety with heads-up displays, and boosting customer engagement. By integrating AR with ADAS and collaborating with tech vendors, automakers can stay…","Dublin, April 10, 2026 (GLOBE NEWSWIRE) -- The ""Strategic Intelligence: Augmented Reality in Automotive"" report has been added to ResearchAndMarkets.com's offering.
The report covers how AR overcome… [+4218 chars]","Augmented Reality in Automotive Strategic Intelligence Report 2026 - Automakers Should Invest in AR Heads-up Displays AR offers significant opportunities in the automotive sector by enhancing design processes, improving vehicle safety with heads-up displays, and boosting customer engagement. By integrating AR with ADAS and collaborating with tech vendors, automakers can stay… Dublin, April 10, 2026 (GLOBE NEWSWIRE) -- The ""Strategic Intelligence: Augmented Reality in Automotive"" report has been added to ResearchAndMarkets.com's offering. The report covers how AR overcome… [+4218 chars]",https://www.globenewswire.com/news-release/2026/04/10/3271555/28124/en/Augmented-Reality-in-Automotive-Strategic-Intelligence-Report-2026-Automakers-Should-Invest-in-AR-Heads-up-Displays.html,2026-04-10T08:05:00+00:00,GlobeNewswire,Research and Markets,https://ml.globenewswire.com/Resource/Download/908fb457-7f8e-4a08-9081-5565e3dfb3d7
Why pay thousands for a new laptop? This MacBook Air refurb gets the job done for under $200,"Macworld







TL;DR: This refurbished 2017 MacBook Air delivers reliable everyday performance with 8GB RAM, a fast 128GB SSD, and up to 12 hours of battery life, all for just $199.97 (MSRP $999) through April 19.




If your current laptop struggles to ke…","Skip to contentType your search and hit enter
When you purchase through links in our articles, we may earn a small commission. This doesn't affect our editorial independence
.
TL;DR: This refurbis… [+1574 chars]","Why pay thousands for a new laptop? This MacBook Air refurb gets the job done for under $200 Macworld TL;DR: This refurbished 2017 MacBook Air delivers reliable everyday performance with 8GB RAM, a fast 128GB SSD, and up to 12 hours of battery life, all for just $199.97 (MSRP $999) through April 19. If your current laptop struggles to ke… Skip to contentType your search and hit enter When you purchase through links in our articles, we may earn a small commission. This doesn't affect our editorial independence . TL;DR: This refurbis… [+1574 chars]",https://www.macworld.com/article/3107361/why-pay-thousands-for-a-new-laptop-this-macbook-air-refurb-gets-the-job-done-for-under-200.html,2026-04-10T08:00:00+00:00,Macworld,DealPost Team,https://www.macworld.com/wp-content/uploads/2026/04/MacBook-Air.jpg?quality=50&strip=all&w=1024
Lithography Equipment Market Size to Grow USD 53.94 Billion by 2035 | SNS Insider,"Lithography Equipment Market Size, Share, Revenue Trends & Segment, By Technology, Equipment, Application, End Use, and Region | Global Forecast 2035...","Austin, April 10, 2026 (GLOBE NEWSWIRE) -- Lithography Equipment Market Size &amp; Growth Outlook:
According to the SNS Insider, The Lithography Equipment Market Size was valued at USD 28.63 Billion… [+7717 chars]","Lithography Equipment Market Size to Grow USD 53.94 Billion by 2035 | SNS Insider Lithography Equipment Market Size, Share, Revenue Trends & Segment, By Technology, Equipment, Application, End Use, and Region | Global Forecast 2035... Austin, April 10, 2026 (GLOBE NEWSWIRE) -- Lithography Equipment Market Size Growth Outlook: According to the SNS Insider, The Lithography Equipment Market Size was valued at USD 28.63 Billion… [+7717 chars]",https://www.globenewswire.com/news-release/2026/04/10/3271541/0/en/Lithography-Equipment-Market-Size-to-Grow-USD-53-94-Billion-by-2035-SNS-Insider.html,2026-04-10T07:30:00+00:00,GlobeNewswire,SNS Insider pvt ltd,https://ml.globenewswire.com/Resource/Download/d6272c2e-d204-41b8-b545-a6e2e24f85c2
Intel's TeraFab Win A Major Credibility Boost For Foundry Arm: Analyst,"Intel Corp., Tesla Inc., xAI, and SpaceX finalized a landmark TeraFab partnership on Tuesday, positioning Intel as a core technology and manufacturing...","Intel Corp., Tesla Inc., xAI, and SpaceX finalized a landmark TeraFab partnership on Tuesday, positioning Intel as a core technology and manufacturing partner to scale next-generation AI and semicond… [+1854 chars]","Intel's TeraFab Win A Major Credibility Boost For Foundry Arm: Analyst Intel Corp., Tesla Inc., xAI, and SpaceX finalized a landmark TeraFab partnership on Tuesday, positioning Intel as a core technology and manufacturing... Intel Corp., Tesla Inc., xAI, and SpaceX finalized a landmark TeraFab partnership on Tuesday, positioning Intel as a core technology and manufacturing partner to scale next-generation AI and semicond… [+1854 chars]",https://finance.yahoo.com/sectors/technology/articles/intels-terafab-win-major-credibility-023107116.html,2026-04-10T02:31:07+00:00,Yahoo Entertainment,Anusuya Lahiri,https://s.yimg.com/os/en/Benzinga/d60c22419011b4666ceef8d4568f7ba0
Intel inks multiyear data center chip partnership with Google,Google LLC will adopt multiple future iterations of Intel Corp.’s Xeon processor series as part of a collaboration announced today. Shares of the chipmaker closed 4.7% higher on the news. Google will deploy the chips in its cloud platform. They will power art…,"Google LLC will adopt multiple future iterations of Intel Corp.s Xeon processor series as part of a collaboration announced today.
Shares of the chipmaker closed 4.7% higher on the news.
Google wil… [+3939 chars]",Intel inks multiyear data center chip partnership with Google Google LLC will adopt multiple future iterations of Intel Corp.’s Xeon processor series as part of a collaboration announced today. Shares of the chipmaker closed 4.7% higher on the news. Google will deploy the chips in its cloud platform. They will power art… Google LLC will adopt multiple future iterations of Intel Corp.s Xeon processor series as part of a collaboration announced today. Shares of the chipmaker closed 4.7% higher on the news. Google wil… [+3939 chars],https://siliconangle.com/2026/04/09/intel-inks-multiyear-data-center-chip-partnership-google/,2026-04-09T23:03:49+00:00,SiliconANGLE News,Maria Deutscher,https://d15shllkswkct0.cloudfront.net/wp-content/blogs.dir/1/files/2026/04/Intel-1.jpg
"Stock Market Today, April 9: Intel Rises After Expanding Google Cloud AI Partnership for Data Center Push",,"If you click 'Accept all', we and our partners, including 251 who are part of the IAB Transparency &amp; Consent Framework, will also store and / or access information on a device (in other words, us… [+1046 chars]","Stock Market Today, April 9: Intel Rises After Expanding Google Cloud AI Partnership for Data Center Push If you click 'Accept all', we and our partners, including 251 who are part of the IAB Transparency Consent Framework, will also store and / or access information on a device (in other words, us… [+1046 chars]",https://consent.yahoo.com/v2/collectConsent?sessionId=1_cc-session_4234fc62-8d18-4125-80bf-71e1ffd29f0f,2026-04-09T22:16:54+00:00,Yahoo Entertainment,,
Cramer explains the divergence in tech stocks – and why software may continue to lag,Jim Cramer marveled at the divergent fates of technology stocks — from hardware winners like Intel to software losers like Salesforce and Adobe.,"CNBC's Jim Cramer on Thursday marveled at the divergent fates of technology stocks the hardware winners and software losers and suggested it may remain this way for a while longer.
This divide had b… [+2058 chars]",Cramer explains the divergence in tech stocks – and why software may continue to lag Jim Cramer marveled at the divergent fates of technology stocks — from hardware winners like Intel to software losers like Salesforce and Adobe. CNBC's Jim Cramer on Thursday marveled at the divergent fates of technology stocks the hardware winners and software losers and suggested it may remain this way for a while longer. This divide had b… [+2058 chars],https://www.cnbc.com/2026/04/09/jim-cramer-tech-stocks-diverge.html,2026-04-09T22:13:47+00:00,CNBC,Morgan Chittum,https://image.cnbcfm.com/api/v1/image/108288638-17756569222026-04-08t135836z_57320729_rc21lkazl7y0_rtrmadp_0_usa-stocks.jpeg?v=1775656957&w=1920&h=1080
All The Mistakes in Big Mistakes,Nicky (Dan Levy) and Morgan (Taylor Ortega) made so many miscalculations in Netflix’s latest crime comedy (co-created by Levy and Rachel Sennott) that we had to track and categorize all of them.,"In Dan Levy and Rachel Sennotts new comedy thriller Big Mistakes, pastor Nicky Dardano (Levy) and his elementary school teacher sister, Morgan (Taylor Ortega), take a necklace that does not belong to… [+13201 chars]","All The Mistakes in Big Mistakes Nicky (Dan Levy) and Morgan (Taylor Ortega) made so many miscalculations in Netflix’s latest crime comedy (co-created by Levy and Rachel Sennott) that we had to track and categorize all of them. In Dan Levy and Rachel Sennotts new comedy thriller Big Mistakes, pastor Nicky Dardano (Levy) and his elementary school teacher sister, Morgan (Taylor Ortega), take a necklace that does not belong to… [+13201 chars]",http://www.vulture.com/article/big-mistakes-recap-netflix-series-timeline-and-ending.html,2026-04-09T22:00:31+00:00,Vulture,Maggie Fremont,https://pyxis.nymag.com/v1/imgs/307/c6a/11458d461fb3b56ff570aebd03d5a7d755-bigmistakes.1x.rsocial.w1200.jpg
US Treasury expands cybersecurity threat intel to crypto industry,The US Department of the Treasury announced that it will share its cybersecurity threat intelligence reports and advice with players in the crypto industry.,The US Department of the Treasurys Office of Cybersecurity and Critical Infrastructure Protection (OCCIP) announced on Thursday that it is expanding its cybersecurity threat identification program to… [+2415 chars],US Treasury expands cybersecurity threat intel to crypto industry The US Department of the Treasury announced that it will share its cybersecurity threat intelligence reports and advice with players in the crypto industry. The US Department of the Treasurys Office of Cybersecurity and Critical Infrastructure Protection (OCCIP) announced on Thursday that it is expanding its cybersecurity threat identification program to… [+2415 chars],https://cointelegraph.com/news/us-treasury-cybersecurity-intel-crypto,2026-04-09T21:19:29+00:00,Cointelegraph,Cointelegraph by Vince Quill,"https://images.cointelegraph.com/cdn-cgi/image/f=auto,onerror=redirect,w=1200/https://s3.cointelegraph.com/uploads/2026-04/019d4ae1-3733-7188-97ba-064f33283491.jpg"
"Fueled by Musk's TeraFab tie-in, Intel's market cap hits highest level in 25 years — tops $300 billion on CPU, AI, and foundry momentum","Intel tops $300 billion, its highest market capitalization in 25 years on AI, CPU, and foundry announcements momentum.",The Fine Print: The following comments are owned by whoever posted them. We are not responsible for them in any way.,"Fueled by Musk's TeraFab tie-in, Intel's market cap hits highest level in 25 years — tops $300 billion on CPU, AI, and foundry momentum Intel tops $300 billion, its highest market capitalization in 25 years on AI, CPU, and foundry announcements momentum. The Fine Print: The following comments are owned by whoever posted them. We are not responsible for them in any way.",https://slashdot.org/firehose.pl?op=view&amp;id=181499840,2026-04-09T19:33:10+00:00,Slashdot.org,thfeed,
"Fueled by Musk's TeraFab tie-in, Intel's market cap hits highest level in 25 years — tops $300 billion on CPU, AI, and foundry momentum","Intel tops $300 billion, its highest market capitalization in 25 years on AI, CPU, and foundry announcements momentum.","With production of Core Ultra 300 'Panther Lake' and Xeon 6+ 'Clearwater Forest' ramping at Intel's fab in Arizona, Intel is seemingly on the right track to recovery in the coming years. While it's n… [+2942 chars]","Fueled by Musk's TeraFab tie-in, Intel's market cap hits highest level in 25 years — tops $300 billion on CPU, AI, and foundry momentum Intel tops $300 billion, its highest market capitalization in 25 years on AI, CPU, and foundry announcements momentum. With production of Core Ultra 300 'Panther Lake' and Xeon 6+ 'Clearwater Forest' ramping at Intel's fab in Arizona, Intel is seemingly on the right track to recovery in the coming years. While it's n… [+2942 chars]",https://www.tomshardware.com/pc-components/cpus/fueled-by-musks-terafab-tie-in-intels-market-cap-hits-highest-level-in-25-years-tops-usd300-billion-on-cpu-ai-and-foundry-momentum,2026-04-09T19:21:06+00:00,Tom's Hardware UK,"ashilov@gmail.com (Anton Shilov) , Anton Shilov",https://cdn.mos.cms.futurecdn.net/ADBoEQA3CwEZ7y6EuN4hKX-2560-80.jpg
"Google wants more Intel inside ... its datacenters, taps Chipzilla for more SmartNICs","Custom ASIC biz now running at a $1B annual pace for Intel
Google will continue to work with Intel, buying SmartNICs for its public cloud rather than blazing its own trail as AWS has done with its Nitro NICs.…","Google will continue to work with Intel, buying SmartNICs for its public cloud rather than blazing its own trail as AWS has done with its Nitro NICs.
Like most hyperscalers today, Google employs Sma… [+2666 chars]","Google wants more Intel inside ... its datacenters, taps Chipzilla for more SmartNICs Custom ASIC biz now running at a $1B annual pace for Intel Google will continue to work with Intel, buying SmartNICs for its public cloud rather than blazing its own trail as AWS has done with its Nitro NICs.… Google will continue to work with Intel, buying SmartNICs for its public cloud rather than blazing its own trail as AWS has done with its Nitro NICs. Like most hyperscalers today, Google employs Sma… [+2666 chars]",https://www.theregister.com/2026/04/09/google_intel_ipu/,2026-04-09T19:03:41+00:00,Theregister.com,Tobias Mann,https://regmedia.co.uk/2023/01/20/shutterstock_intel.jpg
Google Cloud deepens AI infrastructure partnership with Intel across Xeon and custom chips,In short: Google Cloud and Intel have announced a deepened multi-year AI infrastructure partnership covering both CPU deployment and custom chip co-development. Google Cloud will continue adopting Intel’s Xeon 6 processors across its global infrastructure for…,In short: Google Cloud and Intel have announced a deepened multi-year AI infrastructure partnership covering both CPU deployment and custom chip co-development. Google Cloud will continue adopting In… [+8074 chars],Google Cloud deepens AI infrastructure partnership with Intel across Xeon and custom chips In short: Google Cloud and Intel have announced a deepened multi-year AI infrastructure partnership covering both CPU deployment and custom chip co-development. Google Cloud will continue adopting Intel’s Xeon 6 processors across its global infrastructure for… In short: Google Cloud and Intel have announced a deepened multi-year AI infrastructure partnership covering both CPU deployment and custom chip co-development. Google Cloud will continue adopting In… [+8074 chars],https://thenextweb.com/news/revolut-uk-bank-licence-mobilisation-five-years/,2026-04-09T19:02:38+00:00,The Next Web,Ana Maria Constantin,https://cdn0.tnwcdn.com/wp-content/blogs.dir/1/files/2026/04/google-intel-ai-infrastructure-partnership.png
Intel Stock Hits 5-Year High on Musk Deal - Is It Too Late to Buy?,,"If you click 'Accept all', we and our partners, including 251 who are part of the IAB Transparency &amp; Consent Framework, will also store and / or access information on a device (in other words, us… [+1046 chars]","Intel Stock Hits 5-Year High on Musk Deal - Is It Too Late to Buy? If you click 'Accept all', we and our partners, including 251 who are part of the IAB Transparency Consent Framework, will also store and / or access information on a device (in other words, us… [+1046 chars]",https://consent.yahoo.com/v2/collectConsent?sessionId=1_cc-session_7236e12c-beac-4e95-9a9a-14b778922c8f,2026-04-09T19:00:00+00:00,Yahoo Entertainment,,
"Amazon’s chip business could be worth $50 billion, Jassy says, and he hints it may sell them externally","In short: Andy Jassy’s annual letter to shareholders, published on 9 April 2026, reveals that Amazon’s custom chip business, covering Graviton, Trainium, and Nitro, generates more than $20 billion in annualised revenue growing at triple-digit rates year-on-ye…","In short: Andy Jassys annual letter to shareholders, published on 9 April 2026, reveals that Amazons custom chip business, covering Graviton, Trainium, and Nitro, generates more than $20 billion in a… [+7063 chars]","Amazon’s chip business could be worth $50 billion, Jassy says, and he hints it may sell them externally In short: Andy Jassy’s annual letter to shareholders, published on 9 April 2026, reveals that Amazon’s custom chip business, covering Graviton, Trainium, and Nitro, generates more than $20 billion in annualised revenue growing at triple-digit rates year-on-ye… In short: Andy Jassys annual letter to shareholders, published on 9 April 2026, reveals that Amazons custom chip business, covering Graviton, Trainium, and Nitro, generates more than $20 billion in a… [+7063 chars]",https://thenextweb.com/news/amazon-custom-chips-jassy-letter-fifty-billion-trainium/,2026-04-09T18:30:46+00:00,The Next Web,Alina Maria Stan,https://cdn0.tnwcdn.com/wp-content/blogs.dir/1/files/2026/04/amazon-custom-chips-jassy-letter-fifty-billion-trainium.png
"Intel Stock Surges Past $60 as Analyst Upgrade, Terafab Partnership and Foundry Momentum Fuel Turnaround Hopes","SANTA CLARA, Calif. — Intel Corp. shares climbed more than 2.5% Thursday, breaking above $60 for the first time in years, as renewed optimism around the chipmaker's foundry business, a high-profile partnership with Elon Musk's Terafab project and a fresh anal…","SANTA CLARA, Calif. — Intel Corp. shares climbed more than 2.5% Thursday, breaking above $60 for the first time in years, as renewed optimism around the chipmaker's foundry business, a high-profile p… [+6787 chars]","Intel Stock Surges Past $60 as Analyst Upgrade, Terafab Partnership and Foundry Momentum Fuel Turnaround Hopes SANTA CLARA, Calif. — Intel Corp. shares climbed more than 2.5% Thursday, breaking above $60 for the first time in years, as renewed optimism around the chipmaker's foundry business, a high-profile partnership with Elon Musk's Terafab project and a fresh anal… SANTA CLARA, Calif. — Intel Corp. shares climbed more than 2.5% Thursday, breaking above $60 for the first time in years, as renewed optimism around the chipmaker's foundry business, a high-profile p… [+6787 chars]",https://www.ibtimes.com.au/intel-stock-surges-past-60-analyst-upgrade-terafab-partnership-foundry-momentum-fuel-turnaround-1865939,2026-04-09T18:30:43+00:00,Ibtimes.com.au,Mike Clair,https://d.ibtimes.com.au/en/full/1879924/executives-silicon-valley-chip-maker-intel-say-fluid-us-trade-policies-regulatory-moves-have.jpg
Intel Pivots from ‘Dead Money’ to ‘Hot Stock’: Should You Too Buy INTC Stock Here?,,"If you click 'Accept all', we and our partners, including 251 who are part of the IAB Transparency &amp; Consent Framework, will also store and / or access information on a device (in other words, us… [+1046 chars]","Intel Pivots from ‘Dead Money’ to ‘Hot Stock’: Should You Too Buy INTC Stock Here? If you click 'Accept all', we and our partners, including 251 who are part of the IAB Transparency Consent Framework, will also store and / or access information on a device (in other words, us… [+1046 chars]",https://consent.yahoo.com/v2/collectConsent?sessionId=1_cc-session_f295a702-8f91-4ca7-ab8b-0f579c67b3db,2026-04-09T18:08:17+00:00,Yahoo Entertainment,,
