title,description,content,text_for_analysis,url,published_at,source,author,image_url
Intel Stock Just Hit a New 52-Week High. Should You Chase the Rally Here?,,"If you click 'Accept all', we and our partners, including 251 who are part of the IAB Transparency &amp; Consent Framework, will also store and / or access information on a device (in other words, us… [+1046 chars]","Intel Stock Just Hit a New 52-Week High. Should You Chase the Rally Here? If you click 'Accept all', we and our partners, including 251 who are part of the IAB Transparency Consent Framework, will also store and / or access information on a device (in other words, us… [+1046 chars]",https://consent.yahoo.com/v2/collectConsent?sessionId=1_cc-session_0c8c1336-3abd-44be-81c9-b9304ca34e3e,2026-04-09T18:06:59+00:00,Yahoo Entertainment,,
Alphabet Stock Climbs Modestly as Google Expands AI Chip Partnership With Intel Amid Ceasefire Relief Rally,"Alphabet Inc. Class C shares rose modestly midday Thursday, trading near $316 as investors digested the latest developments in the company's aggressive artificial intelligence push, including an expanded partnership with Intel on AI infrastructure, while broa…","Alphabet Inc. Class C shares rose modestly midday Thursday, trading near $316 as investors digested the latest developments in the company's aggressive artificial intelligence push, including an expa… [+6737 chars]","Alphabet Stock Climbs Modestly as Google Expands AI Chip Partnership With Intel Amid Ceasefire Relief Rally Alphabet Inc. Class C shares rose modestly midday Thursday, trading near $316 as investors digested the latest developments in the company's aggressive artificial intelligence push, including an expanded partnership with Intel on AI infrastructure, while broa… Alphabet Inc. Class C shares rose modestly midday Thursday, trading near $316 as investors digested the latest developments in the company's aggressive artificial intelligence push, including an expa… [+6737 chars]",https://www.ibtimes.com.au/alphabet-stock-climbs-modestly-google-expands-ai-chip-partnership-intel-amid-ceasefire-relief-1865909,2026-04-09T16:44:48+00:00,Ibtimes.com.au,Tony Jackson,https://d.ibtimes.com.au/en/full/1879196/having-won-court-ruling-that-google-had-monopoly-online-ad-technology-us-attorneys-could.jpg
"Fung Program Public Talk: Jennifer Miller, Dartmouth University","In the early 1980s, rising Japanese imports raised alarms across the United States. U.S. business, political, and labor leaders described the United States and Japan as locked in a high-stakes competition for manufacturing prowess, for market share, even for …","Diversity and Non-discrimination 
Equal Opportunity and Non-discrimination at Princeton University: Princeton University believes that commitment to equal opportunity for all is favorable to the fre… [+1240 chars]","Fung Program Public Talk: Jennifer Miller, Dartmouth University In the early 1980s, rising Japanese imports raised alarms across the United States. U.S. business, political, and labor leaders described the United States and Japan as locked in a high-stakes competition for manufacturing prowess, for market share, even for … Diversity and Non-discrimination Equal Opportunity and Non-discrimination at Princeton University: Princeton University believes that commitment to equal opportunity for all is favorable to the fre… [+1240 chars]",https://www.princeton.edu/events/2026/fung-program-public-talk-jennifer-miller-dartmouth-university,2026-04-09T16:07:54+00:00,Princeton University,Princeton University,
David Pogue’s Apple Book,"“Apple: The First 50 Years” 1. To tell you the truth, I finished this book almost a week ago, and I forgot most of what I wanted to say about it. Primarily the business insights. Not that I don’t remember the facts. Not that I haven’t internalized the message…","“Apple: The First 50 Years”
1. To tell you the truth, I finished this book almost a week ago, and I forgot most of what I wanted to say about it. Primarily the business insights.
Not that I don’t r… [+11940 chars]","David Pogue’s Apple Book “Apple: The First 50 Years” 1. To tell you the truth, I finished this book almost a week ago, and I forgot most of what I wanted to say about it. Primarily the business insights. Not that I don’t remember the facts. Not that I haven’t internalized the message… “Apple: The First 50 Years” 1. To tell you the truth, I finished this book almost a week ago, and I forgot most of what I wanted to say about it. Primarily the business insights. Not that I don’t r… [+11940 chars]",https://ritholtz.com/2026/04/david-pogues-apple-book/,2026-04-09T16:00:38+00:00,Ritholtz.com,Bob Lefsetz,https://ritholtz.com/wp-content/uploads/2026/04/Apple-50.png
"Amazon CEO takes aim at Nvidia, Intel, Starlink, more in annual shareholder letter - TechCrunch","Amazon CEO takes aim at Nvidia, Intel, Starlink, more in annual shareholder letterTechCrunch CEO Andy Jassy’s 2025 Letter to ShareholdersAbout Amazon Amazon CEO Jassy says company could sell AI chips, raising stakes for Nvidia, AMDYahoo Finance Amazon CEO Pre…","It was pity stayed his hand.
""Pity I don't have any more bullets,"" thought Frito.
-- _Bored_of_the_Rings_, a Harvard Lampoon parody of Tolkein","Amazon CEO takes aim at Nvidia, Intel, Starlink, more in annual shareholder letter - TechCrunch Amazon CEO takes aim at Nvidia, Intel, Starlink, more in annual shareholder letterTechCrunch CEO Andy Jassy’s 2025 Letter to ShareholdersAbout Amazon Amazon CEO Jassy says company could sell AI chips, raising stakes for Nvidia, AMDYahoo Finance Amazon CEO Pre… It was pity stayed his hand. ""Pity I don't have any more bullets,"" thought Frito. -- _Bored_of_the_Rings_, a Harvard Lampoon parody of Tolkein",https://slashdot.org/firehose.pl?op=view&amp;id=181494430,2026-04-09T15:52:27+00:00,Slashdot.org,feedfeeder,
More defensive versatility? Best safety fits for Patriots in NFL Draft,Can the Patriots find the next Craig Woodson in this year's NFL Draft? Phil Perry highlights the best safety fits for New England in the 2026 class.,"More defensive versatility? Best safety fits for Patriots in NFL Draft originally appeared on NBC Sports Boston
Editors Note: In the lead-up to the 2026 NFL Draft, Phil Perry is identifying the best… [+8140 chars]","More defensive versatility? Best safety fits for Patriots in NFL Draft Can the Patriots find the next Craig Woodson in this year's NFL Draft? Phil Perry highlights the best safety fits for New England in the 2026 class. More defensive versatility? Best safety fits for Patriots in NFL Draft originally appeared on NBC Sports Boston Editors Note: In the lead-up to the 2026 NFL Draft, Phil Perry is identifying the best… [+8140 chars]",https://www.nbcsportsboston.com/nfl/new-england-patriots/best-safety-fits-2026-nfl-draft/780919/?partner=yahoo,2026-04-09T15:48:00+00:00,Nbcsportsboston.com,Phil Perry,https://s.yimg.com/os/en/csnne.com/01f502e002b008775d0dcd21158e5387
"TSMC’s Chipmaking Edge Is So Strong That Competitors Are Fighting to Work with Its Supply Chain Partners, Viewing Them as a Winning Bet","TSMC's dominance over the semiconductor industry also stems from how disciplined its supply chain partners have become, and rivals are now looking to capitalize on this edge. TSMC's Supply Network Has Created a Moat For Them In The Chip Industry, After Passin…","TSMC's dominance over the semiconductor industry also stems from how disciplined its supply chain partners have become, and rivals are now looking to capitalize on this edge. 
The Taiwan chip giant … [+2848 chars]","TSMC’s Chipmaking Edge Is So Strong That Competitors Are Fighting to Work with Its Supply Chain Partners, Viewing Them as a Winning Bet TSMC's dominance over the semiconductor industry also stems from how disciplined its supply chain partners have become, and rivals are now looking to capitalize on this edge. TSMC's Supply Network Has Created a Moat For Them In The Chip Industry, After Passin… TSMC's dominance over the semiconductor industry also stems from how disciplined its supply chain partners have become, and rivals are now looking to capitalize on this edge. The Taiwan chip giant … [+2848 chars]",https://wccftech.com/tsmc-edge-is-so-strong-that-competitors-are-racing-to-work-with-its-supply-chain-partners/,2026-04-09T15:46:04+00:00,Wccftech,Muhammad Zuhair,https://cdn.wccftech.com/wp-content/uploads/2025/11/TSMC-1.jpg
Are Intel Investors Tired of Winning Yet? Chipmaker Bags Another Big Score,"AI workloads have stretched data-center capacity to the limit. Hyperscalers now spend hundreds of billions annually to keep pace, yet GPUs handle only part...","<ul><li>Intel (INTC) locked in a multiyear collaboration with Google committing the search giant to multiple generations of Xeon processors for AI training, inference, and general-purpose computing, … [+5597 chars]","Are Intel Investors Tired of Winning Yet? Chipmaker Bags Another Big Score AI workloads have stretched data-center capacity to the limit. Hyperscalers now spend hundreds of billions annually to keep pace, yet GPUs handle only part... Intel (INTC) locked in a multiyear collaboration with Google committing the search giant to multiple generations of Xeon processors for AI training, inference, and general-purpose computing, … [+5597 chars]",https://247wallst.com/investing/2026/04/09/are-intel-investors-tired-of-winning-yet-chipmaker-bags-another-big-score/,2026-04-09T15:45:10+00:00,24/7 Wall St.,Rich Duprey,https://s.yimg.com/ny/api/res/1.2/Np7O6Fp4EcfGlUCXCM6l_w--/YXBwaWQ9aGlnaGxhbmRlcjt3PTEyMDA7aD04MDA-/https://media.zenfs.com/en/24_7_wall_st__718/c2603d70f36cc09b0f63040f6a7ab924
Show HN: PropOps – AI agent that reads Indian govt property data nobody checks,"AI-powered property transparency tool built on Claude Code. Scrapes government registries (IGRS, RERA, eCourts), scores properties, flags risks, and alerts buyers. - himanshudongre/propops","Every property transaction in India is public record. Builders just hope you don't check.
AI-powered property transparency tool built on Claude Code. Scrapes government registries (IGRS, RERA, eCour… [+9292 chars]","Show HN: PropOps – AI agent that reads Indian govt property data nobody checks AI-powered property transparency tool built on Claude Code. Scrapes government registries (IGRS, RERA, eCourts), scores properties, flags risks, and alerts buyers. - himanshudongre/propops Every property transaction in India is public record. Builders just hope you don't check. AI-powered property transparency tool built on Claude Code. Scrapes government registries (IGRS, RERA, eCour… [+9292 chars]",https://github.com/himanshudongre/propops,2026-04-09T15:29:02+00:00,Github.com,himanshudongre,https://opengraph.githubassets.com/4ab5102eabbde771f280213af843f297ae688b822019ebaa950072ae08d20782/himanshudongre/propops
Laptops Are About to Get Very Exciting Again… Thanks to Nvidia,"Nvidia is about to throw another wrench into laptops led by Intel, AMD, and Qualcomm.",Nvidia is gearing up to throw the entire laptop scene out of wack. Eagle-eyed leakers spotted a listing for a supposed Nvidia N1 chip housed on an engineering motherboard listed on the Chinese-langua… [+3027 chars],"Laptops Are About to Get Very Exciting Again… Thanks to Nvidia Nvidia is about to throw another wrench into laptops led by Intel, AMD, and Qualcomm. Nvidia is gearing up to throw the entire laptop scene out of wack. Eagle-eyed leakers spotted a listing for a supposed Nvidia N1 chip housed on an engineering motherboard listed on the Chinese-langua… [+3027 chars]",https://gizmodo.com/laptops-are-about-to-get-very-exciting-again-thanks-to-nvidia-2000744490,2026-04-09T15:15:00+00:00,Gizmodo.com,Kyle Barr,https://gizmodo.com/app/uploads/2026/02/Nvidia-CEO-Jensen-Huang-RTX-50-Series-GPU-1-1200x675.jpg
"Intel's EMIB-T packaging technology set for fab rollout this year — as TSMC CoWoS capacity remains limited,EMIB-T is preparing for advanced AI accelerator designs","If these “billions per year” in deals close, it’d mark quite the turnaround for Intel Foundry, which generated just $307 million in external revenue last year.","Intel CFO Dave Zinsner told the Morgan Stanley TMT conference last month that Intel Foundry is ""close to closing some deals that are in the billions per year in terms of revenue"" on advanced packagin… [+8447 chars]","Intel's EMIB-T packaging technology set for fab rollout this year — as TSMC CoWoS capacity remains limited,EMIB-T is preparing for advanced AI accelerator designs If these “billions per year” in deals close, it’d mark quite the turnaround for Intel Foundry, which generated just $307 million in external revenue last year. Intel CFO Dave Zinsner told the Morgan Stanley TMT conference last month that Intel Foundry is ""close to closing some deals that are in the billions per year in terms of revenue"" on advanced packagin… [+8447 chars]",https://www.tomshardware.com/tech-industry/semiconductors/intels-emib-t-heads-for-fab-rollout-this-year,2026-04-09T15:09:42+00:00,Tom's Hardware UK,Luke James,https://cdn.mos.cms.futurecdn.net/qXjw6K9cVJzeNZurs6CD3H-1920-80.jpg
"Amazon’s Jassy defends $200 billion investment, targets rivals in shareholder letter","In his annual letter to shareholders, Amazon CEO Andy Jassy criticized competitors like Nvidia, Intel, and Starlink while justifying the company's significant $200 billion capital expenditure. The letter outlines Amazon's strategic vision and commitment to in…","In his annual letter to shareholders, Amazon CEO Andy Jassy criticized competitors like Nvidia, Intel, and Starlink while justifying the company's significant $200 billion capital expenditure. The le… [+237 chars]","Amazon’s Jassy defends $200 billion investment, targets rivals in shareholder letter In his annual letter to shareholders, Amazon CEO Andy Jassy criticized competitors like Nvidia, Intel, and Starlink while justifying the company's significant $200 billion capital expenditure. The letter outlines Amazon's strategic vision and commitment to in… In his annual letter to shareholders, Amazon CEO Andy Jassy criticized competitors like Nvidia, Intel, and Starlink while justifying the company's significant $200 billion capital expenditure. The le… [+237 chars]",https://nextbigwhat.com/amazons-jassy-defends-200-billion-investment-targets-rivals-in-shareholder-letter/,2026-04-09T15:07:05+00:00,Nextbigwhat.com,Editorial Team,https://s0.wp.com/_si/?t=eyJpbWciOiJodHRwczpcL1wvaTAud3AuY29tXC9uZXh0Ymlnd2hhdC5jb21cL3dwLWNvbnRlbnRcL3VwbG9hZHNcLzIwMjRcLzAyXC82OTc0Yy1uZXh0Ymlnd2hhdC1sb2dvLnBuZz9maXQ9MTA2OCUyQzMwMSZzc2w9MSIsInR4dCI6Ik5leHRCaWdXaGF0IiwidGVtcGxhdGUiOiJlZGdlIiwiZm9udCI6IiIsImJsb2dfaWQiOjIxMzc5NDAxM30.vQKvxzKickmO33DelB2jg4vHNf7Tipk9MGSbojqVuT4MQ
"Israeli attacks on Lebanon aimed to undermine ceasefire, critics say",More than 250 people have been killed in a barrage of air strikes on Lebanon since the ceasefire was declared.,"Just hours after the United States and Iran announced a ceasefire in the war that has dominated news headlines around the world and pushed oil prices to new heights, Israel bombarded Lebanon on Wedne… [+5837 chars]","Israeli attacks on Lebanon aimed to undermine ceasefire, critics say More than 250 people have been killed in a barrage of air strikes on Lebanon since the ceasefire was declared. Just hours after the United States and Iran announced a ceasefire in the war that has dominated news headlines around the world and pushed oil prices to new heights, Israel bombarded Lebanon on Wedne… [+5837 chars]",https://www.aljazeera.com/news/2026/4/9/israeli-attacks-on-lebanon-aimed-to-undermine-ceasefire-critics-say,2026-04-09T14:52:54+00:00,Al Jazeera English,Simon Speakman Cordall,https://www.aljazeera.com/wp-content/uploads/2026/04/AA-20260408-41053084-41053073-ISRAELI_FORCES_LAUNCH_NEW_AIRSTRIKES_ON_BEIRUT-1775694214.jpg?resize=1200%2C630
Notre Dame's 2027 quarterback board could shift drastically after a flurry of recruiting updates and unfortunate news,Notre Dame will need to add more quarterback options to the board for the 2027 recruiting class after an unfortunate sequence of news. The post Notre Dame's 2027 quarterback board could shift drastically after a flurry of recruiting updates and unfortunate ne…,"Notre Dame will need to add more quarterback options to the board for the 2027 recruiting class after an unfortunate sequence of news.
The vibes around Notre Dame football recruiting have mostly bee… [+3849 chars]",Notre Dame's 2027 quarterback board could shift drastically after a flurry of recruiting updates and unfortunate news Notre Dame will need to add more quarterback options to the board for the 2027 recruiting class after an unfortunate sequence of news. The post Notre Dame's 2027 quarterback board could shift drastically after a flurry of recruiting updates and unfortunate ne… Notre Dame will need to add more quarterback options to the board for the 2027 recruiting class after an unfortunate sequence of news. The vibes around Notre Dame football recruiting have mostly bee… [+3849 chars],https://atozsports.com/college-football/notre-dame-fighting-irish-news/notre-dame-football-recruting-2027-quarterback-board-kamden-lopati-champ-monds-jake-nawrot-davin-davidson/,2026-04-09T14:36:39+00:00,Atozsports.com,Ryan Roberts,https://s.yimg.com/ny/api/res/1.2/57u4ln.mEfKg5zqSJV.UoQ--/YXBwaWQ9aGlnaGxhbmRlcjt3PTEyMDA7aD04NzE7Y2Y9d2VicA--/https://media.zenfs.com/en/atoz_sports_articles_485/8c31c2ba02cda45dd6334b05ae4b57c5
"Amazon CEO takes aim at Nvidia, Intel, Starlink, more in annual shareholder letter | TechCrunch",Andy Jassy's annual shareholder letter reads something like a diss track to a wide range of competitors as he defends spending $200 billion in capex.,"Amazon CEO Andy Jassy’s annual shareholder letter reads something like a Kendrick Lamar diss track, if the rapper was a corporate-speak talking CEO and not a poetic Pulitzer-prize winning musician.
… [+3559 chars]","Amazon CEO takes aim at Nvidia, Intel, Starlink, more in annual shareholder letter | TechCrunch Andy Jassy's annual shareholder letter reads something like a diss track to a wide range of competitors as he defends spending $200 billion in capex. Amazon CEO Andy Jassy’s annual shareholder letter reads something like a Kendrick Lamar diss track, if the rapper was a corporate-speak talking CEO and not a poetic Pulitzer-prize winning musician. … [+3559 chars]",https://techcrunch.com/2026/04/09/amazon-ceo-takes-aim-at-nvidia-intel-starlink-more-in-annual-shareholder-letter/,2026-04-09T14:30:02+00:00,TechCrunch,Julie Bort,"https://techcrunch.com/wp-content/uploads/2025/04/GettyImages-2201505679.jpg?resize=1200,800"
US Stocks: Intel and Google to double down on AI CPUs with expanded partnership,"Intel and Google have expanded their partnership to advance ​the use of artificial intelligence-focused ​central processing units and to develop custom infrastructure ​processors, as shifting use of AI drives renewed demand for traditional computing chips.","Intel and Google have expanded their partnership to advance the use of artificial intelligence-focused central processing units and to develop custom infrastructure processors, as shifting use of AI … [+1654 chars]","US Stocks: Intel and Google to double down on AI CPUs with expanded partnership Intel and Google have expanded their partnership to advance ​the use of artificial intelligence-focused ​central processing units and to develop custom infrastructure ​processors, as shifting use of AI drives renewed demand for traditional computing chips. Intel and Google have expanded their partnership to advance the use of artificial intelligence-focused central processing units and to develop custom infrastructure processors, as shifting use of AI … [+1654 chars]",https://economictimes.indiatimes.com/markets/us-stocks/news/us-stocks-intel-and-google-to-double-down-on-ai-cpus-with-expanded-partnership/articleshow/130145076.cms,2026-04-09T14:06:40+00:00,The Times of India,Reuters,"https://img.etimg.com/thumb/msid-130145076,width-1200,height-630,imgsize-16806,overlay-etmarkets/articleshow.jpg"
College basketball transfer portal: Top 10 players available,"The NCAA transfer portal officially opened at midnight on April 7 with thousands of college basketball players prepared to evaluate their future. In the new offseason format, all players must submit an entry by April 21 to change programs. The goal for these …","The NCAA transfer portal officially opened at midnight on April 7 with thousands of college basketball players prepared to evaluate their future. In the new offseason format, all players must submit … [+6873 chars]","College basketball transfer portal: Top 10 players available The NCAA transfer portal officially opened at midnight on April 7 with thousands of college basketball players prepared to evaluate their future. In the new offseason format, all players must submit an entry by April 21 to change programs. The goal for these … The NCAA transfer portal officially opened at midnight on April 7 with thousands of college basketball players prepared to evaluate their future. In the new offseason format, all players must submit … [+6873 chars]",https://www.on3.com/transfer-portal/news/college-basketball-transfer-portal-top-10-players-available/,2026-04-09T14:02:29+00:00,On3.com,James Fletcher III,https://s.yimg.com/os/en/on3_transfer_portal_articles_263/92c9fbbfdf1df4f4d28035afda86ce50
Chargers Daily Links: Thursday Open Thread,Your source for all Chargers and NFL news from around the web.,"Good morning, Chargers fans!
You know what to do!
And now for todays links.
Heres why ESPNs Jordan Reid believes the Chargers could draft a cornerback this year (Chargers.com)
Vega Ioane may have… [+740 chars]","Chargers Daily Links: Thursday Open Thread Your source for all Chargers and NFL news from around the web. Good morning, Chargers fans! You know what to do! And now for todays links. Heres why ESPNs Jordan Reid believes the Chargers could draft a cornerback this year (Chargers.com) Vega Ioane may have… [+740 chars]",https://www.boltsfromtheblue.com/los-angeles-chargers-news/63616/chargers-daily-links-thursday-open-thread,2026-04-09T13:50:00+00:00,Bolts From The Blue,Michael Peterson,https://s.yimg.com/ny/api/res/1.2/CqDfA1TQzaY1s3ATRl8ChA--/YXBwaWQ9aGlnaGxhbmRlcjt3PTEyMDA7aD04MDA7Y2Y9d2VicA--/https://media.zenfs.com/en/sb_nation_articles_115/3dfcc6b3e07882202a47e2c96e06c8d5
Intel and Google expand collaboration to integrate CPUs and IPUs at scale,"This collaboration could accelerate AI advancements, enhance cloud infrastructure efficiency, and drive innovation across industries.
The post Intel and Google expand collaboration to integrate CPUs and IPUs at scale appeared first on Crypto Briefing.",Google Cloud will keep using Intel Xeon processors for diverse workloads while the companies expand development of custom IPUs to boost efficiency and utilization. Intel and Google are deepening thei… [+1157 chars],"Intel and Google expand collaboration to integrate CPUs and IPUs at scale This collaboration could accelerate AI advancements, enhance cloud infrastructure efficiency, and drive innovation across industries. The post Intel and Google expand collaboration to integrate CPUs and IPUs at scale appeared first on Crypto Briefing. Google Cloud will keep using Intel Xeon processors for diverse workloads while the companies expand development of custom IPUs to boost efficiency and utilization. Intel and Google are deepening thei… [+1157 chars]",https://cryptobriefing.com/intel-google-ai-partnership-cloud-infrastructure/,2026-04-09T13:43:15+00:00,Crypto Briefing,Vivian Nguyen,https://static.cryptobriefing.com/wp-content/uploads/2026/04/09092827/65098d55-391a-48f0-9192-3f70525d246b-800x420.jpg
Falling trust in America is a Pandora’s box for the global economy,"The TACO trade, a bet on Trump backing down from market-rattling actions, seems outdated as his Iran war and global policy shifts create unpredictability. Despite this, capital still flows to the US, drawn by its markets and the AI revolution, even as allies …","Investors embraced in 2025 the so-called TACO tradethat is, a bet that Trump Always Chickens Out on any move that would rattle markets for too long. That idea seems blithe now.President Donald Trumps… [+10410 chars]","Falling trust in America is a Pandora’s box for the global economy The TACO trade, a bet on Trump backing down from market-rattling actions, seems outdated as his Iran war and global policy shifts create unpredictability. Despite this, capital still flows to the US, drawn by its markets and the AI revolution, even as allies … Investors embraced in 2025 the so-called TACO tradethat is, a bet that Trump Always Chickens Out on any move that would rattle markets for too long. That idea seems blithe now.President Donald Trumps… [+10410 chars]",https://economictimes.indiatimes.com/news/international/global-trends/falling-trust-in-america-is-a-pandoras-box-for-the-global-economy/articleshow/130144553.cms,2026-04-09T13:39:47+00:00,The Times of India,Bloomberg,"https://img.etimg.com/thumb/msid-130144688,width-1200,height-630,imgsize-71132,overlay-economictimes/articleshow.jpg"
