title,description,content,text_for_analysis,url,published_at,source,author,image_url
"Physical Intellectual Property Market Research Report 2026-2032: Comparing Leaders ARM, Synopsys, Imagination Technologies, CEVA, Cadence Design Systems","Explore integrated IP protection strategies, leverage regional dynamics, and adopt digital provenance to capitalize on tech convergence and bolster enforcement in evolving markets. Explore integrated IP protection strategies, leverage regional dynamics, and a…","Dublin, April 09, 2026 (GLOBE NEWSWIRE) -- The ""Physical Intellectual Property Market - Global Forecast 2026-2032"" report has been added to ResearchAndMarkets.com's offering.
The Physical Intellectu… [+6513 chars]","Physical Intellectual Property Market Research Report 2026-2032: Comparing Leaders ARM, Synopsys, Imagination Technologies, CEVA, Cadence Design Systems Explore integrated IP protection strategies, leverage regional dynamics, and adopt digital provenance to capitalize on tech convergence and bolster enforcement in evolving markets. Explore integrated IP protection strategies, leverage regional dynamics, and a… Dublin, April 09, 2026 (GLOBE NEWSWIRE) -- The ""Physical Intellectual Property Market - Global Forecast 2026-2032"" report has been added to ResearchAndMarkets.com's offering. The Physical Intellectu… [+6513 chars]",https://www.globenewswire.com/news-release/2026/04/09/3270708/28124/en/Physical-Intellectual-Property-Market-Research-Report-2026-2032-Comparing-Leaders-ARM-Synopsys-Imagination-Technologies-CEVA-Cadence-Design-Systems.html,2026-04-09T09:35:00+00:00,GlobeNewswire,Research and Markets,https://ml.globenewswire.com/Resource/Download/bc28196b-e800-40b9-8076-4b46484719f9
PC market enjoys growth in Q1,"In what could be one of the last good quarters before shortages make their full impact, Omdia tracks an improvement in global shipments","The prospects for the PC market are looking bleaker than expected, with analysts warning that memory and storage costs are going to be higher than forecasted.
As a result, the growth recorded in the… [+2898 chars]","PC market enjoys growth in Q1 In what could be one of the last good quarters before shortages make their full impact, Omdia tracks an improvement in global shipments The prospects for the PC market are looking bleaker than expected, with analysts warning that memory and storage costs are going to be higher than forecasted. As a result, the growth recorded in the… [+2898 chars]",https://www.computerweekly.com/microscope/news/366641579/PC-market-enjoys-growth-in-Q1,2026-04-09T08:20:00+00:00,ComputerWeekly.com,Simon Quicke,https://www.computerweekly.com/visuals/German/HERO-Gefahr-mimi-yellow-warning-triangle-Adobe-01.jpg
Artificial Intelligence in Pharmaceutical Market Research and Global Forecast Report 2026-2032,"AI in pharma offers opportunities in clinical trial optimization, drug discovery enhancement, personalized healthcare, and more efficient supply chain management, driving innovation and operational efficiency. AI in pharma offers opportunities in clinical tri…","Dublin, April 09, 2026 (GLOBE NEWSWIRE) -- The ""Artificial Intelligence in Pharmaceutical Market - Global Forecast 2026-2032"" report has been added to ResearchAndMarkets.com's offering.
The artifici… [+6665 chars]","Artificial Intelligence in Pharmaceutical Market Research and Global Forecast Report 2026-2032 AI in pharma offers opportunities in clinical trial optimization, drug discovery enhancement, personalized healthcare, and more efficient supply chain management, driving innovation and operational efficiency. AI in pharma offers opportunities in clinical tri… Dublin, April 09, 2026 (GLOBE NEWSWIRE) -- The ""Artificial Intelligence in Pharmaceutical Market - Global Forecast 2026-2032"" report has been added to ResearchAndMarkets.com's offering. The artifici… [+6665 chars]",https://www.globenewswire.com/news-release/2026/04/09/3270686/28124/en/Artificial-Intelligence-in-Pharmaceutical-Market-Research-and-Global-Forecast-Report-2026-2032.html,2026-04-09T08:03:00+00:00,GlobeNewswire,Research and Markets,https://ml.globenewswire.com/Resource/Download/7b53606d-4bb2-4497-8014-a1a370dddc67
Microcenter Bundle Price Mistakes: AMD Ryzen 9 9900X + MSI X870E-P PRO WIFI Mobo + 32GB Corsair DDR5-6000 Ram For $520; With R7 9850x3d $620; And More $519.99,Microcenter [microcenter.com] has various bundles on sale below their officially listed price when you use the custom pc builder or add the components to cart separately. This is a price mistake where,Microcenter[microcenter.com] has various bundles on sale below their officially listed price when you use the custom pc builder or add the components to cart separately. This is a price mistake where… [+2866 chars],Microcenter Bundle Price Mistakes: AMD Ryzen 9 9900X + MSI X870E-P PRO WIFI Mobo + 32GB Corsair DDR5-6000 Ram For $520; With R7 9850x3d $620; And More $519.99 Microcenter [microcenter.com] has various bundles on sale below their officially listed price when you use the custom pc builder or add the components to cart separately. This is a price mistake where Microcenter[microcenter.com] has various bundles on sale below their officially listed price when you use the custom pc builder or add the components to cart separately. This is a price mistake where… [+2866 chars],https://slickdeals.net/f/19399200-microcenter-bundle-price-mistakes-amd-ryzen-9-9900x-msi-x870e-p-pro-wifi-mobo-32gb-corsair-ddr5-6000-ram-for-520-with-r7-9850x3d-620-and-more-519-99,2026-04-09T06:21:35+00:00,Slickdeals.net,BeigeRoad455,https://slickdeals.net/attachment/2/9/2/8/0/8/2/0/450x450/20061297.thumb
firewallxpl added to PyPI,"Perimeter security exploitation framework — NGFW, UTM, WAF, VPN, NAC, LB, and OT/ICS firewalls","Fork focado em perímetro e caixa de estado: NGFW, UTM, WAF, firewalls de cloud (AWS/Azure/GCP/OCI, Cloudflare, ELB/WAF labels em catálogo), e SSL-VPN concentrators laboratório autorizado.O ramo Firew… [+6541 chars]","firewallxpl added to PyPI Perimeter security exploitation framework — NGFW, UTM, WAF, VPN, NAC, LB, and OT/ICS firewalls Fork focado em perímetro e caixa de estado: NGFW, UTM, WAF, firewalls de cloud (AWS/Azure/GCP/OCI, Cloudflare, ELB/WAF labels em catálogo), e SSL-VPN concentrators laboratório autorizado.O ramo Firew… [+6541 chars]",https://pypi.org/project/firewallxpl/,2026-04-08T22:40:51+00:00,Pypi.org,mrhenrike@users.noreply.github.com,https://pypi.org/static/images/twitter.abaf4b19.webp
Lenovo ThinkPad X13 spec bump brings Intel Panther Lake and AMD Ryzen AI PRO 400 options,"The Lenovo ThinkPad X13 Gen 7 is a thin and light laptop with a starting weight of just 936 grams, or less than 2.1 pounds. Lenovo did not introduce this year’s model during Mobile World Congress in March, instead focusing on the ThinkPad X13 Detachable. But …","The Lenovo ThinkPad X13 Gen 7 is a thin and light laptop with a starting weight of just 936 grams, or less than 2.1 pounds. Lenovo did not introduce this year’s model during Mobile World Congress in … [+2549 chars]","Lenovo ThinkPad X13 spec bump brings Intel Panther Lake and AMD Ryzen AI PRO 400 options The Lenovo ThinkPad X13 Gen 7 is a thin and light laptop with a starting weight of just 936 grams, or less than 2.1 pounds. Lenovo did not introduce this year’s model during Mobile World Congress in March, instead focusing on the ThinkPad X13 Detachable. But … The Lenovo ThinkPad X13 Gen 7 is a thin and light laptop with a starting weight of just 936 grams, or less than 2.1 pounds. Lenovo did not introduce this year’s model during Mobile World Congress in … [+2549 chars]",https://liliputing.com/lenovo-thinkpad-x13-spec-bump-brings-intel-panther-lake-and-amd-ryzen-ai-pro-400-options/,2026-04-08T21:30:22+00:00,Liliputing,Brad Linder,https://liliputing.com/wp-content/uploads/2026/04/thinkpad-x13_02.jpg
Computer Won't Run Windows 11? Google's ChromeOS Flex Is a Solid Alternative,Don't rush your old Windows 10 computer to the landfill just yet.,"Google is issuing you its periodic reminder that you aren't tethered to Microsoft's operating system if you own a PC. In fact, the search giant is making it easier than ever to switch over to ChromeO… [+8236 chars]","Computer Won't Run Windows 11? Google's ChromeOS Flex Is a Solid Alternative Don't rush your old Windows 10 computer to the landfill just yet. Google is issuing you its periodic reminder that you aren't tethered to Microsoft's operating system if you own a PC. In fact, the search giant is making it easier than ever to switch over to ChromeO… [+8236 chars]",https://www.cnet.com/tech/computing/computer-wont-run-windows-11-googles-chromeos-flex-is-a-solid-alternative/,2026-04-08T20:31:31+00:00,CNET,Joshua Goldman,https://www.cnet.com/a/img/resize/f5647a2d4babfecd3883e7973c6b06ecb53aa7ba/hub/2022/08/25/e21ce503-743e-48b4-8466-97e897c720c6/chromeos-flex-install-05.jpg?auto=webp&fit=crop&height=675&width=1200
NASCAR Docuseries ‘Full Speed’ Leaving Netflix in May 2026 Following Move to Prime Video,Last chance to catch the first two seasons before they become an Prime Video exclusive.,"Picture Credit: NASCAR Studios, Words + Pictures
Sports documentaries have been a major staple for Netflix, but one of its high-octane additions is officially hitting the brakes on the service. Both… [+2844 chars]","NASCAR Docuseries ‘Full Speed’ Leaving Netflix in May 2026 Following Move to Prime Video Last chance to catch the first two seasons before they become an Prime Video exclusive. Picture Credit: NASCAR Studios, Words + Pictures Sports documentaries have been a major staple for Netflix, but one of its high-octane additions is officially hitting the brakes on the service. Both… [+2844 chars]",https://www.whats-on-netflix.com/leaving-soon/full-speed-leaving-netflix/,2026-04-08T19:49:08+00:00,What's on Netflix,Kasey Moore,https://www.whats-on-netflix.com/wp-content/uploads/2026/04/full-speed-leaving-netflix-as-it-completes-transition-to-prime-video.webp
Intel and SambaNova team up on heterogenous AI inference platform — different hardware performs different workloads,"Intel and SambaNova announce heterogeneous inference platform that can take advantage of Intel Xeon 6 CPUs, SambaNova SN50 RDUs, and Nvidia GPUs.","Intel and SambaNova on Wednesday announced their joint production-ready heterogeneous inference architecture that relies on AI accelerators or GPUs for prefill, SambaNova reconfigurable dataflow unit… [+3019 chars]","Intel and SambaNova team up on heterogenous AI inference platform — different hardware performs different workloads Intel and SambaNova announce heterogeneous inference platform that can take advantage of Intel Xeon 6 CPUs, SambaNova SN50 RDUs, and Nvidia GPUs. Intel and SambaNova on Wednesday announced their joint production-ready heterogeneous inference architecture that relies on AI accelerators or GPUs for prefill, SambaNova reconfigurable dataflow unit… [+3019 chars]",https://www.tomshardware.com/tech-industry/artificial-intelligence/intel-and-sambanova-team-up-on-heterogenous-ai-inference-platform-different-hardware-performs-different-workloads,2026-04-08T19:45:25+00:00,Tom's Hardware UK,"ashilov@gmail.com (Anton Shilov) , Anton Shilov",https://cdn.mos.cms.futurecdn.net/uA6Ne4z4gSbp9nZArMDYK8-1920-80.jpg
"You probably weren’t planning to buy a laptop today, but this MacBook deal is hard to pass up",This large of a discount is not easy to come by,"Discover startups, services, products and more from our partner StackCommerce. New York Post edits this content, and may be compensated and/or receive an affiliate commission if you buy through our l… [+1597 chars]","You probably weren’t planning to buy a laptop today, but this MacBook deal is hard to pass up This large of a discount is not easy to come by Discover startups, services, products and more from our partner StackCommerce. New York Post edits this content, and may be compensated and/or receive an affiliate commission if you buy through our l… [+1597 chars]",https://nypost.com/2026/04/08/shopping/you-probably-werent-planning-to-buy-a-laptop-today-but-this-macbook-deal-is-hard-to-pass-up/,2026-04-08T19:28:50+00:00,New York Post,StackCommerce,https://nypost.com/wp-content/uploads/sites/2/2026/04/macbook.jpg?quality=75&strip=all&w=1200
"Little Snitch, the macOS network tool, is now available on Linux","A Linux version of Little Snitch, the iconic network monitoring and firewall tool for macOS, has been released. Little Snitch for Linux is written in Rust and uses eBPF for kernel-level traffic interception (which lets sandboxed code run inside the Linux kern…","A Linux version of Little Snitch, the iconic network monitoring and firewall tool for macOS, has been released.
Little Snitch for Linux is written in Rust and uses eBPF for kernel-level traffic inte… [+2764 chars]","Little Snitch, the macOS network tool, is now available on Linux A Linux version of Little Snitch, the iconic network monitoring and firewall tool for macOS, has been released. Little Snitch for Linux is written in Rust and uses eBPF for kernel-level traffic interception (which lets sandboxed code run inside the Linux kern… A Linux version of Little Snitch, the iconic network monitoring and firewall tool for macOS, has been released. Little Snitch for Linux is written in Rust and uses eBPF for kernel-level traffic inte… [+2764 chars]",https://www.omgubuntu.co.uk/2026/04/little-snitch-linux,2026-04-08T18:59:16+00:00,Omgubuntu.co.uk,Joey Sneddon,https://www.omgubuntu.co.uk/wp-content/uploads/2026/04/littlesnitch-linux-dark-840x603.webp
"PCI Express roadmap: The path to 1TB/s with PCI 8.0, the challenges of integration, and beyond","We take a deep-dive into the past, present, and future of the ubiquitous PCIe standard, and look ahead at the challenges that await manufacturers when integrating PCIe 6.0 and beyond into real-world hardware.","PCI Express (PCIe) is a foundational technology that's been around for decades, and that's not going to change anytime soon. The standard is set to change and evolve over the coming years, and the te… [+11329 chars]","PCI Express roadmap: The path to 1TB/s with PCI 8.0, the challenges of integration, and beyond We take a deep-dive into the past, present, and future of the ubiquitous PCIe standard, and look ahead at the challenges that await manufacturers when integrating PCIe 6.0 and beyond into real-world hardware. PCI Express (PCIe) is a foundational technology that's been around for decades, and that's not going to change anytime soon. The standard is set to change and evolve over the coming years, and the te… [+11329 chars]",https://www.tomshardware.com/pc-components/motherboards/pci-express-roadmap-the-path-to-1tb-s-with-pci-8-0-the-challenges-of-integration-and-beyond,2026-04-08T17:58:57+00:00,Tom's Hardware UK,"ashilov@gmail.com (Anton Shilov) , Anton Shilov",https://cdn.mos.cms.futurecdn.net/o9pBPTTVY3oLhG624ECr8Q-1920-80.jpg
Solidigm targets the AI bottleneck with advanced storage tech and ecosystem partnerships,"The far-reaching impact of the artificial intelligence revolution has spilled over into many parts of the stack, where memory bottlenecks can slow AI inferencing and other key tasks. As SiliconANGLE’s analysts have noted in recent weeks, the “memory supercycl…","The far-reaching impact of the artificial intelligence revolution has spilled over into many parts of the stack, where memory bottlenecks can slow AI inferencing and other key tasks. As SiliconANGLEs… [+10756 chars]","Solidigm targets the AI bottleneck with advanced storage tech and ecosystem partnerships The far-reaching impact of the artificial intelligence revolution has spilled over into many parts of the stack, where memory bottlenecks can slow AI inferencing and other key tasks. As SiliconANGLE’s analysts have noted in recent weeks, the “memory supercycl… The far-reaching impact of the artificial intelligence revolution has spilled over into many parts of the stack, where memory bottlenecks can slow AI inferencing and other key tasks. As SiliconANGLEs… [+10756 chars]",https://siliconangle.com/2026/04/08/solidigm-vast-data-storage-industry-ai-tech-vastforward/,2026-04-08T17:56:24+00:00,SiliconANGLE News,Mark Albertson,https://d15shllkswkct0.cloudfront.net/wp-content/blogs.dir/1/files/2026/04/Clearing-the-path-for-AI.png
How Costco Won in Japan,"Costco had to re-think its real estate, merchandising and warehouse design to succeed in Japan, which is now its largest market outside of North America.","Thanks for subscribing to SatPost. 
Today, we are talking about how Costco solved retail in Japan, its second largest market outside of North America.
Also this week:
<ul><li>KPop Demon Hunter Is … [+37079 chars]","How Costco Won in Japan Costco had to re-think its real estate, merchandising and warehouse design to succeed in Japan, which is now its largest market outside of North America. Thanks for subscribing to SatPost. Today, we are talking about how Costco solved retail in Japan, its second largest market outside of North America. Also this week: KPop Demon Hunter Is … [+37079 chars]",https://www.readtrung.com/p/how-costco-won-in-japan,2026-04-08T17:38:14+00:00,Readtrung.com,Trungphan2,"https://substackcdn.com/image/fetch/$s_!gej1!,w_1200,h_675,c_fill,f_jpg,q_auto:good,fl_progressive:steep,g_auto/https%3A%2F%2Fsubstack-post-media.s3.amazonaws.com%2Fpublic%2Fimages%2F4436c032-6ff1-48fa-87ea-087191d2513f_1324x862.png"
"Lynx Launches MOSA.ic.AI for Deterministic AI in Safety-Critical Systems, Addressing a $25B Market by 2030","New platform closes the AI Deployment Gap by delivering certifiable AI execution across heterogeneous CPU and GPU architectures, reducing certification complexity and risk New platform closes the AI Deployment Gap by delivering certifiable AI execution across…","SAN JOSE, Calif., April 08, 2026 (GLOBE NEWSWIRE) -- Lynx,
 a leader in safe and secure software platforms for mission-critical edge systems, today announced the general availability of LYNX MOSA.ic… [+7967 chars]","Lynx Launches MOSA.ic.AI for Deterministic AI in Safety-Critical Systems, Addressing a $25B Market by 2030 New platform closes the AI Deployment Gap by delivering certifiable AI execution across heterogeneous CPU and GPU architectures, reducing certification complexity and risk New platform closes the AI Deployment Gap by delivering certifiable AI execution across… SAN JOSE, Calif., April 08, 2026 (GLOBE NEWSWIRE) -- Lynx, a leader in safe and secure software platforms for mission-critical edge systems, today announced the general availability of LYNX MOSA.ic… [+7967 chars]",https://www.globenewswire.com/news-release/2026/04/08/3270407/0/en/Lynx-Launches-MOSA-ic-AI-for-Deterministic-AI-in-Safety-Critical-Systems-Addressing-a-25B-Market-by-2030.html,2026-04-08T16:26:00+00:00,GlobeNewswire,Lynx Software Technologies Inc.,https://ml.globenewswire.com/Resource/Download/e9008b8d-31d0-4ae4-b9a7-80bdee588c13
"The new, AI-powered Google Finance is expanding to more than 100 countries.",Google Finance brings AI tools to 100+ countries. Use AI to research stocks and follow live earnings in your preferred language.,"Starting today, the new, AI-powered Google Finance is going global. Over the coming weeks, were rolling out the experience to 100+ countries including Australia, Brazil, Canada, Indonesia, Japan, Mex… [+900 chars]","The new, AI-powered Google Finance is expanding to more than 100 countries. Google Finance brings AI tools to 100+ countries. Use AI to research stocks and follow live earnings in your preferred language. Starting today, the new, AI-powered Google Finance is going global. Over the coming weeks, were rolling out the experience to 100+ countries including Australia, Brazil, Canada, Indonesia, Japan, Mex… [+900 chars]",https://blog.google/products-and-platforms/products/search/google-finance-expansion/,2026-04-08T15:00:00+00:00,Blog.google,,https://storage.googleapis.com/gweb-uniblog-publish-prod/images/finance_marketing_landscape.max-1440x810.png
Intel joins Musk’s Terafab as foundry partner in $25B chip megaproject,"In short: Intel has signed on as the primary foundry partner for Elon Musk’s Terafab, a $25 billion joint venture between Tesla, SpaceX, and xAI targeting a terawatt of AI compute per year, handing the struggling chip giant the marquee customer it has been se…","In short: Intel has signed on as the primary foundry partner for Elon Musks Terafab, a $25 billion joint venture between Tesla, SpaceX, and xAI targeting a terawatt of AI compute per year, handing th… [+9451 chars]","Intel joins Musk’s Terafab as foundry partner in $25B chip megaproject In short: Intel has signed on as the primary foundry partner for Elon Musk’s Terafab, a $25 billion joint venture between Tesla, SpaceX, and xAI targeting a terawatt of AI compute per year, handing the struggling chip giant the marquee customer it has been se… In short: Intel has signed on as the primary foundry partner for Elon Musks Terafab, a $25 billion joint venture between Tesla, SpaceX, and xAI targeting a terawatt of AI compute per year, handing th… [+9451 chars]",https://thenextweb.com/news/intel-terafab-elon-musk-foundry-partnership/,2026-04-08T14:59:04+00:00,The Next Web,Alina Maria Stan,https://cdn0.tnwcdn.com/wp-content/blogs.dir/1/files/2026/04/intel-terafab-elon-musk-foundry-partnership.png
"""Raptor Lake will continue to be abundantly available"": Intel exec makes a case for its older chips as RAM prices soar, but are they actually worth buying in 2026?","Intel's aging Raptor Lake desktop CPUs are ""not going anywhere,"" according to an Intel exec, as RAM prices soar and PC gamers search for DDR4 alternatives. Are these chips worth buying in 2026? Let's explore.","Perhaps unsurprisingly, due to the state of the PC gaming hardware market, Intel has clarified that it doesn't have plans to retire production of its 13th and 14th Gen Core processors.
In an intervi… [+3320 chars]","""Raptor Lake will continue to be abundantly available"": Intel exec makes a case for its older chips as RAM prices soar, but are they actually worth buying in 2026? Intel's aging Raptor Lake desktop CPUs are ""not going anywhere,"" according to an Intel exec, as RAM prices soar and PC gamers search for DDR4 alternatives. Are these chips worth buying in 2026? Let's explore. Perhaps unsurprisingly, due to the state of the PC gaming hardware market, Intel has clarified that it doesn't have plans to retire production of its 13th and 14th Gen Core processors. In an intervi… [+3320 chars]",https://www.windowscentral.com/hardware/intel/intel-raptor-lake-ddr4-cpu-benefits-pc-gaming,2026-04-08T14:51:06+00:00,Windows Central,"c.cale.hunt@gmail.com (Cale Hunt) , Cale Hunt",https://cdn.mos.cms.futurecdn.net/MqpiK7fwgQ9ohFHvKZeEUH-1256-80.jpg
Electronic Design Automation (EDA) Market Size to Hit $42.85 Billion by 2035 | Research by SNS Insider,"Electronic Design Automation Market Size, Share, Revenue Trends & Segment, by Product, Deployment Mode, Application, End User, and Region | Forecast 2035...","Austin, April 08, 2026 (GLOBE NEWSWIRE) -- Electronic Design Automation (EDA) Market Size &amp; Growth Insights:
According to the SNS Insider,The Electronic Design Automation (EDA) Market Size was v… [+6965 chars]","Electronic Design Automation (EDA) Market Size to Hit $42.85 Billion by 2035 | Research by SNS Insider Electronic Design Automation Market Size, Share, Revenue Trends & Segment, by Product, Deployment Mode, Application, End User, and Region | Forecast 2035... Austin, April 08, 2026 (GLOBE NEWSWIRE) -- Electronic Design Automation (EDA) Market Size Growth Insights: According to the SNS Insider,The Electronic Design Automation (EDA) Market Size was v… [+6965 chars]",https://www.globenewswire.com/news-release/2026/04/08/3270311/0/en/Electronic-Design-Automation-EDA-Market-Size-to-Hit-42-85-Billion-by-2035-Research-by-SNS-Insider.html,2026-04-08T14:30:00+00:00,GlobeNewswire,SNS Insider pvt ltd,https://ml.globenewswire.com/Resource/Download/d6272c2e-d204-41b8-b545-a6e2e24f85c2
M5 MacBook Air drops to record low $949 on Amazon,"Apple's sleek and powerful 2026 M5 MacBook Air has barely been out for a month, but it's already seeing impressive discounts…
The post M5 MacBook Air drops to record low $949 on Amazon appeared first on MacDailyNews.","Apple’s MacBook Neo in Citrus
Apple’s sleek and powerful 2026 M5 MacBook Air has barely been out for a month, but it’s already seeing impressive discounts. Today, Amazon has slashed prices on multip… [+2583 chars]","M5 MacBook Air drops to record low $949 on Amazon Apple's sleek and powerful 2026 M5 MacBook Air has barely been out for a month, but it's already seeing impressive discounts… The post M5 MacBook Air drops to record low $949 on Amazon appeared first on MacDailyNews. Apple’s MacBook Neo in Citrus Apple’s sleek and powerful 2026 M5 MacBook Air has barely been out for a month, but it’s already seeing impressive discounts. Today, Amazon has slashed prices on multip… [+2583 chars]",https://macdailynews.com/2026/04/08/m5-macbook-air-drops-to-record-low-949-on-amazon/,2026-04-08T14:19:46+00:00,Macdailynews.com,MacDailyNews,https://macdailynews.com/wp-content/uploads/2026/03/260304_macbook_neo_citrus.png
